id,conversation_id,created_at,date,time,timezone,user_id,username,name,place,tweet,language,mentions,urls,photos,replies_count,retweets_count,likes_count,hashtags,cashtags,link,retweet,quote_url,video,thumbnail,near,geo,source,user_rt_id,user_rt,retweet_id,reply_to,retweet_date,translate,trans_src,trans_dest
1358156504982032388,1358156504982032388,2021-02-06 20:51:58 UTC,2021-02-06,20:51:58,+0000,17126462,pnikolov,Plamen V Nikolov 🌐,,"If you teach #economics or know someone who teaches economics, this @NPR's @planetmoney website is a great resource to help you use Planet Money in the classroom:   https://t.co/l580U0JKNC  Hopefully, it will expand to include even more micro issues! #EconTwitter  #AcademicTwitter  https://t.co/i4fM3phl14",en,"[{'screen_name': 'npr', 'name': 'npr', 'id': '5392522'}, {'screen_name': 'planetmoney', 'name': ""npr's planet money"", 'id': '15905103'}]",['https://planetmoney.listenwise.com'],['https://pbs.twimg.com/media/Etkj04TXYAM6VGA.png'],0,2,3,"['economics', 'econtwitter', 'academictwitter']",[],https://twitter.com/pnikolov/status/1358156504982032388,False,,1,https://pbs.twimg.com/media/Etkj04TXYAM6VGA.png,,,,,,,[],,,,
1358147345440010240,1358147345440010240,2021-02-06 20:15:34 UTC,2021-02-06,20:15:34,+0000,55840043,sam_a_bell,Sam🔔,,first nice day in a while but #econtwitter is too good today... keep it going folks  https://t.co/a1RdRhImdd,en,[],[],"['https://pbs.twimg.com/media/EtkbwVRXEAIeoTh.jpg', 'https://pbs.twimg.com/media/EtkbxQ7XAAI7bvA.jpg']",0,3,27,['econtwitter'],[],https://twitter.com/sam_a_bell/status/1358147345440010240,False,,1,https://pbs.twimg.com/media/EtkbwVRXEAIeoTh.jpg,,,,,,,[],,,,
1358146115699433473,1358146115699433473,2021-02-06 20:10:41 UTC,2021-02-06,20:10:41,+0000,97097480,yilmazkuday,HAKAN YILMAZKUDAY,,Publications in Economics After 2020  #EconTwitter #economics #economy #Econometrics #econjobmarket #AcademicTwitter #AcademicChatter #research #ResearchPaper #researchers #Economia #international #tradetwitter #Finance #development #publishing  https://t.co/ILad6GlXN9,en,[],[],[],0,2,4,"['econtwitter', 'economics', 'economy', 'econometrics', 'econjobmarket', 'academictwitter', 'academicchatter', 'research', 'researchpaper', 'researchers', 'economia', 'international', 'tradetwitter', 'finance', 'development', 'publishing']",[],https://twitter.com/yilmazkuday/status/1358146115699433473,False,,1,https://pbs.twimg.com/ext_tw_video_thumb/1358145085205012483/pu/img/qSgv66S91VWjjk06.jpg,,,,,,,[],,,,
1358134248054657024,1358134248054657024,2021-02-06 19:23:32 UTC,2021-02-06,19:23:32,+0000,865004396681207809,ne0liberal,Neoliberal 🌐,,"In the #EconTwitter system, the people are represented by two separate, yet equally important, groups: the inflation doves, who investigate the hawks; and FOMC twitter, who prosecute the offenders. These are their stories.",en,[],[],[],3,9,87,['econtwitter'],[],https://twitter.com/ne0liberal/status/1358134248054657024,False,,0,,,,,,,,[],,,,
1358130729956356098,1358130729956356098,2021-02-06 19:09:33 UTC,2021-02-06,19:09:33,+0000,369593887,alessia_metrics,Alessia Paccagnini 👩‍🏫📚💶📈💻🍕⚽🐱🐶🎥 🎶🌍,,📢Have you ever taught #Introductory #Econometrics? I am collecting data for a #TeachingAndLearning course.  Here a #Survey 👇   https://t.co/TvGTJiC1Ps  Thanks for your help!👩‍🎓  #WomenWhoCode #AcademicTwitter #Teaching #University #PhDLife #EconTwitter  https://t.co/l986aPJ64q,en,[],['https://docs.google.com/forms/d/e/1FAIpQLSfl9Oq4l3EptYHAhBvPITzQxuHA2DXxtxzyiPMC8YYxSMWZGA/viewform?usp=sf_link'],['https://pbs.twimg.com/media/EtkLx25XMAYelVA.png'],2,15,16,"['introductory', 'econometrics', 'teachingandlearning', 'survey', 'womenwhocode', 'academictwitter', 'teaching', 'university', 'phdlife', 'econtwitter']",[],https://twitter.com/Alessia_metrics/status/1358130729956356098,False,,1,https://pbs.twimg.com/media/EtkLx25XMAYelVA.png,,,,,,,[],,,,
1358129799865241602,1358129799865241602,2021-02-06 19:05:51 UTC,2021-02-06,19:05:51,+0000,452383701,swazonomics,Zach Swaziek,,This *gestures broadly at the current #EconTwitter discussions* is why I want to study macro in grad school.,en,[],[],[],0,2,6,['econtwitter'],[],https://twitter.com/Swazonomics/status/1358129799865241602,False,,0,,,,,,,,[],,,,
1358124012958851072,1358057910388023296,2021-02-06 18:42:52 UTC,2021-02-06,18:42:52,+0000,92107986,sabinedoering,Sabine Döring,,"@larsweisbrod @schnellenbachj Hat ein Index-Spezi von Euch (#EconTwitter) schon mal geprüft, wie hemmungslos wir mit diesen Index-Zahlen um uns werfen dürfen? Haben die es drauf? (Kann das ja nicht in letzter Instanz beurteilen). 🤓",de,[],[],[],2,1,2,['econtwitter'],[],https://twitter.com/sabinedoering/status/1358124012958851072,False,,0,,,,,,,,"[{'screen_name': 'larsweisbrod', 'name': 'Lars Weisbrod', 'id': '16189050'}]",,,,
1358121850908405769,1358121850908405769,2021-02-06 18:34:16 UTC,2021-02-06,18:34:16,+0000,885710908013424644,prof_nishith_p,Nishith Prakash,,Thank you @EdmondsEric &amp; @NinaPavcnik for the “WBER Excellence in Refereeing Award” 2020! @UConnResearch @UConnCLAS @hriuconn @wapppHKS #EconTwitter  https://t.co/r2ovrpIbK3,en,"[{'screen_name': 'edmondseric', 'name': 'eric edmonds', 'id': '418163893'}, {'screen_name': 'ninapavcnik', 'name': 'nina pavcnik', 'id': '774046093629874176'}, {'screen_name': 'uconnresearch', 'name': 'uconn research', 'id': '735204346661593088'}, {'screen_name': 'uconnclas', 'name': 'uconn clas', 'id': '155696177'}, {'screen_name': 'hriuconn', 'name': 'hri @ uconn', 'id': '847484979986653186'}, {'screen_name': 'wappphks', 'name': 'women and public policy program', 'id': '317784968'}]",[],['https://pbs.twimg.com/media/EtkEn_FWYAIXBux.jpg'],2,2,38,['econtwitter'],[],https://twitter.com/Prof_Nishith_P/status/1358121850908405769,False,,1,https://pbs.twimg.com/media/EtkEn_FWYAIXBux.jpg,,,,,,,[],,,,
1358118748385775617,1358118748385775617,2021-02-06 18:21:56 UTC,2021-02-06,18:21:56,+0000,19856974,jennifermharris,Jennifer Harris,,#EconTwitter please tell everyone else what you’ve known for a good while now. 👇🏼👇🏼👇🏼👇🏼,en,[],[],[],0,5,13,['econtwitter'],[],https://twitter.com/jennifermharris/status/1358118748385775617,False,https://twitter.com/GregAFish/status/1356298854115631105,0,,,,,,,,[],,,,
1358117020445851648,1358117020445851648,2021-02-06 18:15:04 UTC,2021-02-06,18:15:04,+0000,362645475,markfny,Mark Rossano,,Starting at min 16 we do a deep dive on global work from home and some dynamics that we expect to remain/change after #COVID19. #OOTT #EFT #Econtwitter #economy #WFH #vaccine #lockdown #wfhlife #energy #fintwit #internet #5G #jobs #remoteworking #oildemand  https://t.co/CY8xCHJGnI,en,[],['https://www.youtube.com/watch?v=Sttc-8R5-0k'],[],1,2,8,"['covid19', 'oott', 'eft', 'econtwitter', 'economy', 'wfh', 'vaccine', 'lockdown', 'wfhlife', 'energy', 'fintwit', 'internet', '5g', 'jobs', 'remoteworking', 'oildemand']",[],https://twitter.com/markfny/status/1358117020445851648,False,,0,,,,,,,,[],,,,
1358111167491760133,1358111167491760133,2021-02-06 17:51:49 UTC,2021-02-06,17:51:49,+0000,896067767056699392,pengpeng_xiao,Pengpeng Xiao,,#EconTwitter Is anyone going to Honolulu in person for the WEA annual conference this year? Can we just agree that the conference location should remain Honolulu every year until we can actually go there!  https://t.co/agPb0BLoaP,en,[],[],['https://pbs.twimg.com/tweet_video_thumb/Etj650JXMAEoPM8.jpg'],1,2,23,['econtwitter'],[],https://twitter.com/pengpeng_xiao/status/1358111167491760133,False,,1,https://pbs.twimg.com/tweet_video_thumb/Etj650JXMAEoPM8.jpg,,,,,,,[],,,,
1358110358804647936,1358110358804647936,2021-02-06 17:48:36 UTC,2021-02-06,17:48:36,+0000,502008757,akbarpour_,Mohammad Akbarpour,,"#econtwitter question: school X makes an exploding 7 day offer to candidate A. School Y, that A likes much more, is making a decision in 10 days. X knows this &amp; doesn’t extend the deadline. What should A do?",en,[],[],[],31,9,114,['econtwitter'],[],https://twitter.com/akbarpour_/status/1358110358804647936,False,,0,,,,,,,,[],,,,
1358108948772052993,1358108948772052993,2021-02-06 17:43:00 UTC,2021-02-06,17:43:00,+0000,765591257355849730,healthecon_cu,Health Economics at Cornell,,"Join us Monday Feb 8 at 10:30 am ET when Ben Harrell @elben of @GeorgiaStateU @aysps presents ""Public Health Insurance and Prescription Medications for Sexually Transmitted Illnesses."" Register for link at  https://t.co/vrsTe8uJg7  #EconTwitter  https://t.co/PDC1P9EwIb",en,"[{'screen_name': 'elben', 'name': 'ben harrell🏳️\u200d🌈 🌐➕🧦=❤️', 'id': '14759765'}, {'screen_name': 'georgiastateu', 'name': 'georgia state university', 'id': '26524127'}, {'screen_name': 'aysps', 'name': 'andrew young school', 'id': '166622963'}]",['http://VERBseminar.org'],['https://pbs.twimg.com/media/Etj3NUrXIAE3Qmn.jpg'],0,10,18,['econtwitter'],[],https://twitter.com/HealthEcon_CU/status/1358108948772052993,False,,1,https://pbs.twimg.com/media/Etj3NUrXIAE3Qmn.jpg,,,,,,,[],,,,
1358088805945921536,1358088805945921536,2021-02-06 16:22:58 UTC,2021-02-06,16:22:58,+0000,1348850574670913544,hotnewtrend,Super Intelligence,,"Recruiting people to your team is not a one time thing.  It’s a lifestyle.   Always be on the lookout.  Even if you don’t own a business,  Always try to recruit great people into your circle.  #business #MarketingTwitter #EconTwitter #startup #AcademicTwitter #AcademicChatter",en,[],[],[],1,4,4,"['business', 'marketingtwitter', 'econtwitter', 'startup', 'academictwitter', 'academicchatter']",[],https://twitter.com/hotnewtrend/status/1358088805945921536,False,,0,,,,,,,,[],,,,
1358085013565296644,1358085013565296644,2021-02-06 16:07:53 UTC,2021-02-06,16:07:53,+0000,1278050480002928641,fig_box,figbox.,,quick reminder everyone... published academic reviewers in over 30 different research areas willing to review your working manuscript. its free!  start here:  https://t.co/ifqScMWlvs   get published!  #EconTwitter #AcademicTwitter #AcademicChatter #ScienceTwitter #phdchat #phdlife  https://t.co/HEVdsJDGmH,en,[],['http://www.figbox.co'],[],0,2,2,"['econtwitter', 'academictwitter', 'academicchatter', 'sciencetwitter', 'phdchat', 'phdlife']",[],https://twitter.com/fig_box/status/1358085013565296644,False,,1,https://pbs.twimg.com/ext_tw_video_thumb/1358084266974969857/pu/img/qaxnvaXmFyliYz7p.jpg,,,,,,,[],,,,
1358083335172489217,1358083335172489217,2021-02-06 16:01:13 UTC,2021-02-06,16:01:13,+0000,299877538,garencheckley,Garen Checkley,,@planetmoney plz explain India farmer protests from the #EconTwitter POV! Economists aren’t getting coverage!,en,[],[],[],1,1,2,['econtwitter'],[],https://twitter.com/garencheckley/status/1358083335172489217,False,,0,,,,,,,,[],,,,
1358080143936356353,1358080143936356353,2021-02-06 15:48:32 UTC,2021-02-06,15:48:32,+0000,1348850574670913544,hotnewtrend,Super Intelligence,,Seeing a lot of yellow backgrounds for peoples profile pics.  I actually think it looks great.   Yellow is an often underutilized color so I’m happy to see it get some love.  #business #MarketingTwitter #EconTwitter #startup #AcademicTwitter #AcademicChatter,en,[],[],[],0,4,4,"['business', 'marketingtwitter', 'econtwitter', 'startup', 'academictwitter', 'academicchatter']",[],https://twitter.com/hotnewtrend/status/1358080143936356353,False,,0,,,,,,,,[],,,,
1358079582243610630,1358079582243610630,2021-02-06 15:46:18 UTC,2021-02-06,15:46:18,+0000,330597630,vincentgeloso,Vincent (Economic History) Geloso,,"Poll for economists #econtwitter : what is your preferred definition of transaction costs -- (I have to use certain abbreviations as follows: M= market, E=enforcing, D=Defining, P=Property, R=Relative, IE=Internal Exchange, EE=External Exchange)",en,[],[],[],4,3,2,['econtwitter'],[],https://twitter.com/VincentGeloso/status/1358079582243610630,False,,0,,,,,,,,[],,,,
1358078878837657600,1358078878837657600,2021-02-06 15:43:31 UTC,2021-02-06,15:43:31,+0000,14941540,abhishekn,Abhishek Nagaraj 🗺️,,"Ok, so where are all the economists on @joinClubhouse at? #EconTwitter  https://t.co/xBXRUuFkwV",en,"[{'screen_name': 'joinclubhouse', 'name': 'clubhouse', 'id': '1242240513811480576'}]",[],['https://pbs.twimg.com/media/EtjdiurU0AA5maQ.jpg'],7,2,10,['econtwitter'],[],https://twitter.com/abhishekn/status/1358078878837657600,False,,1,https://pbs.twimg.com/media/EtjdiurU0AA5maQ.jpg,,,,,,,[],,,,
1358060205507043329,1358060205507043329,2021-02-06 14:29:19 UTC,2021-02-06,14:29:19,+0000,1351314996727316482,regscurbec,Regional Science and Urban Economics,,"New in #RSUE: ""On rational forward-looking behavior in economic geography: An experimental analysis""  https://t.co/Cdi5V8XfVk #UrbanEcon #EconTwitter",en,[],['https://ift.tt/3oXklFH'],[],0,1,6,"['rsue', 'urbanecon', 'econtwitter']",[],https://twitter.com/RegScUrbEc/status/1358060205507043329,False,,0,,,,,,,,[],,,,
1358057360011513856,1358057360011513856,2021-02-06 14:18:00 UTC,2021-02-06,14:18:00,+0000,60693203,brookingsecon,Brookings Econ,,"Job opening: Help @BrookingsEcon research reach press, policymakers, and the public! Now hiring Senior Media Relations and Outreach Coordinator - apply at  https://t.co/3kbsCCuJQM #EconTwitter",en,"[{'screen_name': 'brookingsecon', 'name': 'brookings econ', 'id': '60693203'}]",['https://social.icims.com/viewjob/pt1611867105800aad47'],[],1,3,2,['econtwitter'],[],https://twitter.com/BrookingsEcon/status/1358057360011513856,False,,0,,,,,,,,[],,,,
1358044245681188871,1358044245681188871,2021-02-06 13:25:54 UTC,2021-02-06,13:25:54,+0000,1145686112,drlisadcook,Dr. Lisa D. Cook,,"Colleagues throughout the economics profession, whether you are designing/running pre-doc programs or not, @jeannasmialek’s article is required reading. #EconTwitter",en,"[{'screen_name': 'jeannasmialek', 'name': 'jeanna smialek', 'id': '258157507'}]",[],[],1,5,34,['econtwitter'],[],https://twitter.com/drlisadcook/status/1358044245681188871,False,https://twitter.com/moriahlmacklin/status/1357792026729848832,0,,,,,,,,[],,,,
1358032187866628099,1358032187866628099,2021-02-06 12:37:59 UTC,2021-02-06,12:37:59,+0000,1348850574670913544,hotnewtrend,Super Intelligence,,Look forward to finishing those tasks you have started recently.  You have stuck with them so far (against the odds perhaps)  Now - keep going.  You can do it.   #business #MarketingTwitter #EconTwitter #startup #AcademicTwitter #AcademicChatter,en,[],[],[],0,4,2,"['business', 'marketingtwitter', 'econtwitter', 'startup', 'academictwitter', 'academicchatter']",[],https://twitter.com/hotnewtrend/status/1358032187866628099,False,,0,,,,,,,,[],,,,
1358031822236639232,1358031822236639232,2021-02-06 12:36:32 UTC,2021-02-06,12:36:32,+0000,531071556,trevondlogan,Dr. Trevon D Logan,,I think the employment/pop ratio would need to rise considerably before we'd have to worry about inflation. I can't see how the stimulus would have short-run inflationary impact given the unemployment and LF participation situation. #EconTwitter What am I missing here?,en,[],[],[],2,5,70,['econtwitter'],[],https://twitter.com/TrevonDLogan/status/1358031822236639232,False,,0,,,,,,,,[],,,,
1358031492631379968,1358031492631379968,2021-02-06 12:35:13 UTC,2021-02-06,12:35:13,+0000,16905041,gsohn,gsohn,,Das Lebenswerk von #ReinhardPfriem #EconTwitter #Economics  https://t.co/GqDCNtET0p,de,[],[],['https://pbs.twimg.com/media/EtiycMnWYAEv49U.jpg'],0,3,4,"['reinhardpfriem', 'econtwitter', 'economics']",[],https://twitter.com/gsohn/status/1358031492631379968,False,,1,https://pbs.twimg.com/media/EtiycMnWYAEv49U.jpg,,,,,,,[],,,,
1358026961122131970,1358026961122131970,2021-02-06 12:17:13 UTC,2021-02-06,12:17:13,+0000,1348850574670913544,hotnewtrend,Super Intelligence,,"If you wanted to learn a new task this month or year,  Make sure you finish what you start.  You deserve to be feeling finished and accomplished.  Please retweet for awareness   #business #MarketingTwitter #EconTwitter #startup #AcademicTwitter #AcademicChatter",en,[],[],[],0,3,2,"['business', 'marketingtwitter', 'econtwitter', 'startup', 'academictwitter', 'academicchatter']",[],https://twitter.com/hotnewtrend/status/1358026961122131970,False,,0,,,,,,,,[],,,,
1358013769251717120,1357891575360196609,2021-02-06 11:24:47 UTC,2021-02-06,11:24:47,+0000,2819741495,jd_grom,J.D. Grom 🇺🇸,,@Austan_Goolsbee @jasonfurman @NewDemCoalition Help us make this happen!  And work with us on the branding...  I’m told automatic stabilizers doesn’t resonate as well as check$  #EconTwitter,en,[],[],[],0,1,2,['econtwitter'],[],https://twitter.com/JD_Grom/status/1358013769251717120,False,,0,,,,,,,,"[{'screen_name': 'Austan_Goolsbee', 'name': 'Austan Goolsbee', 'id': '217284148'}, {'screen_name': 'jasonfurman', 'name': 'Jason Furman', 'id': '279036722'}, {'screen_name': 'NewDemCoalition', 'name': 'New Dem Coalition', 'id': '761783018'}]",,,,
1357980668228030464,1357980668228030464,2021-02-06 09:13:16 UTC,2021-02-06,09:13:16,+0000,1177348071803555843,empressbeauty8,AshleyShante,,I know this may sound crazy but I'm not willing to work a job that doesn't pay me at least  $1000.00  a week.... rent prices are up...and most companies require your salary to be 3 times the rent to move in  #costofliving #EconTwitter #BlackTwitter #jobseekers  #Job,en,[],[],[],0,4,6,"['costofliving', 'econtwitter', 'blacktwitter', 'jobseekers', 'job']",[],https://twitter.com/EmpressBeauty8/status/1357980668228030464,False,,0,,,,,,,,[],,,,
1357971065616683009,1357728286571454466,2021-02-06 08:35:06 UTC,2021-02-06,08:35:06,+0000,3318643690,schreyerforscht,Dominik Schreyer,,"@BasSchnater @SDEurope07 Thanks, Bas! Having analyzed data from 6,481 matches played in 23 leagues/17 countries in 2019-20, we don't observe such an effect. #EconTwitter  We find large and statistically significant effects on the number of yellow cards issued by referees, though.   https://t.co/Pj1UtJZ3nU",en,[],['https://doi.org/10.1016/j.econlet.2020.109664'],[],0,1,5,['econtwitter'],[],https://twitter.com/schreyerforscht/status/1357971065616683009,False,,0,,,,,,,,"[{'screen_name': 'BasSchnater', 'name': 'Bas Schnater 🗣💬 = ⚽️&📊', 'id': '402966333'}, {'screen_name': 'SDEurope07', 'name': 'SD Europe', 'id': '3428256033'}]",,,,
1357967733204344837,1357957197758562307,2021-02-06 08:21:52 UTC,2021-02-06,08:21:52,+0000,2791738481,pncmohr,Peter N.C. Mohr,,"@schnellenbachj 50 Mio Dosen = 25 Mio Geimpfte? Nicht die optimale Versicherungslösung, die auf #Econtwitter seit Wochen diskutiert wird. Vll. ist EU ja diesmal zwar langsamer, bestellt aber genug. Man kann es nur hoffen...",de,[],[],[],1,1,3,['econtwitter'],[],https://twitter.com/PNCMohr/status/1357967733204344837,False,,0,,,,,,,,"[{'screen_name': 'schnellenbachj', 'name': 'Jan Schnellenbach', 'id': '829677473042485249'}]",,,,
1357962233985323008,1357962233985323008,2021-02-06 08:00:00 UTC,2021-02-06,08:00:00,+0000,3318643690,schreyerforscht,Dominik Schreyer,,"In case you missed it: We have just published a new manuscript on whether there is a first-mover advantage in penalty-shootouts! #EconTwitter  Spoiler: No, we find no such advantage per se!   https://t.co/eFkukgCqtM",en,[],['https://www.sciencedirect.com/science/article/pii/S0899825621000117?dgcid=coauthor'],[],0,5,13,['econtwitter'],[],https://twitter.com/schreyerforscht/status/1357962233985323008,False,,0,,,,,,,,[],,,,
1357956191578644480,1357956191578644480,2021-02-06 07:36:00 UTC,2021-02-06,07:36:00,+0000,3365390812,juliabuntingpc,Julia Bunting,,Check out @Pop_Council’s Population &amp; Development Review #PDRjournal for a new collection of essays on #COVID19 &amp; the Global #Demographic #Research Agenda. #PopTwitter #EpiTwitter #EconTwitter @IUSSP @UNFPA @PopAssocAmerica @aphrc @Afidep @PRBdata @PSG_LSHTM @OxfordDemSci,en,"[{'screen_name': 'pop_council', 'name': 'population council', 'id': '44138534'}, {'screen_name': 'iussp', 'name': 'iussp', 'id': '217353107'}, {'screen_name': 'unfpa', 'name': 'unfpa', 'id': '194643654'}, {'screen_name': 'popassocamerica', 'name': 'paa', 'id': '2836918220'}, {'screen_name': 'aphrc', 'name': 'aphrc', 'id': '102018028'}, {'screen_name': 'afidep', 'name': 'afidep', 'id': '715575655'}, {'screen_name': 'prbdata', 'name': 'prb', 'id': '330539177'}, {'screen_name': 'psg_lshtm', 'name': 'psg lshtm', 'id': '847789794470105088'}, {'screen_name': 'oxforddemsci', 'name': 'leverhulme centre for demographic science', 'id': '1110146189196955648'}]",[],[],0,8,18,"['pdrjournal', 'covid19', 'demographic', 'research', 'poptwitter', 'epitwitter', 'econtwitter']",[],https://twitter.com/JuliaBuntingPC/status/1357956191578644480,False,https://twitter.com/Pop_Council/status/1357718233374216199,0,,,,,,,,[],,,,
1357946746349961216,1357946746349961216,2021-02-06 06:58:28 UTC,2021-02-06,06:58:28,+0000,55332191,markgsheppard,Mark G. Sheppard,,I think I speak for all aspiring academics on #EconTwitter when I say this: there are very few things as wholesome than when a professor follows you or likes your posts.,en,[],[],[],1,5,65,['econtwitter'],[],https://twitter.com/markgsheppard/status/1357946746349961216,False,,0,,,,,,,,[],,,,
1357924012924407808,1357924012924407808,2021-02-06 05:28:08 UTC,2021-02-06,05:28:08,+0000,1079296134781165569,manjaribalu12,Manjari - மஞ்சரி,,"While the govt credits improved export performance, there needs a review if this is a sustainable strategy. I write on the same for South Asian Monitor  #economics #EconTwitter #trade #export #AatmanirbharBharat  https://t.co/hTxSR3mq6x",en,[],['https://southasiamonitor.org/spotlight/contribute-global-value-chain-india-needs-move-beyond-self-reliance-label#.YB4nUMbaBu0.whatsapp'],[],0,1,3,"['economics', 'econtwitter', 'trade', 'export', 'aatmanirbharbharat']",[],https://twitter.com/manjaribalu12/status/1357924012924407808,False,,0,,,,,,,,[],,,,
1357913554267951104,1357913554267951104,2021-02-06 04:46:34 UTC,2021-02-06,04:46:34,+0000,63073975,madversity,Madhavan Narayanan,,"Sad to hear of the passing of Prof S.K. Goyal, socialist economist who used to be close to former PM Chandra Shekhar.  My recollection is of a passionate man with a sense of detail on industrial economics beyond simplistic macros. Learnt on cooperatives from him. RIP #EconTwitter",en,[],[],[],3,1,15,['econtwitter'],[],https://twitter.com/madversity/status/1357913554267951104,False,,0,,,,,,,,[],,,,
1357907146650775553,1357907146650775553,2021-02-06 04:21:07 UTC,2021-02-06,04:21:07,+0000,3175539157,sanat_ecoholics,Sanat Shrivastava,,The central tenet here is that #capitalism is built on accumulated #profits which in turn are expropriated by living #labour. This is also known famously as the #value #price transformation #problem  #economy #economics #economist #EconTwitter  #trending #EconomicSurvey,en,[],[],[],0,3,7,"['capitalism', 'profits', 'labour', 'value', 'price', 'problem', 'economy', 'economics', 'economist', 'econtwitter', 'trending', 'economicsurvey']",[],https://twitter.com/sanat_ecoholics/status/1357907146650775553,False,,0,,,,,,,,[],,,,
1357905388708970496,1357905388708970496,2021-02-06 04:14:07 UTC,2021-02-06,04:14:07,+0000,1675147274,vanceginn,Vance Ginn,,"There’s a myth that govt can “invest” hidden in big govt arguments.  Govt can’t invest because it’s spending someone else’s $.  The govt can redistribute $ to many things to attempt public benefits, but no investment.  Only the private sector invests. #economy #EconTwitter",en,[],[],[],0,2,2,"['economy', 'econtwitter']",[],https://twitter.com/VanceGinn/status/1357905388708970496,False,https://twitter.com/lhsummers/status/1357902935699636232,0,,,,,,,,[],,,,
1357898484301627394,1357898484301627394,2021-02-06 03:46:41 UTC,2021-02-06,03:46:41,+0000,228033525,yesimorhun,Yesim Orhun,,This is a really good read.  #EconTwitter,en,[],[],[],0,1,2,['econtwitter'],[],https://twitter.com/yesimorhun/status/1357898484301627394,False,https://twitter.com/MPFSmith/status/1357695929327968263,0,,,,,,,,[],,,,
1357896165275148288,1357896165275148288,2021-02-06 03:37:28 UTC,2021-02-06,03:37:28,+0000,231052203,abhishek_mahesh,Abhishek Maheshwari,,Online Math lecture notes for #Econ #phd programs..  #EconTwitter #Econometrics,en,[],[],[],0,1,2,"['econ', 'phd', 'econtwitter', 'econometrics']",[],https://twitter.com/abhishek_mahesh/status/1357896165275148288,False,https://twitter.com/raogautam/status/1357876464780124161,0,,,,,,,,[],,,,
1357882694093463554,1357882694093463554,2021-02-06 02:43:57 UTC,2021-02-06,02:43:57,+0000,362645475,markfny,Mark Rossano,,"The Primary Vision Frac Spread show covers current completion activity, what to expect over the next several weeks, and an update on some econ data points and oil/product storage and flows. #OOTT #EFT #energy #fintwit #econtwitter #economy #Jobs #China  https://t.co/GEkvEJ0ba5",en,[],['https://www.youtube.com/watch?v=QOJdUSt19jg'],[],0,2,4,"['oott', 'eft', 'energy', 'fintwit', 'econtwitter', 'economy', 'jobs', 'china']",[],https://twitter.com/markfny/status/1357882694093463554,False,,0,,,,,,,,[],,,,
1357878455078170625,1357778740504387590,2021-02-06 02:27:06 UTC,2021-02-06,02:27:06,+0000,885710908013424644,prof_nishith_p,Nishith Prakash,,@FrankSchilbach @ElizaForsythe So so useful!!! #EconTwitter,en,[],[],[],0,1,2,['econtwitter'],[],https://twitter.com/Prof_Nishith_P/status/1357878455078170625,False,,0,,,,,,,,"[{'screen_name': 'FrankSchilbach', 'name': 'Frank Schilbach', 'id': '1052320778'}, {'screen_name': 'ElizaForsythe', 'name': 'Eliza Forsythe', 'id': '388891015'}]",,,,
