id,conversation_id,created_at,date,time,timezone,user_id,username,name,place,tweet,language,mentions,urls,photos,replies_count,retweets_count,likes_count,hashtags,cashtags,link,retweet,quote_url,video,thumbnail,near,geo,source,user_rt_id,user_rt,retweet_id,reply_to,retweet_date,translate,trans_src,trans_dest
1353095072569565184,1353095072569565184,2021-01-23 21:39:39 UTC,2021-01-23,21:39:39,+0000,865711238189338625,marietmora,Marie Mora,,"Excited to be a panelist in the upcoming Immigration &amp; Entrepreneurship @KauffmanFDN Forum (virtual), Jan 28th. Details &amp; registration link in @sameedesai ‘s tweet below.  #Entrepreneurship #SmallBusiness #ImmigrantEntrepreneurs @LBANstrong @ASHE_ASSA @umslecon #EconTwitter",en,"[{'screen_name': 'kauffmanfdn', 'name': 'kauffman foundation', 'id': '27015055'}, {'screen_name': 'sameedesai', 'name': 'sameeksha desai', 'id': '3596110814'}, {'screen_name': 'lbanstrong', 'name': 'lban', 'id': '3242713873'}, {'screen_name': 'ashe_assa', 'name': 'american society of hispanic economists', 'id': '957804404719149056'}, {'screen_name': 'umslecon', 'name': 'umsl|economics', 'id': '3062855516'}]",[],[],0,8,21,"['entrepreneurship', 'smallbusiness', 'immigrantentrepreneurs', 'econtwitter']",[],https://twitter.com/Marietmora/status/1353095072569565184,False,https://twitter.com/sameedesai/status/1353029865986002945,0,,,,,,,,[],,,,
1353090932007165955,1353090932007165955,2021-01-23 21:23:12 UTC,2021-01-23,21:23:12,+0000,39523376,mikemakowsky,Mike Makowsky,,"#Econtwitter is in round 12 (of N) about the costs and benefits of the minimum wage, not to mention the underlying morality of even acknowledging its salience to your own hiring decisions. My research w/ @AmandaYAgan has recently entered the conversation 1/n",en,"[{'screen_name': 'amandayagan', 'name': 'amanda agan', 'id': '106539273'}]",[],[],1,3,6,['econtwitter'],[],https://twitter.com/mikemakowsky/status/1353090932007165955,False,https://twitter.com/benzipperer/status/1353016544855523330,0,,,,,,,,[],,,,
1353067152333361157,1353067152333361157,2021-01-23 19:48:42 UTC,2021-01-23,19:48:42,+0000,391925716,foley_kelly,kelly erin foley,,".@CLEForum has just announced a prize for Best Young-Researcher Paper Award, to be awarded to a recent graduate from a Canadian university or a Canadian graduating from elsewhere. #cdnecon #Econtwitter Details can be found on the website:  https://t.co/LvbtDxMAeX",en,"[{'screen_name': 'cleforum', 'name': 'clef - fcet', 'id': '4218852478'}]",['https://clef.uwaterloo.ca/wp-content/uploads/2021/01/Canadian-Labour-Economics-Prize-2021.pdf'],[],0,8,8,"['cdnecon', 'econtwitter']",[],https://twitter.com/foley_kelly/status/1353067152333361157,False,,0,,,,,,,,[],,,,
1353063308643823616,1353063308643823616,2021-01-23 19:33:26 UTC,2021-01-23,19:33:26,+0000,543552239,vinpons,Vincent Pons,,"#EconTwitter, which book would you recommend on #international trade and finance? Level: 2nd year MBA students",en,[],[],[],3,4,13,"['econtwitter', 'international']",[],https://twitter.com/VinPons/status/1353063308643823616,False,,0,,,,,,,,[],,,,
1353058540726800386,1353058540726800386,2021-01-23 19:14:29 UTC,2021-01-23,19:14:29,+0000,453020414,maxmagnacca,Maximilian Magnacca Sancho,,"Just a fascinating WP from BdE with an @barcelonagse professor to explore levels of economic policy uncertainty affects social polarisation &amp; eco growth by tracking words in media. The paper has a bit of everything: history, data, economics. #EconTwitter   https://t.co/thTp0pYd0A",en,"[{'screen_name': 'barcelonagse', 'name': 'barcelona graduate school of economics', 'id': '39478650'}]",['https://www.bde.es/f/webbde/SES/Secciones/Publicaciones/PublicacionesSeriadas/DocumentosTrabajo/21/Files/dt2102e.pdf'],[],0,2,3,['econtwitter'],[],https://twitter.com/MaxMagnacca/status/1353058540726800386,False,,0,,,,,,,,[],,,,
1353051013465436161,1353051013465436161,2021-01-23 18:44:34 UTC,2021-01-23,18:44:34,+0000,2981738470,economicethics,SeTh,,"Wer sich an der marxistischen Sichtweise nicht stört, findet in ""Thilo Sarrazin oder die Biologisierung des Sozialen"" von Bafta Sarbo ein paar lesenswerte Gedanken zum Thema Rassismus &amp; Wirtschaftsenken.⬇️👉 https://t.co/oj1pVm7W8H  cc  #EconTwitter @JaninaUrban @econ4future_DE",de,"[{'screen_name': 'janinaurban', 'name': 'janina urban', 'id': '397910504'}, {'screen_name': 'econ4future_de', 'name': 'economists for future de', 'id': '1279052333230456835'}]",['https://www.neues-deutschland.de/artikel/1147111.thilo-sarrazin-oder-die-biologisierung-des-sozialen.html'],[],0,1,4,['econtwitter'],[],https://twitter.com/EconomicEthics/status/1353051013465436161,False,,0,,,,,,,,[],,,,
1353042501515567104,1353042501515567104,2021-01-23 18:10:45 UTC,2021-01-23,18:10:45,+0000,422357561,kymberlyhelle,k. michelle,,"Please help me out @ #EconTwitter, I just started my MS in econ. Should I complete a thesis or do the data analytics track ?? All opinions appreciated",en,[],[],[],1,1,2,['econtwitter'],[],https://twitter.com/kymberlyhelle/status/1353042501515567104,False,,0,,,,,,,,[],,,,
1353042182618439680,1353042182618439680,2021-01-23 18:09:29 UTC,2021-01-23,18:09:29,+0000,886998317695213570,lucasmitcnichtk,Lucas mit C,,"Brauche mal Input von der mir bekannten #EconTwitter-Bubble:  Kennt Ihr gute (verständliche) Texte/ Paper/ etc., die MMT kritisch beleuchten? :) @BachmannRudi  @schnellenbachj  @ArashMV @PHuenermund  @christianbaye13 @SDullien @APeichl",de,"[{'screen_name': 'bachmannrudi', 'name': 'rudi bachmann', 'id': '905524795252625408'}, {'screen_name': 'schnellenbachj', 'name': 'jan schnellenbach', 'id': '829677473042485249'}, {'screen_name': 'arashmv', 'name': 'arash molavi vasséi', 'id': '1196467294056128512'}, {'screen_name': 'phuenermund', 'name': 'paul hünermund', 'id': '705390315'}, {'screen_name': 'christianbaye13', 'name': 'christian bayer', 'id': '3837709792'}, {'screen_name': 'sdullien', 'name': 'sebastian dullien', 'id': '499717174'}, {'screen_name': 'apeichl', 'name': 'andreas peichl', 'id': '3130999965'}]",[],[],5,2,5,['econtwitter'],[],https://twitter.com/LucasMitCnichtK/status/1353042182618439680,False,,0,,,,,,,,[],,,,
1353035717232963584,1353035717232963584,2021-01-23 17:43:47 UTC,2021-01-23,17:43:47,+0000,285097736,stehsatz,Jenni Thier 🤯,,Für die #EconTwitter-Bubble: ein Janet Yellen Rap!  „It only took a couple centuries The first female secretary of the treasury  BRIDGE  Don’t want no tax evasion  Forgers faking  In her treasury Trying for higher wages For the nation Less disparity“   https://t.co/yeXsik6rT3,en,[],['https://www.marketplace.org/2021/01/21/yellen-hamilton-musical-biden-dessa/'],[],0,1,2,['econtwitter'],[],https://twitter.com/stehsatz/status/1353035717232963584,False,,0,,,,,,,,[],,,,
1353035155900952578,1353035155900952578,2021-01-23 17:41:34 UTC,2021-01-23,17:41:34,+0000,1219339372962766855,tmsrgr,Thomas Rieger,,"To all those on #EconTwitter holding on to their copies of Mankiw and Varian like fundamentalists to the bible: it‘s called paradigmatic, not paradogmatic (I’m kind of guilty too — just for pun)",en,[],[],[],0,1,4,['econtwitter'],[],https://twitter.com/tmsrgr/status/1353035155900952578,False,,0,,,,,,,,[],,,,
1353032824811450368,1353032824811450368,2021-01-23 17:32:18 UTC,2021-01-23,17:32:18,+0000,735672194894692355,zabrinacamp,Zabrina✨🧡,,#MutualAid #HelpFolksLive2021 #mutualfunds #MutualAidRequest #EconTwitter #crowdfund #cashappinbio #finance #fintech #cryptocurrency #investing PLEASE HELP JUST SIMPLE RETWEET MIGHT BE BIG HELP 🙏,en,[],[],[],0,9,6,"['mutualaid', 'helpfolkslive2021', 'mutualfunds', 'mutualaidrequest', 'econtwitter', 'crowdfund', 'cashappinbio', 'finance', 'fintech', 'cryptocurrency', 'investing']",[],https://twitter.com/ZabrinaCamp/status/1353032824811450368,False,https://twitter.com/zabrinacamp/status/1350118157239783424,0,,,,,,,,[],,,,
1353031633948073984,1353031628961050633,2021-01-23 17:27:34 UTC,2021-01-23,17:27:34,+0000,1548484621,pluralecon,Plurale Ökonomik,,"What hits us harder still, is the aggressive tone we were met with by some discutants in the debate that followed. We're glad about content-related discussions with #EconTwitter. That's what we're here for. But we want to engage in these criticisms in a respectful way. (4/5)",en,[],[],[],2,1,15,['econtwitter'],[],https://twitter.com/PluralEcon/status/1353031633948073984,False,,0,,,,,,,,[],,,,
1353031628961050633,1353031628961050633,2021-01-23 17:27:33 UTC,2021-01-23,17:27:33,+0000,1548484621,pluralecon,Plurale Ökonomik,,"Dear #EconTwitter,  We need to talk about HOW discussions are led. As promised, we evaluated the speaker times of the last event of @ForumNewEconomy.   These unequal results are only one indication of what needs to be considered for a balanced debate. (1/5)",en,"[{'screen_name': 'forumneweconomy', 'name': 'forum new economy', 'id': '1186246646109298688'}]",[],[],2,8,35,['econtwitter'],[],https://twitter.com/PluralEcon/status/1353031628961050633,False,,0,,,,,,,,[],,,,
1353029779356864513,1353029779356864513,2021-01-23 17:20:12 UTC,2021-01-23,17:20:12,+0000,1050927630122389506,francisco_yira,Francisco Yirá 💻📈🇨🇱,,Idea: a reading club on Slack/Discord for econometrics/causal inference papers #EconTwitter #statstwitter,en,[],[],[],0,2,2,"['econtwitter', 'statstwitter']",[],https://twitter.com/francisco_yira/status/1353029779356864513,False,,0,,,,,,,,[],,,,
1353029071186362371,1353029071186362371,2021-01-23 17:17:23 UTC,2021-01-23,17:17:23,+0000,4155155777,bjthorsen,BoJellesmarkThorsen,,"#Cooperatives are succesful in the Danish #food industry. In a new paper our colleague @PeterBogetoft show that one reason may be they are prefered partners for downstream business, e.g. retail.  #EconTwitter @danishcrown @ArlaDanmark @spisekammeret   https://t.co/AINi5D6Wyv",en,"[{'screen_name': 'peterbogetoft', 'name': 'peter bogetoft', 'id': '583764070'}, {'screen_name': 'danishcrown', 'name': 'danish crown', 'id': '39985239'}, {'screen_name': 'arladanmark', 'name': 'arla danmark', 'id': '35806386'}, {'screen_name': 'spisekammeret', 'name': 'landbrug & fødevarer', 'id': '2323965297'}]",['https://doi.org/10.1016/j.jebo.2020.11.036'],[],0,3,3,"['cooperatives', 'food', 'econtwitter']",[],https://twitter.com/BJThorsen/status/1353029071186362371,False,,0,,,,,,,,[],,,,
1353017612607709184,1353017612607709184,2021-01-23 16:31:51 UTC,2021-01-23,16:31:51,+0000,1184334528837574656,basedosdados,Base dos Dados,,"Segundo workshop BD sobre aplicações em R entrando ao vivo em 30 minutos, às 14h. Cheguem mais!  #rviz #econtwitter #r #bdmais   https://t.co/8nOQSblQC0",pt,[],['https://youtu.be/5_Ir8neyFf4'],[],2,7,51,"['rviz', 'econtwitter', 'r', 'bdmais']",[],https://twitter.com/basedosdados/status/1353017612607709184,False,,0,,,,,,,,[],,,,
1353007852135223298,1353007852135223298,2021-01-23 15:53:04 UTC,2021-01-23,15:53:04,+0000,830370630,teevrat,Teevrat Garg,,"#EconTwitter - a friend of mine wants to teach IV basics to their non-Econ undergrads. Anyone have a slide deck they are willing to share? Applications to environmental problems would be particularly helpful. Thank you 🙏🏾 (and yes, actually asking for a friend).",en,[],[],[],2,3,3,['econtwitter'],[],https://twitter.com/teevrat/status/1353007852135223298,False,,0,,,,,,,,[],,,,
1352993594559356929,1352993594559356929,2021-01-23 14:56:25 UTC,2021-01-23,14:56:25,+0000,52525784,emmarackstraw,Emma Rackstraw,,#EconTwitter what's the best visual explanation of OLS you've seen for a general audience? Could be a short video or an interactive graphic of some kind. (Context: I am teaching MPPs for the first time and would love to draw on some existing resources to provide them intuition),en,[],[],[],13,7,54,['econtwitter'],[],https://twitter.com/emmarackstraw/status/1352993594559356929,False,,0,,,,,,,,[],,,,
1352987494048960513,1352987494048960513,2021-01-23 14:32:10 UTC,2021-01-23,14:32:10,+0000,1341008872207618048,empiricalindia,Empirical India Papers,,"Women's inheritance rights reform and the preference for sons in India  Sonia Bhalotra (@SoniaBhalotra), Rachel Brulé (@BruleRachel), Sanchari Roy(@sancharirm)  #EconTwitter #WomensRights #india #gender #womenempowerment    https://t.co/Ct1hUUYj7H",en,"[{'screen_name': 'soniabhalotra', 'name': 'sonia bhalotra', 'id': '1052153398223626241'}, {'screen_name': 'brulerachel', 'name': 'rachel e. brule', 'id': '1164236458917392384'}, {'screen_name': 'sancharirm', 'name': 'sanchari roy', 'id': '1813024538'}]",['https://www.sciencedirect.com/science/article/abs/pii/S0304387818300294'],[],0,1,4,"['econtwitter', 'womensrights', 'india', 'gender', 'womenempowerment']",[],https://twitter.com/EmpiricalIndia/status/1352987494048960513,False,,0,,,,,,,,[],,,,
1352987004728913923,1352987004728913923,2021-01-23 14:30:13 UTC,2021-01-23,14:30:13,+0000,248601019,econunikent,School of Economics,,Our new BSc Economics with Data Science. A fantastic opportunity to train as an economist and develop big data skills.   Accepting applications for Sept 2021 entry.    https://t.co/kCJ50TCN6f  #bigdata #datascience #AI #programming #econtwitter  https://t.co/ehYbXdQXQp,en,[],['http://ow.ly/Trri50DeCtz'],['https://pbs.twimg.com/media/EsbGgrWXAAEa3G4.jpg'],0,6,4,"['bigdata', 'datascience', 'ai', 'programming', 'econtwitter']",[],https://twitter.com/EconUniKent/status/1352987004728913923,False,,1,https://pbs.twimg.com/media/EsbGgrWXAAEa3G4.jpg,,,,,,,[],,,,
1352985729786384384,1352985729786384384,2021-01-23 14:25:09 UTC,2021-01-23,14:25:09,+0000,2905737766,annagoeddeke,Anna Goeddeke,,Externe Effekte ist doch ein Lieblingsthema von #EconTwitter .😉  Ich hab nie in meinem Leben geraucht aber 23€ pro Päckchen. Das ist ne Hausnummer!  https://t.co/new5LtvQid,de,[],[],['https://pbs.twimg.com/media/EsbFWYNXMAAu9vJ.jpg'],3,2,16,['econtwitter'],[],https://twitter.com/AnnaGoeddeke/status/1352985729786384384,False,,1,https://pbs.twimg.com/media/EsbFWYNXMAAu9vJ.jpg,,,,,,,[],,,,
1352976102050963456,1352975674475163652,2021-01-23 13:46:54 UTC,2021-01-23,13:46:54,+0000,1047276656673665029,bronxadjacent,Scott Dennis🌐,,@AuroraCordeira This should be the cover image for all #economics texts in the future. #EconTwitter,en,[],[],[],0,1,2,"['economics', 'econtwitter']",[],https://twitter.com/BronxAdjacent/status/1352976102050963456,False,,0,,,,,,,,"[{'screen_name': 'AuroraCordeira', 'name': 'Aurora Cordeira', 'id': '1272539357153501185'}]",,,,
1352972077087789057,1352972077087789057,2021-01-23 13:30:54 UTC,2021-01-23,13:30:54,+0000,964370209841717249,rosholmmichael,Michael Rosholm,,"1/12 New paper, open access. See title &amp; full list of co-authors in link:  https://t.co/n5PqEXktXp  #econtwitter #dkøko #dkpol  @boerneforskning @trygfonden @AarhusUni @Aarhus_BSS @alexandergpaul @57Justice @SimonCalmar @MichaelSvarer  https://t.co/vlOQNMaGqH",en,"[{'screen_name': 'boerneforskning', 'name': 'trygfondens børneforskningscenter', 'id': '956107870352936960'}, {'screen_name': 'trygfonden', 'name': 'trygfonden', 'id': '26853888'}, {'screen_name': 'aarhusuni', 'name': 'aarhus universitet', 'id': '224283051'}, {'screen_name': 'aarhus_bss', 'name': 'aarhus bss', 'id': '3407768932'}, {'screen_name': 'alexandergpaul', 'name': 'alexander paul', 'id': '49391547'}, {'screen_name': '57justice', 'name': 'laura justice, phd', 'id': '3012425883'}, {'screen_name': 'simoncalmar', 'name': 'simon calmar anderse', 'id': '1562599818'}, {'screen_name': 'michaelsvarer', 'name': 'michael svarer', 'id': '802062916279238656'}]",['https://onlinelibrary.wiley.com/doi/epdf/10.1111/joes.12400'],['https://pbs.twimg.com/media/Esa2gyFXUAUC8uI.png'],3,12,22,"['econtwitter', 'dkøko', 'dkpol']",[],https://twitter.com/RosholmMichael/status/1352972077087789057,False,,1,https://pbs.twimg.com/media/Esa2gyFXUAUC8uI.png,,,,,,,[],,,,
1352960642437820418,1352960642437820418,2021-01-23 12:45:28 UTC,2021-01-23,12:45:28,+0000,824288526695071745,hasheconomy,#Economy,,"Has @cenbank actively helped to control the adverse effect of COVID-19 on the economy?  P.S. If you are not sure about this, check our previous tweets that reported CBN activities regards this topic, it will help for this poll.   #polls #COVID19 #Covid_19 #EconTwitter   @cenbank",en,"[{'screen_name': 'cenbank', 'name': 'central bank of nigeria', 'id': '16182044'}, {'screen_name': 'cenbank', 'name': 'central bank of nigeria', 'id': '16182044'}]",[],[],0,9,8,"['polls', 'covid19', 'covid_19', 'econtwitter']",[],https://twitter.com/HashEconomy/status/1352960642437820418,False,,0,,,,,,,,[],,,,
1352958732024614912,1352958732024614912,2021-01-23 12:37:53 UTC,2021-01-23,12:37:53,+0000,1188831667932336128,mariapiamendola,mariapia mendola,,A few days left! Graduate students don't miss the opportunity to attend this amazing course in Macro Development! Deadline to register January 31  #EconTwitter,en,[],[],[],0,2,2,['econtwitter'],[],https://twitter.com/MariapiaMendola/status/1352958732024614912,False,https://twitter.com/Guenther_ETH/status/1352728323512741888,0,,,,,,,,[],,,,
1352939861515317250,1352939861515317250,2021-01-23 11:22:54 UTC,2021-01-23,11:22:54,+0000,1063868385803608064,bdzovb,BDZOVBremen,,#Übersterblichkeit im 5-Jahres-Vergleich #Coronavirusde #COVID19DE #Flattentheccurve #Maskeauf im Dezember 2020 etwa 30 % Höher als Durchschnitt #econtwitter #zerocovid #harterlockdown #öd #dbb #BDZ #Bremen #Berlin #Hamburg #Bayern #Sachsen #tbb #bbb #nbb  https://t.co/30yzcsg5v2  https://t.co/2hUhzBQkFl,de,[],['http://zeit.de'],['https://pbs.twimg.com/media/EsabniTXcAAze31.png'],0,3,2,"['übersterblichkeit', 'coronavirusde', 'covid19de', 'flattentheccurve', 'maskeauf', 'econtwitter', 'zerocovid', 'harterlockdown', 'öd', 'dbb', 'bdz', 'bremen', 'berlin', 'hamburg', 'bayern', 'sachsen', 'tbb', 'bbb', 'nbb']",[],https://twitter.com/BdzovB/status/1352939861515317250,False,,1,https://pbs.twimg.com/media/EsabniTXcAAze31.png,,,,,,,[],,,,
1352932993057382401,1352932993057382401,2021-01-23 10:55:36 UTC,2021-01-23,10:55:36,+0000,1238120327017832449,bbe_berlin,Berlin Behavioral Economics,,"Gary Charness, Anna Dreber, and Severine Toussaert are willing to get your opinion on peer review process in economics to improve it and generate a common benefit.  You can check the 15-20 min survey and contribute through the following link:  https://t.co/N3FRq0pvHM #EconTwitter",en,[],['https://hhs.qualtrics.com/jfe/form/SV_87FKZS74eGhVOrr'],[],0,11,5,['econtwitter'],[],https://twitter.com/bbe_berlin/status/1352932993057382401,False,,0,,,,,,,,[],,,,
1352889038626320384,1352889019949060097,2021-01-23 08:00:56 UTC,2021-01-23,08:00:56,+0000,1153198855548260353,econtweetingbot,EconTweeting Bot,,"Using Google`s PageRank algorithm to determine the connectedness betweens #EconTwitter users by considering links through likes and replies, @BachmannRudi turns out to be of a high rank in yesterdays discussions.  https://t.co/GNKu3tB2t0",en,"[{'screen_name': 'bachmannrudi', 'name': 'rudi bachmann', 'id': '905524795252625408'}]",[],['https://pbs.twimg.com/media/EsZtaRYXAAAqcEP.png'],1,1,2,['econtwitter'],[],https://twitter.com/EconTweetingBot/status/1352889038626320384,False,,1,https://pbs.twimg.com/media/EsZtaRYXAAAqcEP.png,,,,,,,[],,,,
1352887141072826368,1352887141072826368,2021-01-23 07:53:24 UTC,2021-01-23,07:53:24,+0000,369593887,alessia_metrics,Alessia Paccagnini 👩‍🏫📚💶📈💻🍕⚽🐱🐶🎥 🎶🌍,,Almost ready to present my recent research about #Uncertainty and #BayesianMixedFrequency #VAR joint with .@parla_fabio at #ICEEEE2021 #ICEEE21 .@SIdE_IEA  #EconTwitter #Econometrics #AcademicTwitter #AcademicChatter #Macroeconomics  https://t.co/vDmLc1WRo9,en,"[{'screen_name': 'parla_fabio', 'name': 'fabio parla', 'id': '1279338442812542976'}, {'screen_name': 'side_iea', 'name': 'side', 'id': '1272827905035378689'}]",[],"['https://pbs.twimg.com/media/EsZrrsSXAAAB0Vp.jpg', 'https://pbs.twimg.com/media/EsZrr13XYAE0Z9O.jpg']",4,8,33,"['uncertainty', 'bayesianmixedfrequency', 'var', 'iceeee2021', 'iceee21', 'econtwitter', 'econometrics', 'academictwitter', 'academicchatter', 'macroeconomics']",[],https://twitter.com/Alessia_metrics/status/1352887141072826368,False,,1,https://pbs.twimg.com/media/EsZrrsSXAAAB0Vp.jpg,,,,,,,[],,,,
1352871157905543168,1352871157905543168,2021-01-23 06:49:53 UTC,2021-01-23,06:49:53,+0000,1341008872207618048,empiricalindia,Empirical India Papers,,"Bad Karma or Discrimination? Male–Female Wage Gaps Among Salaried Workers in India  Ashwini Deshpande (@AshwDeshpande), Deepti Goel, Shantanu Khanna  #EconTwitter #women #genderbias #discriminaton #genderinequality #GenderGap #EmpoweringWomen #employment   https://t.co/24TOvoRw0F",en,"[{'screen_name': 'ashwdeshpande', 'name': 'ashwini_deshpande', 'id': '1062187602420236289'}]",['https://www.sciencedirect.com/science/article/abs/pii/S0305750X16302352'],[],1,6,27,"['econtwitter', 'women', 'genderbias', 'discriminaton', 'genderinequality', 'gendergap', 'empoweringwomen', 'employment']",[],https://twitter.com/EmpiricalIndia/status/1352871157905543168,False,,0,,,,,,,,[],,,,
1352867425700638720,1352867425700638720,2021-01-23 06:35:04 UTC,2021-01-23,06:35:04,+0000,1063173499,prachi_shukla_,Prachi Shukla,,Great initiative by @prashansa_25 and @anahitark! Let's get info about applying to RAships and experiences of RAs in India out! #EconTwitter,en,"[{'screen_name': 'prashansa_25', 'name': 'prashansa srivastava', 'id': '947162428231389184'}, {'screen_name': 'anahitark', 'name': 'anahita karandikar', 'id': '3279700196'}]",[],[],2,4,8,['econtwitter'],[],https://twitter.com/Prachi_shukla_/status/1352867425700638720,False,https://twitter.com/prashansa_25/status/1352854754666438657,0,,,,,,,,[],,,,
1352863674415759365,1352863674415759365,2021-01-23 06:20:09 UTC,2021-01-23,06:20:09,+0000,974629193496473601,torshachakravo1,Torsha Chakravorty,,"Do take out ~10 mins to complete the following survey by @prashansa_25 and @anahitark on RA positions. Also consider signing up for @weconpol, an amazing, inclusive space for women interested in policy and econ! #EconTwitter",en,"[{'screen_name': 'prashansa_25', 'name': 'prashansa srivastava', 'id': '947162428231389184'}, {'screen_name': 'anahitark', 'name': 'anahita karandikar', 'id': '3279700196'}, {'screen_name': 'weconpol', 'name': 'women in econ/policy', 'id': '1281929017864548354'}]",[],[],2,5,12,['econtwitter'],[],https://twitter.com/TorshaChakravo1/status/1352863674415759365,False,https://twitter.com/prashansa_25/status/1352854754666438657,0,,,,,,,,[],,,,
1352858098315251712,1352857421325230082,2021-01-23 05:58:00 UTC,2021-01-23,05:58:00,+0000,1281929017864548354,weconpol,Women in Econ/Policy,,@JPAL_SA @IDinsight @IWWAGEIFMR @LEADatKrea @econ_ra  @GoodBusinessLab @asanishasharma @asercentre @kanmahajan @AditiBhowmick18  #EconTwitter,und,"[{'screen_name': 'idinsight', 'name': 'idinsight', 'id': '302616261'}, {'screen_name': 'iwwageifmr', 'name': 'iwwage', 'id': '1069519130103934976'}, {'screen_name': 'leadatkrea', 'name': 'lead at krea university', 'id': '31748570'}, {'screen_name': 'econ_ra', 'name': 'econ ra listings', 'id': '1042199173527941121'}, {'screen_name': 'goodbusinesslab', 'name': 'goodbusinesslab', 'id': '899522324516438016'}, {'screen_name': 'asanishasharma', 'name': 'anisha sharma', 'id': '134176592'}, {'screen_name': 'asercentre', 'name': 'aser centre', 'id': '2855189744'}, {'screen_name': 'kanmahajan', 'name': 'kanika mahajan', 'id': '368366112'}, {'screen_name': 'aditibhowmick18', 'name': 'aditi roy bhowmick', 'id': '846690508852277248'}]",[],[],0,1,2,['econtwitter'],[],https://twitter.com/weconpol/status/1352858098315251712,False,,0,,,,,,,,[],,,,
1352855326429687808,1352855326429687808,2021-01-23 05:46:59 UTC,2021-01-23,05:46:59,+0000,3795586874,allriseforbacon,Ritabrata Bose,,8 best Python Natural Language Processing (#NLP) libraries @_DomKo_    https://t.co/fkY73feQuT  #Python #Python3 #pythonprogramming #pythonlearning  #100DaysOfCode #100DaysOfMLCode #100DaysOfPython  #DataScience #EconTwitter #MachineLearning #AI   p.s.: my go-to choice: @spacy_io,en,"[{'screen_name': '_domko_', 'name': 'dominik kozaczko', 'id': '220634450'}, {'screen_name': 'spacy_io', 'name': 'spacy', 'id': '3422200198'}]",['https://bit.ly/3qLu6Iw'],[],0,92,31,"['nlp', 'python', 'python3', 'pythonprogramming', 'pythonlearning', '100daysofcode', '100daysofmlcode', '100daysofpython', 'datascience', 'econtwitter', 'machinelearning', 'ai']",[],https://twitter.com/AllRiseForBacon/status/1352855326429687808,False,,0,,,,,,,,[],,,,
1352849568921214977,1352849568921214977,2021-01-23 05:24:06 UTC,2021-01-23,05:24:06,+0000,2297878958,sascha_steffen,Sascha Steffen,,#EconTwitter Submit your papers to the The Fifteenth New York Fed / NYU Stern Conference on Financial Intermediation  https://t.co/jKP588HdhS,en,[],['https://www.ssrn.com/index.cfm/en/janda/announcement/?id=8222'],[],0,6,19,['econtwitter'],[],https://twitter.com/sascha_steffen/status/1352849568921214977,False,,0,,,,,,,,[],,,,
1352844055420432385,1352844055420432385,2021-01-23 05:02:12 UTC,2021-01-23,05:02:12,+0000,1175984438540288001,trogonomics,trogonomics,,How would Dr ⁦@JustinTrogdon⁩ advise ⁦@VP⁩ and ⁦@JoeBiden⁩ on economic policy for the first 100 days... and for the ling term? #economics #econtwitter   https://t.co/1aFtaHFUk2,en,"[{'screen_name': 'justintrogdon', 'name': 'justin trogdon', 'id': '2263295395'}, {'screen_name': 'vp', 'name': 'vice president kamala harris', 'id': '803694179079458816'}, {'screen_name': 'joebiden', 'name': 'joe biden', 'id': '939091'}]",['https://podcasts.apple.com/us/podcast/trogonomics/id1530771040?i=1000506253662'],[],0,1,3,"['economics', 'econtwitter']",[],https://twitter.com/trogonomics/status/1352844055420432385,False,,0,,,,,,,,[],,,,
