id,conversation_id,created_at,date,time,timezone,user_id,username,name,place,tweet,language,mentions,urls,photos,replies_count,retweets_count,likes_count,hashtags,cashtags,link,retweet,quote_url,video,thumbnail,near,geo,source,user_rt_id,user_rt,retweet_id,reply_to,retweet_date,translate,trans_src,trans_dest
1358835666180710403,1358835666180710403,2021-02-08 17:50:43 UTC,2021-02-08,17:50:43,+0000,1263209624146239490,lisawritesforum,Melissa❤,,You feel like you need help in your dissertation or thesis? HMU! I'll be excited to help you. #AcademicTwitter #phdchat #phdlife #phdfriend #academichatter #openacademics ##econtwitter,en,[],[],[],0,2,2,"['academictwitter', 'phdchat', 'phdlife', 'phdfriend', 'academichatter', 'openacademics', 'econtwitter']",[],https://twitter.com/lisawritesforum/status/1358835666180710403,False,,0,,,,,,,,[],,,,
1358829004560695296,1358829004560695296,2021-02-08 17:24:15 UTC,2021-02-08,17:24:15,+0000,372631354,aessaji,Azim Essaji,,"Wait, wait, I know the answer to this....  #cdnpoli #EconTwitter",en,[],[],[],0,0,4,"['cdnpoli', 'econtwitter']",[],https://twitter.com/AEssaji/status/1358829004560695296,False,https://twitter.com/mikalskuterud/status/1358823192647860227,0,,,,,,,,[],,,,
1358826576285102080,1358826576285102080,2021-02-08 17:14:36 UTC,2021-02-08,17:14:36,+0000,1215740329707503616,tmfparkev,Parkev Tatevosian,,#Gamestop and #AMC are extremely volatile. $AMC $GME $AMZN $NFLX $DIS $IWM $QQQ $XRT #Investment #stocks #StockMarket #EconTwitter #coronavirus #RobinhoodApp #investing #StocksToWatch #StocksToBuy #StocksToWatch #gamer #movie #SuperBowl    https://t.co/naQk85vTlb,en,[],['https://www.fool.com/investing/2021/02/08/forget-gamestop-and-amc-these-2-growth-stocks-will/'],[],0,2,5,"['gamestop', 'amc', 'investment', 'stocks', 'stockmarket', 'econtwitter', 'coronavirus', 'robinhoodapp', 'investing', 'stockstowatch', 'stockstobuy', 'stockstowatch', 'gamer', 'movie', 'superbowl']","['amc', 'gme', 'amzn', 'nflx', 'dis', 'iwm', 'qqq', 'xrt']",https://twitter.com/TMFParkev/status/1358826576285102080,False,,0,,,,,,,,[],,,,
1358825941196283905,1358825941196283905,2021-02-08 17:12:04 UTC,2021-02-08,17:12:04,+0000,1317522042107854848,nelson_bvsa,Nelson Sá,,"I am teaching Macroeconomic Theory remotely this semester and giving it a shot at creating memes to keep the sessions lively. So far, so good... #EconTwitter #TeachEcon  https://t.co/FsoxI0Fgg7",en,[],[],"['https://pbs.twimg.com/media/EtuE_SaWgAIjQ2o.jpg', 'https://pbs.twimg.com/media/EtuE_SZXMAMS2C6.jpg', 'https://pbs.twimg.com/media/EtuE_SWXcAw0d80.jpg', 'https://pbs.twimg.com/media/EtuE_SfXAAEfNpc.jpg']",0,2,6,"['econtwitter', 'teachecon']",[],https://twitter.com/nelson_bvsa/status/1358825941196283905,False,,1,https://pbs.twimg.com/media/EtuE_SaWgAIjQ2o.jpg,,,,,,,[],,,,
1358824310824173572,1358824310824173572,2021-02-08 17:05:36 UTC,2021-02-08,17:05:36,+0000,1068216159844077568,cmichaudleclerc,Catherine Michaud Leclerc,,We are looking for 2nd/3rd year PhD students in Econ of Education to help organize and lead the #GEEZseminars. Please reply here or DM me if interested! #EconTwitter #edutwitter @cjlwig @MeulenSimon @mobariz_ahmad,en,"[{'screen_name': 'cjlwig', 'name': 'cora wigger', 'id': '823205084'}, {'screen_name': 'meulensimon', 'name': 'simon ter meulen', 'id': '1021659990657048578'}, {'screen_name': 'mobariz_ahmad', 'name': 'ahmad shah mobariz', 'id': '749513655541170176'}]",[],[],4,39,68,"['geezseminars', 'econtwitter', 'edutwitter']",[],https://twitter.com/CMichaudLeclerc/status/1358824310824173572,False,,0,,,,,,,,[],,,,
1358821926370697218,1358821926370697218,2021-02-08 16:56:07 UTC,2021-02-08,16:56:07,+0000,17126462,pnikolov,Plamen V Nikolov 🌐,,Submissions are open for the 2021 Advances with Field Experiments conference:   https://t.co/W57OYYDVig  #AcademicTwitter #EconTwitter,en,[],['https://economics.uchicago.edu/content/afe-2021'],[],0,4,2,"['academictwitter', 'econtwitter']",[],https://twitter.com/pnikolov/status/1358821926370697218,False,https://twitter.com/RDMetcalfe/status/1358804580855812102,0,,,,,,,,[],,,,
1358820527268372483,1358820527268372483,2021-02-08 16:50:34 UTC,2021-02-08,16:50:34,+0000,266289538,giacrom,Giacomo Roma,,Nell’ultimo numero di Economia pubblica (@AngeliEdizioni) con @SauroMocetti facciamo il punto sulle società partecipate: forse abbiamo scoperto quante sono davvero e che il problema non è solo ridurle ma soprattutto migliorare la governance.  #EconTwitter   https://t.co/XYHrIBFdMu  https://t.co/QwIdMjDKX1,it,"[{'screen_name': 'angeliedizioni', 'name': 'francoangeli', 'id': '449678892'}, {'screen_name': 'sauromocetti', 'name': 'sauro mocetti', 'id': '1190214109184380930'}]",['https://www.francoangeli.it/Riviste/sommario.aspx?IDRivista=16&lingua=IT'],['https://pbs.twimg.com/media/EtuAEI7XYAIr6UB.jpg'],0,4,17,['econtwitter'],[],https://twitter.com/giacrom/status/1358820527268372483,False,,1,https://pbs.twimg.com/media/EtuAEI7XYAIr6UB.jpg,,,,,,,[],,,,
1358818968723685380,1358818968723685380,2021-02-08 16:44:22 UTC,2021-02-08,16:44:22,+0000,1017851537337577472,kaitmsims,Kait Sims,,"Friends of #EconTwitter -- what's your favorite (decently-to-well) published null results paper? Bonus points for null results in public health, health Econ, public policy, or general applied work. Thanks in advance!",en,[],[],[],13,9,40,['econtwitter'],[],https://twitter.com/kaitmsims/status/1358818968723685380,False,,0,,,,,,,,[],,,,
1358818271101878272,1358818271101878272,2021-02-08 16:41:36 UTC,2021-02-08,16:41:36,+0000,867914691783340032,eugen_dimant,Eugen Dimant,,"Interested in how affective polarization impacts social preferences (altruism, cooperation) &amp; if behavioral interventions (#nudging, #norms) can help to alleviate this rift?  If so: join tomorrow at @NuffieldCESS Oxford (sign-up👇🏻).  🧵Paper:  https://t.co/zMKRMfr5zo  #EconTwitter  https://t.co/6GWJlfUIdb",en,"[{'screen_name': 'nuffieldcess', 'name': 'nuffieldcess', 'id': '3063896002'}]",['https://twitter.com/eugen_dimant/status/1301979333591003138?s=21'],['https://pbs.twimg.com/media/Ett-A0eXIAQ3dv5.jpg'],0,5,7,"['nudging', 'norms', 'econtwitter']",[],https://twitter.com/eugen_dimant/status/1358818271101878272,False,https://twitter.com/nuffieldcess/status/1358758339979673602,1,https://pbs.twimg.com/media/Ett-A0eXIAQ3dv5.jpg,,,,,,,[],,,,
1358816386404012035,1358816386404012035,2021-02-08 16:34:06 UTC,2021-02-08,16:34:06,+0000,1025538004167864321,itsafronomics,Anna Gifty is on Instagram and young lol,,"If you like my tweets about #economics, policy, and the like, I want to take time this morning to introduce you to some emerging folx in the space, ranging from college students to new professors, that make up the next generation of #EconTwitter:   https://t.co/EzF1CkhUVN",en,[],['https://twitter.com/i/lists/1358262081573838848?s=20'],[],8,38,113,"['economics', 'econtwitter']",[],https://twitter.com/itsafronomics/status/1358816386404012035,False,,0,,,,,,,,[],,,,
1358816029913276422,1358816029913276422,2021-02-08 16:32:41 UTC,2021-02-08,16:32:41,+0000,3410804963,martinbraml,Martin Braml,,"Was meinen #EconTwitter und alle anderen zur Durchführung der #Corona-Maßnahmen?   Braucht man  einen verbindlichen „Fahrplan/Stufenplan“, der Maßnahmen bindend an epidemische Faktoren knüpft oder sollte man aufgrund epidemischer Unwägbarkeiten lieber „auf Sicht fahren“? 1/",de,[],[],[],5,5,9,"['econtwitter', 'corona']",[],https://twitter.com/MartinBraml/status/1358816029913276422,False,,0,,,,,,,,[],,,,
1358815836648185866,1358815836648185866,2021-02-08 16:31:55 UTC,2021-02-08,16:31:55,+0000,3248733388,catianicodemo,Catia Nicodemo,,"Finally, our group of health economists at @OxPrimaryCare  is on Twitter @NDPCHS_HE  #EconTwitter #Health #economics  @UniofOxford",en,"[{'screen_name': 'oxprimarycare', 'name': 'oxprimarycaresci', 'id': '856667810'}, {'screen_name': 'ndpchs_he', 'name': 'university of oxford primary care health economics', 'id': '1358791266679599112'}, {'screen_name': 'uniofoxford', 'name': 'university of oxford', 'id': '48289662'}]",[],[],0,5,16,"['econtwitter', 'health', 'economics']",[],https://twitter.com/CatiaNicodemo/status/1358815836648185866,False,,0,,,,,,,,[],,,,
1358812660574388226,1358812660574388226,2021-02-08 16:19:18 UTC,2021-02-08,16:19:18,+0000,1100859421,royaleconsoc,Royal Economic Society,,We are pleased to announce that bookings for the 2021 RES Annual Conference are now open. Find full information on our website:  https://t.co/5daLvbB0kH #EconTwitter #RES2021  https://t.co/tkvX0ClvMn,en,[],['https://res.org.uk/event-listing/2021-annual-conference.html'],['https://pbs.twimg.com/media/Ett45ToWQAMPqNL.jpg'],0,3,5,"['econtwitter', 'res2021']",[],https://twitter.com/RoyalEconSoc/status/1358812660574388226,False,,1,https://pbs.twimg.com/media/Ett45ToWQAMPqNL.jpg,,,,,,,[],,,,
1358807804761436161,1358807804761436161,2021-02-08 16:00:00 UTC,2021-02-08,16:00:00,+0000,2933767822,htkilic,Talip Kilic,,New paper out in EDE on the micro-level impacts of floods (2014/15) and drought conditions (2015/16) in Malawi: Large losses in crop production - mitigated to some extent thanks to legume intercropping and green belts.  https://t.co/4qz2Rcbya0 #EconTwitter,en,[],['http://bit.ly/droughtsandfloods'],[],0,0,2,['econtwitter'],[],https://twitter.com/htkilic/status/1358807804761436161,False,,0,,,,,,,,[],,,,
1358806995055173633,1358806995055173633,2021-02-08 15:56:47 UTC,2021-02-08,15:56:47,+0000,42264390,ahvillacis,Alexis H. Villacis,,Sharing a little pro tip regarding financial aid offers for all those newly admitted Ph.D. students [a thread]: (1/n) #AcademicChatter #AcademicTwitter #EconTwitter,en,[],[],[],1,2,4,"['academicchatter', 'academictwitter', 'econtwitter']",[],https://twitter.com/AHVillacis/status/1358806995055173633,False,,0,,,,,,,,[],,,,
1358804926890180616,1358804926890180616,2021-02-08 15:48:34 UTC,2021-02-08,15:48:34,+0000,28145010,clevelandfed,ClevelandFed,,"Can an econ class, degree, or career give you tools to make a difference? Yes! Join the 2021 Women in Economics event -  https://t.co/pIXByBs25r - for high school/college students and educators. #TeachEcon #EconTwitter  https://t.co/rzXnuRU9Or",en,[],['http://events.stlouisfed.org/d/87qfrr#'],['https://pbs.twimg.com/media/Ettx4HZWYAEBxkF.jpg'],0,4,3,"['teachecon', 'econtwitter']",[],https://twitter.com/ClevelandFed/status/1358804926890180616,False,,1,https://pbs.twimg.com/media/Ettx4HZWYAEBxkF.jpg,,,,,,,[],,,,
1358804580855812102,1358804580855812102,2021-02-08 15:47:12 UTC,2021-02-08,15:47:12,+0000,410666532,rdmetcalfe,Robert Metcalfe,,"The 2021 Advances with Field Experiments conference will take place at @UChi_Economics September 23-24, 2021. We hope it will be in person.  Submit your abstract by May 28.   Keynotes: Bertrand, Bloom, &amp; Chetty.    https://t.co/wTRkpOAdVn  #EconTwitter Plz RT  https://t.co/8vVzx8VUpK",en,"[{'screen_name': 'uchi_economics', 'name': 'uchicago economics', 'id': '722125936834060288'}]",['https://economics.uchicago.edu/content/afe-2021'],['https://pbs.twimg.com/media/EttxFXqU0AEcRzn.jpg'],1,28,45,['econtwitter'],[],https://twitter.com/RDMetcalfe/status/1358804580855812102,False,,1,https://pbs.twimg.com/media/EttxFXqU0AEcRzn.jpg,,,,,,,[],,,,
1358803575934173184,1358803575934173184,2021-02-08 15:43:12 UTC,2021-02-08,15:43:12,+0000,936524088,pelletthomas,Thomas Pellet,,"#EconTwitter closely monitoring the first signs of overheating on the field.   Evanston, 2021  https://t.co/h9ENJZhGK4",en,[],[],['https://pbs.twimg.com/media/EttwpgJXEAE0dr3.jpg'],0,1,5,['econtwitter'],[],https://twitter.com/PelletThomas/status/1358803575934173184,False,,1,https://pbs.twimg.com/media/EttwpgJXEAE0dr3.jpg,,,,,,,[],,,,
1358798921519276040,1358798921519276040,2021-02-08 15:24:42 UTC,2021-02-08,15:24:42,+0000,449064939,alexander_nye,Alex Nye,,And another one of the better #econtwitter accounts goes dark for the next four years.,en,[],[],[],0,1,5,['econtwitter'],[],https://twitter.com/Alexander_Nye/status/1358798921519276040,False,https://twitter.com/Brad_Setser/status/1358793985528127491,0,,,,,,,,[],,,,
1358798742921633793,1358745226886709250,2021-02-08 15:24:00 UTC,2021-02-08,15:24:00,+0000,37047062,lmonasterio,Leo Monasterio,,@Nailahnv O #EconTwitter agradece o apoio ao #TeamGil ! :-),pt,[],[],[],0,1,3,"['econtwitter', 'teamgil']",[],https://twitter.com/lmonasterio/status/1358798742921633793,False,,0,,,,,,,,"[{'screen_name': 'Nailahnv', 'name': 'Preta Ijimú', 'id': '52558216'}]",,,,
1358789549313384449,1358789549313384449,2021-02-08 14:47:28 UTC,2021-02-08,14:47:28,+0000,330597630,vincentgeloso,Vincent (Economic History) Geloso,,A neat passage regarding capital stocks and their contribution to output during war. A neat way of making Robert Higgs’s point that we really dont measure wartime living standards properly #econtwitter #econhist cc.  ⁦@gillian_brunet⁩  https://t.co/uItTvLSIZs,en,"[{'screen_name': 'gillian_brunet', 'name': 'gillian brunet', 'id': '3381181336'}]",[],['https://pbs.twimg.com/media/Ettj4hvWQAIZ_J1.jpg'],3,3,10,"['econtwitter', 'econhist']",[],https://twitter.com/VincentGeloso/status/1358789549313384449,False,,1,https://pbs.twimg.com/media/Ettj4hvWQAIZ_J1.jpg,,,,,,,[],,,,
1358783389348884483,1358783387218153472,2021-02-08 14:22:59 UTC,2021-02-08,14:22:59,+0000,1328511446792212480,chrisowheat,Chris Wheat,,“…less than 1/2 of 1% of all peer-reviewed top-5 economics papers address race/ethnicity.” Looking forward to more inclusive research to fuel bold policy ideas in 2021+ #EconTwitter 2/2,en,[],[],[],0,1,4,['econtwitter'],[],https://twitter.com/chrisowheat/status/1358783389348884483,False,,0,,,,,,,,[],,,,
1358781410883080197,1358781410883080197,2021-02-08 14:15:07 UTC,2021-02-08,14:15:07,+0000,39478650,barcelonagse,Barcelona Graduate School of Economics,,"Labor Dynamics and Actual #Telework Use during #Covid19: Skills, Occupations and Industries   https://t.co/i0yeOm2frY  Barcelona GSE #WorkingPaper by @JbEymeoud @Petrosky_Nadeau @loraulet and @EtienneWasmer  #EconTwitter  https://t.co/zO8D6b4jLp",en,"[{'screen_name': 'jbeymeoud', 'name': 'jean benoît eyméoud', 'id': '500216123'}, {'screen_name': 'petrosky_nadeau', 'name': 'nicolas petrosky-nadeau', 'id': '1308579910491889665'}, {'screen_name': 'loraulet', 'name': 'raul santaeulalia-llopis', 'id': '26964249'}, {'screen_name': 'etiennewasmer', 'name': 'etienne wasmer', 'id': '1201606590'}]",['https://www.barcelonagse.eu/research/working-papers/labor-dynamics-and-actual-telework-use-during-covid-19-skills-occupations'],['https://pbs.twimg.com/media/EttcfjAXcAIgzof.png'],0,2,3,"['telework', 'covid19', 'workingpaper', 'econtwitter']",[],https://twitter.com/barcelonagse/status/1358781410883080197,False,,1,https://pbs.twimg.com/media/EttcfjAXcAIgzof.png,,,,,,,[],,,,
1358776515178221569,1358776515178221569,2021-02-08 13:55:40 UTC,2021-02-08,13:55:40,+0000,836651799859843073,j_fgomes,Joseph Flavian Gomes,,"#EconTwitter #PhD position in #Development / Political Economy @LIDAM_UCLouvain , @UCLouvain_be   researching policies to mitigate violent #conflict, under @ARMANDalex  (@NovaSBE )  and my supervision. Salary €1900 net + social security etc.",en,"[{'screen_name': 'lidam_uclouvain', 'name': 'lidam', 'id': '1172461009505849344'}, {'screen_name': 'uclouvain_be', 'name': 'uclouvain', 'id': '2319105122'}, {'screen_name': 'armandalex', 'name': 'alex armand', 'id': '351569335'}, {'screen_name': 'novasbe', 'name': 'novasbe', 'id': '730422764'}]",[],[],0,4,4,"['econtwitter', 'phd', 'development', 'conflict']",[],https://twitter.com/j_fgomes/status/1358776515178221569,False,https://twitter.com/jfmaystadt/status/1357342725452963850,0,,,,,,,,[],,,,
1358775709146177540,1358775709146177540,2021-02-08 13:52:28 UTC,2021-02-08,13:52:28,+0000,119432340,routledgehist,"Routledge History, Heritage Studies & Archaeology",,"Happy 176th birthday to Francis Ysidro Edgeworth, philosopher and political economist who made significant contributions to the methods of statistics. Read more here on our History of Economic Thought site.  https://t.co/5Rbl1kAdF7 #economy #EconTwitter #History  #Economics",en,[],['https://bit.ly/2Cwxz9T'],[],0,2,3,"['economy', 'econtwitter', 'history', 'economics']",[],https://twitter.com/RoutledgeHist/status/1358775709146177540,False,,0,,,,,,,,[],,,,
1358774700793597953,1358774700793597953,2021-02-08 13:48:28 UTC,2021-02-08,13:48:28,+0000,1185354854,gustavahorn,Gustav A. Horn,,"Die @spdde übernimmt mit dem von @OlafScholz vorgestellten Ansatz  das  Konzept einer ""mission oriented industrial policy"" von @MazzucatoM . Sie verbindet es zugleich mit dem Anspruch auf Gerechtigkeit im Wandel.  https://t.co/kv0KKEETQH  @NowaboFM @CanselK @mischrodi #EconTwitter",de,"[{'screen_name': 'spdde', 'name': 'spd parteivorstand 🇪🇺', 'id': '26458162'}, {'screen_name': 'olafscholz', 'name': 'olaf scholz', 'id': '38150247'}, {'screen_name': 'mazzucatom', 'name': 'mariana mazzucato', 'id': '394060363'}, {'screen_name': 'nowabofm', 'name': 'norbert walter-borjans', 'id': '706536761279782912'}, {'screen_name': 'canselk', 'name': 'cansel kiziltepe', 'id': '23248102'}, {'screen_name': 'mischrodi', 'name': 'michael schrodi', 'id': '806975237766135813'}]",['https://www.vorwaerts.de/artikel/vier-missionen-olaf-scholz-legt-zukunftskonzept-deutschland'],[],0,4,18,['econtwitter'],[],https://twitter.com/GustavAHorn/status/1358774700793597953,False,,0,,,,,,,,[],,,,
1358772845162229760,1358772845162229760,2021-02-08 13:41:05 UTC,2021-02-08,13:41:05,+0000,1348850574670913544,hotnewtrend,Super Intelligence,,Keep at it everyone.  Today is another day to keep up that good habit you developed.  You can do it.  I know you can.  And you know you can!  #business #MarketingTwitter #EconTwitter #startup #AcademicTwitter #AcademicChatter,en,[],[],[],1,3,5,"['business', 'marketingtwitter', 'econtwitter', 'startup', 'academictwitter', 'academicchatter']",[],https://twitter.com/hotnewtrend/status/1358772845162229760,False,,0,,,,,,,,[],,,,
1358772053088862212,1358772053088862212,2021-02-08 13:37:56 UTC,2021-02-08,13:37:56,+0000,2558914970,sitestockholm,Stockholm Institute of Transition Economics,,"📢How are countries in Eastern Europe, around the Baltic Sea and in the Caucasus managing vaccination efforts in their countries? 📅Join the discussion on Thursday, feb 11, at 10am (CET, Swe) Register here:  https://t.co/QRrLFSSaeG #VaccinationCovid #VaccineStrategy #EconTwitter  https://t.co/5cTbr3ldNC",en,[],['https://www.eventbrite.se/e/addressing-covid-19-vaccination-efforts-in-free-network-countries-registration-138737281945'],['https://pbs.twimg.com/media/EttR9DuWgAAihE4.jpg'],0,4,5,"['vaccinationcovid', 'vaccinestrategy', 'econtwitter']",[],https://twitter.com/SITEStockholm/status/1358772053088862212,False,,1,https://pbs.twimg.com/media/EttR9DuWgAAihE4.jpg,,,,,,,[],,,,
1358765167534891010,1358765167534891010,2021-02-08 13:10:35 UTC,2021-02-08,13:10:35,+0000,1613265398,eaepe,EAEPE,,We are very happy to announce that Prof @JosephEStiglitz (@Columbia University) will give a keynote speech at the 33rd annual EAEPE conference  (2-4 September 2021).  https://t.co/S1Yp3W87GI #EconTwitter,en,"[{'screen_name': 'josephestiglitz', 'name': 'joseph e. stiglitz', 'id': '1963312058'}, {'screen_name': 'columbia', 'name': 'columbia university', 'id': '248795646'}]",['https://eaepe.org/?page=events&side=annual_conference&sub=eaepe_2021_cfp'],[],0,10,25,['econtwitter'],[],https://twitter.com/eaepe/status/1358765167534891010,False,,0,,,,,,,,[],,,,
1358763524571492352,1358763524571492352,2021-02-08 13:04:03 UTC,2021-02-08,13:04:03,+0000,701602604225314816,paubgood,Paula Pereda,,"In honor of the #BlackHistoryMonth , I am seeking recommendations of rigorous books about Afro-American history (preferably non-autobiographical books), any suggestion? #EconTwitter",en,[],[],[],3,2,3,"['blackhistorymonth', 'econtwitter']",[],https://twitter.com/paubgood/status/1358763524571492352,False,,0,,,,,,,,[],,,,
1358761160984547328,1358761160984547328,2021-02-08 12:54:39 UTC,2021-02-08,12:54:39,+0000,2585772811,tradelawdev,"Trade, Law and Development (TL&D)",,"The Call for Papers for our Summer'21 issue (Vol. XIII, No. 1) is out! Find the submission guidelines on our website here :  https://t.co/bOY3GPRzE5  #TradeTwitter #TradeLaw #AcademicTwitter #Academia #EconTwitter #lawtwitter  https://t.co/Ps1Kh0E82C",en,[],['http://www.tradelawdevelopment.com/index.php/tld/about/submissions#authorGuidelines'],"['https://pbs.twimg.com/media/EttKEbaVoAElxl3.jpg', 'https://pbs.twimg.com/media/EttKEwQVcAERXgj.jpg']",1,2,4,"['tradetwitter', 'tradelaw', 'academictwitter', 'academia', 'econtwitter', 'lawtwitter']",[],https://twitter.com/TradeLawDev/status/1358761160984547328,False,,1,https://pbs.twimg.com/media/EttKEbaVoAElxl3.jpg,,,,,,,[],,,,
1358756560588079104,1358756560588079104,2021-02-08 12:36:23 UTC,2021-02-08,12:36:23,+0000,66666832,logwithbasee,Lakshya Narula,,"Never do m:m merge on @Stata   It hurts when you find out that you've been spending a heck lot of time trying to blame the data (which deserves some blame) but in the end, you're doing m:m merge.  Lesson learnt the hard way.  #stata #EconTwitter",en,"[{'screen_name': 'stata', 'name': 'stata', 'id': '108660744'}]",[],[],1,1,5,"['stata', 'econtwitter']",[],https://twitter.com/logwithbasee/status/1358756560588079104,False,,0,,,,,,,,[],,,,
1358753679722037251,1358753679722037251,2021-02-08 12:24:56 UTC,2021-02-08,12:24:56,+0000,236871319,cepii_paris,CEPII,,"""The consequences of the pandemic on the French economy : a view from the IMF"": join an online discussion with Jeffrey Franks @IMF_inEU, Michala Marcussen @SocieteGenerale and @DestaisC on 11 February 2021.  https://t.co/zOsZsTR8i4 #EconTwitter #FranceRelance  https://t.co/AU5dn2a4KQ",en,"[{'screen_name': 'imf_ineu', 'name': 'imf in eu', 'id': '2291331547'}, {'screen_name': 'societegenerale', 'name': 'societe generale group', 'id': '188886565'}, {'screen_name': 'destaisc', 'name': 'christophe destais', 'id': '567218741'}]",['http://www.cepii.fr/CEPII/en/evenements/abstract.asp?IDReu=557'],['https://pbs.twimg.com/media/EttC0McXcAcyWNg.jpg'],0,7,8,"['econtwitter', 'francerelance']",[],https://twitter.com/CEPII_Paris/status/1358753679722037251,False,,1,https://pbs.twimg.com/media/EttC0McXcAcyWNg.jpg,,,,,,,[],,,,
1358749173185720321,1358749173185720321,2021-02-08 12:07:01 UTC,2021-02-08,12:07:01,+0000,2981738470,economicethics,SeTh,,"Nochmal separat: Schöner Artikel von Ulrike Knobloch zur feministischen Ökonomie @MakronomMagazin . 👉 https://t.co/FdapiI1Ugt  Sie macht dort u.a. deutlich, warum das weit verbretete Denken in den Kategorien ""Konsum"" &amp; ""Produktion"" viel zu kurz greift.⬇️  cc #EconTwitter  https://t.co/WqRmxaE1sA",de,"[{'screen_name': 'makronommagazin', 'name': 'makronom', 'id': '2994746043'}]",['https://makronom.de/zukunftsfaehiges-versorgen-oder-vom-privileg-sich-nicht-um-hausarbeit-kuemmern-zu-muessen-38281'],['https://pbs.twimg.com/media/Ets-vNiXUAIe50N.png'],1,6,15,['econtwitter'],[],https://twitter.com/EconomicEthics/status/1358749173185720321,False,,1,https://pbs.twimg.com/media/Ets-vNiXUAIe50N.png,,,,,,,[],,,,
1358749003912015873,1358749003912015873,2021-02-08 12:06:21 UTC,2021-02-08,12:06:21,+0000,1963265239,imbernomics,Scott Imberman,,#EconTwitter - do what you know best. Prove that @Stata is awesome and kick some #Rstats ass.,en,"[{'screen_name': 'stata', 'name': 'stata', 'id': '108660744'}]",[],[],0,4,3,"['econtwitter', 'rstats']",[],https://twitter.com/imbernomics/status/1358749003912015873,False,https://twitter.com/jondr44/status/1358662692660154369,0,,,,,,,,[],,,,
1358748629079650307,1358748629079650307,2021-02-08 12:04:52 UTC,2021-02-08,12:04:52,+0000,369593887,alessia_metrics,Alessia Paccagnini 👩‍🏫📚💶📈💻🍕⚽🐱🐶🎥 🎶🌍,,#Macroeconomics #EconTwitter,und,[],[],[],0,2,3,"['macroeconomics', 'econtwitter']",[],https://twitter.com/Alessia_metrics/status/1358748629079650307,False,https://twitter.com/ojblanchard1/status/1358709906703056896,0,,,,,,,,[],,,,
1358736080686747648,1358736080686747648,2021-02-08 11:15:00 UTC,2021-02-08,11:15:00,+0000,3293058845,safe_frankfurt,Leibniz Institute for Financial Research SAFE,,The paper appears in the SAFE Working Paper Series   https://t.co/HiR15FQqmk #EconTwitter,en,[],['https://safe-frankfurt.de/publications/working-papers.html'],[],0,1,3,['econtwitter'],[],https://twitter.com/SAFE_Frankfurt/status/1358736080686747648,False,https://twitter.com/Kasinger_J/status/1358732392182210562,0,,,,,,,,[],,,,
1358734420249870337,1358734420249870337,2021-02-08 11:08:24 UTC,2021-02-08,11:08:24,+0000,481338876,ubeconomics,UB School of Economics,,"👨🏽‍🎓 @FilippoT7, #PhD student: “Seeing the people around me and the quality of their #research studies, the #UniBarcelona will become a worldwide distinguished #university in #economics.”  More info👉🏽  https://t.co/pOVz5rJz9x #EconTwitter @eviladecans @MiquelAngelGL @FundacioIEB  https://t.co/7q3EkfzZ4q",en,"[{'screen_name': 'filippot7', 'name': 'filippo tassinari', 'id': '1082996460663263232'}, {'screen_name': 'eviladecans', 'name': 'elisabet viladecans-marsal', 'id': '134594969'}, {'screen_name': 'miquelangelgl', 'name': 'miquel-àngel garcia lópez', 'id': '1141814784737861633'}, {'screen_name': 'fundacioieb', 'name': 'ieb', 'id': '229793087'}]",['http://bit.ly/3jtFgzd'],['https://pbs.twimg.com/media/EtsxkvsXcAQiSAA.jpg'],0,3,24,"['phd', 'research', 'unibarcelona', 'university', 'economics', 'econtwitter']",[],https://twitter.com/ubeconomics/status/1358734420249870337,False,,1,https://pbs.twimg.com/media/EtsxkvsXcAQiSAA.jpg,,,,,,,[],,,,
