id,conversation_id,created_at,date,time,timezone,user_id,username,name,place,tweet,language,mentions,urls,photos,replies_count,retweets_count,likes_count,hashtags,cashtags,link,retweet,quote_url,video,thumbnail,near,geo,source,user_rt_id,user_rt,retweet_id,reply_to,retweet_date,translate,trans_src,trans_dest
1356200299145306118,1356200299145306118,2021-02-01 11:18:42 UTC,2021-02-01,11:18:42,+0000,957213383748567040,smita_srinivas,Smita Srinivas,,#EconTwitter #politicaleconomy #economics #institutions #evolutionary,und,[],[],[],0,2,7,"['econtwitter', 'politicaleconomy', 'economics', 'institutions', 'evolutionary']",[],https://twitter.com/Smita_Srinivas/status/1356200299145306118,False,https://twitter.com/eaepe/status/1331675241245011977,0,,,,,,,,[],,,,
1356184703364190209,1356184703364190209,2021-02-01 10:16:44 UTC,2021-02-01,10:16:44,+0000,2468099712,thomas_wuest,Thomas Wüst,,"Endlich mal ein Beitrag von jemandem, der sich damit auskennt und der einfache Formel so mancher #Ökonomen „frühe &amp; hohe Bestellmenge zu „whatever it takes“-Bedingungen führe automatisch zu Push-Effekt beim Aufbau von Produktionskapazität“ eindrucksvoll widerlegt.🙏🏽👍🏾#EconTwitter",de,[],[],[],1,2,6,"['ökonomen', 'econtwitter']",[],https://twitter.com/Thomas_Wuest/status/1356184703364190209,False,https://twitter.com/verowendland/status/1356148225414197250,0,,,,,,,,[],,,,
1356183750359527427,1356183750359527427,2021-02-01 10:12:57 UTC,2021-02-01,10:12:57,+0000,1292848702785191937,hwueconomics,"Economics @ Edinburgh Business School, Heriot-Watt",,The next Economics@Panmure speaker on Friday February 5 at 3:15pm is @ricco_giovanni  (@econwarwick). Register here to join:   https://t.co/u1IfSLTjUS  For the list of speakers this semester check:   https://t.co/MHY3b9LMBd    #PanmureHouse #EconTwitter #AdamSmithHouse  https://t.co/cT3bn4eJqj,en,"[{'screen_name': 'ricco_giovanni', 'name': 'giovanni ricco', 'id': '795269547553071104'}]","['https://zoom.us/webinar/register/WN_OyxavWZUTAK3fh7PQjeTQQ', 'https://panmurehouse.org/programmes/economics-panmure/']",['https://pbs.twimg.com/media/EtIh1XbW8AA9JH0.jpg'],0,2,3,"['panmurehouse', 'econtwitter', 'adamsmithhouse']",[],https://twitter.com/HWUEconomics/status/1356183750359527427,False,,1,https://pbs.twimg.com/media/EtIh1XbW8AA9JH0.jpg,,,,,,,[],,,,
1356178945490771968,1356178945490771968,2021-02-01 09:53:51 UTC,2021-02-01,09:53:51,+0000,789686732,jeni_houser,Jeni Houser,,What is your #econ valentines tip? This is one of my favourite #EconTwitter accounts. Follow on IG as well. These will be the only cards I'll be using!,en,[],[],[],1,2,6,"['econ', 'econtwitter']",[],https://twitter.com/jeni_houser/status/1356178945490771968,False,https://twitter.com/unofficialecon/status/1356089458672627718,0,,,,,,,,[],,,,
1356178369075929088,1356178369075929088,2021-02-01 09:51:34 UTC,2021-02-01,09:51:34,+0000,154237146,berendvdkolk,Berend van der Kolk,,There's some irony hidden in this screenshot 🙈   https://t.co/Pl07P2n2fX @AcademicChatter @AcademicsSay #AcademicTwitter #econtwitter #mgmttwitter #accotwitter  https://t.co/thNaCcq44P,en,"[{'screen_name': 'academicchatter', 'name': 'academic chatter', 'id': '885953601067208705'}, {'screen_name': 'academicssay', 'name': 'shit academics say', 'id': '1891806212'}]",['https://doi.org/10.1017/S0003975609000150'],['https://pbs.twimg.com/media/EtIccYEXIAAbI3_.png'],0,2,9,"['academictwitter', 'econtwitter', 'mgmttwitter', 'accotwitter']",[],https://twitter.com/berendvdkolk/status/1356178369075929088,False,,1,https://pbs.twimg.com/media/EtIccYEXIAAbI3_.png,,,,,,,[],,,,
1356154101353086977,1356154101353086977,2021-02-01 08:15:08 UTC,2021-02-01,08:15:08,+0000,3087070036,oxrepjournal,Oxford Econ Policy,,"Are firms more competitive when they have a higher proportion of women in leadership positions?  In our new Gender Economics issue, @anne_boring and Ghazala Azmat make the 'business case' for gender diversity:   https://t.co/SIAifKxWi3 #EconTwitter  https://t.co/PTez86sdjl",en,"[{'screen_name': 'anne_boring', 'name': 'anne boring', 'id': '2210547705'}]",['https://academic.oup.com/oxrep/article/36/4/760/6124301'],['https://pbs.twimg.com/media/EtIG9_kXYAAsxff.png'],0,6,2,['econtwitter'],[],https://twitter.com/OxrepJournal/status/1356154101353086977,False,,1,https://pbs.twimg.com/media/EtIG9_kXYAAsxff.png,,,,,,,[],,,,
1356152184413564930,1356152184413564930,2021-02-01 08:07:31 UTC,2021-02-01,08:07:31,+0000,512429239,econsociology,Economic Sociology & Political Economy,,"Great opportunities: 15 calls for papers, 5 postdocs, 4 jobs, 3 PhD fellowships, 2 visiting posts, a summer course in economic sociology, political economy &amp; related fields, w/ January 31 - February 28 deadlines. Share. Good luck! #soctwitter #econtwitter   https://t.co/W8Tk3YjtoP",en,[],['https://economicsociology.org/2021/01/31/great-academic-opportunities-15-calls-for-papers-5-postdocs-4-jobs-3-phd-fellowships-2-visiting-posts-a-summer-course/'],[],0,8,14,"['soctwitter', 'econtwitter']",[],https://twitter.com/EconSociology/status/1356152184413564930,False,,0,,,,,,,,[],,,,
1356147904105369603,1356147904105369603,2021-02-01 07:50:31 UTC,2021-02-01,07:50:31,+0000,1173527152098197505,heterodoxeconwu,heterodox_econ_wu,,This month of February our topic is „What is Heterodox Economics?“ We would love to hear your thoughts and comments too! #EconTwitter #pluralecon #heterodoxeconomics  https://t.co/UTswz69xB4,en,[],[],[],1,2,2,"['econtwitter', 'pluralecon', 'heterodoxeconomics']",[],https://twitter.com/HeterodoxEconWU/status/1356147904105369603,False,,1,https://pbs.twimg.com/ext_tw_video_thumb/1356146493602881538/pu/img/NZdYrZPi_01R89_G.jpg,,,,,,,[],,,,
1356143214386933760,1356143214386933760,2021-02-01 07:31:52 UTC,2021-02-01,07:31:52,+0000,1341008872207618048,empiricalindia,Empirical India Papers,,"Impact of COVID-19 on agricultural markets: assessing the roles of commodity characteristics, disease caseload and market reforms  Deepak Varshney, Devesh Roy, J. V. Meenakshi  #EconTwitter #COVID19 #agriculture #commodity #diseases #markets   https://t.co/grudVH8teG",en,[],['https://link.springer.com/article/10.1007/s41775-020-00095-1'],[],1,2,4,"['econtwitter', 'covid19', 'agriculture', 'commodity', 'diseases', 'markets']",[],https://twitter.com/EmpiricalIndia/status/1356143214386933760,False,,0,,,,,,,,[],,,,
1356139960684978180,1356139960684978180,2021-02-01 07:18:57 UTC,2021-02-01,07:18:57,+0000,1288838816132808704,tqh_policy,The Quantum Hub,,"As all eyes turn towards #Budget2021, Surbhi Singh from our team and @kanika_jha from @IWWAGEIFMR write in the Indian Express on why special attention needs to be paid to the socio-economic impact of the pandemic on #women. Read here:  https://t.co/AD3Eg7TViF  #EconTwitter  https://t.co/aA7f08eZXK",en,"[{'screen_name': 'kanika_jha', 'name': 'kanika jha kingra', 'id': '486954979'}, {'screen_name': 'iwwageifmr', 'name': 'iwwage', 'id': '1069519130103934976'}]",['https://indianexpress.com/article/opinion/pandemic-and-the-gender-divide-7169012/'],['https://pbs.twimg.com/media/EtH6GzIXAAIeYQo.jpg'],0,5,6,"['budget2021', 'women', 'econtwitter']",[],https://twitter.com/tqh_policy/status/1356139960684978180,False,,1,https://pbs.twimg.com/media/EtH6GzIXAAIeYQo.jpg,,,,,,,[],,,,
1356137582019686400,1356137582019686400,2021-02-01 07:09:30 UTC,2021-02-01,07:09:30,+0000,789365700,essianenelson,Nelson Essiane,,🤔  Hum....   #EconTwitter,und,[],[],[],4,1,3,['econtwitter'],[],https://twitter.com/EssianeNelson/status/1356137582019686400,False,https://twitter.com/nberpubs/status/1355924051370205186,0,,,,,,,,[],,,,
1356135192424042498,1356135192424042498,2021-02-01 07:00:00 UTC,2021-02-01,07:00:00,+0000,935983514419453952,icae_ucm,ICAE,,"Research Seminar:  Describing and Understanding the Long Run in Repeated Games. 🗓️ February 3rd, 2021, 13:00 h Speaker:  Christos Ioannou (U Paris 1) @ICAE_UCM @UCM_ECONOMICAS unicomplutense   #EconTwitter  🔗 https://t.co/gX1drlPmMO  https://t.co/igK3hcJECd",en,"[{'screen_name': 'icae_ucm', 'name': 'icae', 'id': '935983514419453952'}, {'screen_name': 'ucm_economicas', 'name': 'ucm_económicas', 'id': '177879198'}]",['https://ucm.es/icae/seminars'],['https://pbs.twimg.com/media/EtFvw2mXUAYIlmm.png'],0,6,5,['econtwitter'],[],https://twitter.com/ICAE_UCM/status/1356135192424042498,False,,1,https://pbs.twimg.com/media/EtFvw2mXUAYIlmm.png,,,,,,,[],,,,
1356130634218033154,1356130634218033154,2021-02-01 06:41:53 UTC,2021-02-01,06:41:53,+0000,789365700,essianenelson,Nelson Essiane,,Des résultats TRÈS inquiétants.... #EconTwitter,fr,[],[],[],0,4,10,['econtwitter'],[],https://twitter.com/EssianeNelson/status/1356130634218033154,False,https://twitter.com/DurRobert/status/1355596206450352131,0,,,,,,,,[],,,,
1356123883368312834,1356123883368312834,2021-02-01 06:15:04 UTC,2021-02-01,06:15:04,+0000,819185887091322880,eulerhermesfr,Euler Hermes France,,"🇫🇷 Comment expliquer la #récession historique observée en France en 2020 (-8,3%)? Notre experte @weloveeconomics partage son analyse avec l'@afpfr et @LePoint! #EconTwitter #Covid19 @mheucAFP @eulerhermes @allianzfrance  https://t.co/jSaJ1n22VP",fr,"[{'screen_name': 'weloveeconomics', 'name': 'we love economics', 'id': '851846918842056704'}, {'screen_name': 'afpfr', 'name': 'agence france-presse', 'id': '338985020'}, {'screen_name': 'lepoint', 'name': 'le point', 'id': '8460572'}, {'screen_name': 'mheucafp', 'name': 'marie heuclin', 'id': '2533790236'}, {'screen_name': 'eulerhermes', 'name': 'euler hermes', 'id': '59438003'}, {'screen_name': 'allianzfrance', 'name': 'allianz france', 'id': '270453413'}]",['http://ow.ly/tNzh50DlyiO'],[],0,3,4,"['récession', 'econtwitter', 'covid19']",[],https://twitter.com/eulerhermesFR/status/1356123883368312834,False,,0,,,,,,,,[],,,,
1356115062914768896,1356115062914768896,2021-02-01 05:40:01 UTC,2021-02-01,05:40:01,+0000,67338172,pauljhealy,PJ Healy,,I booked a writing retreat!!! Four nights in a cabin in the woods by myself to finish off a neglected paper. And also just to get away...  #EconTwitter have you done anything like this? Do you have any tips for success???  🌲🌲🌲🌲🌲🤓🖥️🌲🌲🌲🌲🌲,en,[],[],[],3,1,26,['econtwitter'],[],https://twitter.com/pauljhealy/status/1356115062914768896,False,,0,,,,,,,,[],,,,
1356105935366758402,1356105935366758402,2021-02-01 05:03:44 UTC,2021-02-01,05:03:44,+0000,363143381,tejendrapsingh,Tejendra P Singh | तेजेन्द्र,,Nice tutorial on making spatial maps in R by @pbaylis An alternate approach to the one in the post (and the one I particularly like) is using the super-useful `tmap' package for plotting. #RStats #rspatial #EconTwitter #SpatialTwitter #GISTwitter,en,"[{'screen_name': 'pbaylis', 'name': 'patrick baylis', 'id': '23214189'}]",[],[],0,6,5,"['rstats', 'rspatial', 'econtwitter', 'spatialtwitter', 'gistwitter']",[],https://twitter.com/tejendrapsingh/status/1356105935366758402,False,https://twitter.com/pbaylis/status/1356025789230157825,0,,,,,,,,[],,,,
1356103031830544385,1356103031830544385,2021-02-01 04:52:12 UTC,2021-02-01,04:52:12,+0000,865711238189338625,marietmora,Marie Mora,,Just learned my wonderful former colleague @DiegoEscobari is the new PhD Program Director in Business Admin at @vackarcobe! Congrats Diego! 🎉 @ASHE_ASSA @TAMUECON #EconTwitter  @ThePhDProject @SREBDocSch,en,"[{'screen_name': 'diegoescobari', 'name': 'diego escobari', 'id': '315627750'}, {'screen_name': 'vackarcobe', 'name': 'utrgv_vcobe', 'id': '46673020'}, {'screen_name': 'ashe_assa', 'name': 'american society of hispanic economists', 'id': '957804404719149056'}, {'screen_name': 'tamuecon', 'name': 'texas a&m department of economics', 'id': '1078357682'}, {'screen_name': 'thephdproject', 'name': 'thephdproject', 'id': '81846144'}, {'screen_name': 'srebdocsch', 'name': 'sreb-state doctoral scholars program', 'id': '558790404'}]",[],[],2,2,26,['econtwitter'],[],https://twitter.com/Marietmora/status/1356103031830544385,False,,0,,,,,,,,[],,,,
1356089458672627718,1356089458672627718,2021-02-01 03:58:16 UTC,2021-02-01,03:58:16,+0000,1297157408985210880,unofficialecon,unofficially econ,,some Valentines to send to your favorite econ nerd(s)!! #EconTwitter  https://t.co/7sipYadZDE,en,[],[],"['https://pbs.twimg.com/media/EtHMLJ3VEAIA52V.jpg', 'https://pbs.twimg.com/media/EtHMLJ5UYAEfRyt.jpg']",2,20,69,['econtwitter'],[],https://twitter.com/unofficialecon/status/1356089458672627718,False,,1,https://pbs.twimg.com/media/EtHMLJ3VEAIA52V.jpg,,,,,,,[],,,,
1356083006042062850,1356083006042062850,2021-02-01 03:32:38 UTC,2021-02-01,03:32:38,+0000,1271772121656463361,anishettytweets,#मोदी_हमारा_गर्व_है,,I think : Today's Highly rated Economist's will go live ?  #BudgetWithCNBCTV18 #EconTwitter #EconomicSurvey2021 #BudgetSession #Budget2021 #BudgetExpectations #Budget #NirmalaSitharaman,en,[],[],[],1,2,16,"['budgetwithcnbctv18', 'econtwitter', 'economicsurvey2021', 'budgetsession', 'budget2021', 'budgetexpectations', 'budget', 'nirmalasitharaman']",[],https://twitter.com/AnishettyTweets/status/1356083006042062850,False,https://twitter.com/MinistryofSM/status/1355967793745674242,0,,,,,,,,[],,,,
1356074173869789184,1356074173869789184,2021-02-01 02:57:32 UTC,2021-02-01,02:57:32,+0000,1348850574670913544,hotnewtrend,Super Intelligence,,"When you prioritize sleep,  You prioritize success.  Consistent, high quality sleep lets you level up.  #business #ecommerce #MarketingTwitter #EconTwitter #Amazon #startup #LevelUp",en,[],[],[],0,2,5,"['business', 'ecommerce', 'marketingtwitter', 'econtwitter', 'amazon', 'startup', 'levelup']",[],https://twitter.com/hotnewtrend/status/1356074173869789184,False,,0,,,,,,,,[],,,,
1356051029570297858,1356051029570297858,2021-02-01 01:25:34 UTC,2021-02-01,01:25:34,+0000,408755761,constancehunter,Constance L Hunter,,Just learned from @chadmoutray that it is #HugAnEconomistDay.   Spread the word #EconTwitter!,en,"[{'screen_name': 'chadmoutray', 'name': 'chad moutray', 'id': '389686975'}]",[],[],3,3,13,"['huganeconomistday', 'econtwitter']",[],https://twitter.com/ConstanceHunter/status/1356051029570297858,False,,0,,,,,,,,[],,,,
1356046766668451840,1356046766668451840,2021-02-01 01:08:37 UTC,2021-02-01,01:08:37,+0000,1264930729848459266,just_economics,An Economist,,"Best of #econtwitter - Week of January 31, 2021  https://t.co/xW5QESsqGr",en,[],['https://bestofecontwitter.substack.com/p/best-of-econtwitter-week-of-january-ba7'],[],0,1,2,['econtwitter'],[],https://twitter.com/just_economics/status/1356046766668451840,False,,0,,,,,,,,[],,,,
1356016388549140484,1356016388549140484,2021-01-31 23:07:55 UTC,2021-01-31,23:07:55,+0000,741327724984172544,econhembre,Erik Hembre,,Suppose a student (non-econ major) asked you for the best publications/websites to follow to learn more about public policy and economics.    What would you recommend #EconTwitter ?,en,[],[],[],57,48,226,['econtwitter'],[],https://twitter.com/EconHembre/status/1356016388549140484,False,,0,,,,,,,,[],,,,
1356010725781741572,1356010725781741572,2021-01-31 22:45:25 UTC,2021-01-31,22:45:25,+0000,1025538004167864321,itsafronomics,Anna Gifty says #BlackWomenBest,,"Economics is not synonymous with capitalism, but it has definitely been used to promote and perpetuate capitalism. #EconTwitter   There is field of economics called heterodox economics, check out @DivDecEcon to learn more.",en,"[{'screen_name': 'divdececon', 'name': 'diversifying and decolonising economics', 'id': '1093973339272560642'}]",[],[],0,4,19,['econtwitter'],[],https://twitter.com/itsafronomics/status/1356010725781741572,False,https://twitter.com/jessie_fin/status/1356010293273395200,0,,,,,,,,[],,,,
1356008466024902664,1356008466024902664,2021-01-31 22:36:26 UTC,2021-01-31,22:36:26,+0000,110669171,devikadutt,Devika Dutt,,"Me, everyday on #EconTwitter",en,[],[],[],1,1,30,['econtwitter'],[],https://twitter.com/devikadutt/status/1356008466024902664,False,https://twitter.com/kbearart/status/1355790619596099584,0,,,,,,,,[],,,,
1356006216019943425,1356006216019943425,2021-01-31 22:27:29 UTC,2021-01-31,22:27:29,+0000,1025538004167864321,itsafronomics,Anna Gifty says #BlackWomenBest,,Most common critiques I am seeing about econ #econtwitter:  - jargon  - the math aint mathing - elitism abounds - supports capitalism/rich people probably - feels disconnected from the real world  - limited perspective - lots of white guys - no one knows whats happening,en,[],[],[],2,8,71,['econtwitter'],[],https://twitter.com/itsafronomics/status/1356006216019943425,False,https://twitter.com/itsafronomics/status/1355995497773867011,0,,,,,,,,[],,,,
1356000130852397057,1355995497773867011,2021-01-31 22:03:19 UTC,2021-01-31,22:03:19,+0000,1025538004167864321,itsafronomics,Anna Gifty says #BlackWomenBest,,"I think #econtwitter should take a look at the responses below this thread and ask themselves how they are helping to make economics more accessible and less elitist, because so far... the majority of what is being said is true so....  https://t.co/syZJ2ytHKZ",en,[],[],['https://pbs.twimg.com/tweet_video_thumb/EtF67fAW4AUjM8H.jpg'],1,1,17,['econtwitter'],[],https://twitter.com/itsafronomics/status/1356000130852397057,False,,1,https://pbs.twimg.com/tweet_video_thumb/EtF67fAW4AUjM8H.jpg,,,,,,,[],,,,
1355998000980451328,1355998000980451328,2021-01-31 21:54:51 UTC,2021-01-31,21:54:51,+0000,30972353,darwyyndeyo,Darwyyn Deyo,,"As the co-winner of the first Nobel Prize in Economics, Frisch cited the research of zero women in his Nobel Prize Lecture (he thanked his wife and daughter for proofreading). Otoh, Tinbergen cited Irma Adelman and Cynthia Taft Morris. #EconTwitter",en,[],[],[],1,1,4,['econtwitter'],[],https://twitter.com/darwyyndeyo/status/1355998000980451328,False,https://twitter.com/paubgood/status/1355992614688993280,0,,,,,,,,[],,,,
1355995756340117504,1355995756340117504,2021-01-31 21:45:56 UTC,2021-01-31,21:45:56,+0000,17780347,steffenhentrich,Steffen Hentrich,,"#EconTwitter arbeitet sich permanent an #Marktversagen ab, jeden Tag will ein anderer Aktivist den Kapitalismus abschaffen. Da ist es natürlich ein Problem, dass nicht schon der Pförtner die Erstsemester vor Externalitäten warnt (die in leichter Sprache Sozialkunde dominieren).",de,[],[],[],0,1,2,"['econtwitter', 'marktversagen']",[],https://twitter.com/SteffenHentrich/status/1355995756340117504,False,https://twitter.com/SDullien/status/1355618094522249225,0,,,,,,,,[],,,,
1355963272592285699,1355963272592285699,2021-01-31 19:36:51 UTC,2021-01-31,19:36:51,+0000,1170862791781244929,sabitecon,Ahmed Sabit,,A remarkable paper! Fortunare to have Dr. Brantly Callaway as my econometrics professor.    #EconTwitter,en,[],[],[],0,1,2,['econtwitter'],[],https://twitter.com/sabitecon/status/1355963272592285699,False,https://twitter.com/pedrohcgs/status/1340006487456964608,0,,,,,,,,[],,,,
1355957866071543810,1355957866071543810,2021-01-31 19:15:22 UTC,2021-01-31,19:15:22,+0000,2981738470,economicethics,SeTh,,"Zu dem SWR-Beitrag über den Zustand der VWL fasst @_maxhauser viele Punkte zusammen, die mir dazu auch durch den Kopf gingen.⬇️  cc @econ4future_DE @CKemfert @AchimTruger @PluralEcon @EconJena @PluralEcon_HH @lenitiv @politoekonomie @DominikPietron @SDullien #EconTwitter",de,"[{'screen_name': '_maxhauser', 'name': 'max 🍉', 'id': '1224842898077880325'}, {'screen_name': 'econ4future_de', 'name': 'economists for future de', 'id': '1279052333230456835'}, {'screen_name': 'ckemfert', 'name': 'claudia kemfert 😷', 'id': '48406195'}, {'screen_name': 'achimtruger', 'name': 'achim truger', 'id': '3352338183'}, {'screen_name': 'pluralecon', 'name': 'plurale ökonomik', 'id': '1548484621'}, {'screen_name': 'econjena', 'name': 'plurale ökonomik jena', 'id': '1174690584818278400'}, {'screen_name': 'pluralecon_hh', 'name': 'ak plurale ökonomik hamburg', 'id': '1269946437103685632'}, {'screen_name': 'lenitiv', 'name': 'ʟᴇɴɪ', 'id': '4704446168'}, {'screen_name': 'politoekonomie', 'name': 'ak politische ökonomie', 'id': '1354357328905175042'}, {'screen_name': 'dominikpietron', 'name': 'dominik piétron', 'id': '723112812323565568'}, {'screen_name': 'sdullien', 'name': 'sebastian dullien', 'id': '499717174'}]",[],[],0,1,8,['econtwitter'],[],https://twitter.com/EconomicEthics/status/1355957866071543810,False,https://twitter.com/_maxhauser/status/1355803031015665664,0,,,,,,,,[],,,,
1355954539866820612,1355954539866820612,2021-01-31 19:02:09 UTC,2021-01-31,19:02:09,+0000,20715956,princetonupress,Princeton University Press,,"An all time Princeton University Press best seller, Time Series Analysis by James Douglas Hamilton is celebrating its 27th #BookBirthday today! Celebrate with 20% off the hardcover edition with code BB20 at checkout.  https://t.co/5hKsSSQlkY #econtwitter",en,[],['https://hubs.ly/H0FKR7M0'],[],0,4,13,"['bookbirthday', 'econtwitter']",[],https://twitter.com/PrincetonUPress/status/1355954539866820612,False,,0,,,,,,,,[],,,,
1355954052987822081,1355954052987822081,2021-01-31 19:00:13 UTC,2021-01-31,19:00:13,+0000,375847452,toxvaerd1,Flavio Toxvaerd,,"More from the always insightful @t0nyyates, this time on #VaccineNationalism #EconTwitter    https://t.co/O7q1eubDZp",en,"[{'screen_name': 't0nyyates', 'name': 'tony yates', 'id': '21510888'}]",['https://www.prospectmagazine.co.uk/economics-and-finance/vaccine-nationalism-economics-brexit-eu-astrazeneca-contract-uk'],[],0,1,4,"['vaccinenationalism', 'econtwitter']",[],https://twitter.com/toxvaerd1/status/1355954052987822081,False,,0,,,,,,,,[],,,,
1355950743040061442,1355950743040061442,2021-01-31 18:47:04 UTC,2021-01-31,18:47:04,+0000,26886087,asymptosis,Steve Roth,,"I just learned a new word: heterologous. ""Derived from a different organism.""  Nicely describes many branches of heterodox and pluralistic econ, vis-a-vis mainstream/orthodox. #EconTwitter?",en,[],[],[],1,1,2,['econtwitter'],[],https://twitter.com/asymptosis/status/1355950743040061442,False,,0,,,,,,,,[],,,,
1355942746226307077,1355105510270361601,2021-01-31 18:15:17 UTC,2021-01-31,18:15:17,+0000,282771328,gert_woellmann,Gert Wöllmann,,"@T_Waffenschmidt @Kinchkun @Arnd_Diringer @AndreasKemper @BergheimJeff So mancher Ökonom fordert merkwürdige Dinge … ich will keine Namen nennen, aber (nicht nur) #EconTwitter ist voll von merkwürdigen undurchdachten Forderungen ... :)",de,[],[],[],0,1,2,['econtwitter'],[],https://twitter.com/Gert_Woellmann/status/1355942746226307077,False,,0,,,,,,,,"[{'screen_name': 'T_Waffenschmidt', 'name': 'Tilmann Waffenschmidt', 'id': '1260709419580522499'}, {'screen_name': 'Kinchkun', 'name': 'Kinch', 'id': '1165290582'}, {'screen_name': 'Arnd_Diringer', 'name': 'Arnd Diringer', 'id': '3467946681'}, {'screen_name': 'AndreasKemper', 'name': 'AndreasKemper', 'id': '16097514'}, {'screen_name': 'BergheimJeff', 'name': 'Jeff Bergheim', 'id': '1234060130574049281'}]",,,,
1355939902064648201,1355939902064648201,2021-01-31 18:03:59 UTC,2021-01-31,18:03:59,+0000,72373813,os_mitchell,Frau Professor Dr. Dr. Dr. Olivia S. Mitchell,,#EconTwitter - looking for good experiments where people select hypothetical asset allocations before &amp; after we explain risk/return. Any suggestions?,en,[],[],[],5,2,5,['econtwitter'],[],https://twitter.com/OS_Mitchell/status/1355939902064648201,False,,0,,,,,,,,[],,,,
1355933829027033089,1355933824459403269,2021-01-31 17:39:51 UTC,2021-01-31,17:39:51,+0000,1188951984012963840,fatimakramhayat,Fatima Akram Hayat,,"Estimating a first differences model helped reduce #omittedvariablebias in my regressions, and allowed me to control for all fixed school-level characteristics. #EconTwitter #AcademicTwitter",en,[],[],[],1,1,6,"['omittedvariablebias', 'econtwitter', 'academictwitter']",[],https://twitter.com/fatimakramhayat/status/1355933829027033089,False,,0,,,,,,,,[],,,,
1355929352391839754,1355929352391839754,2021-01-31 17:22:04 UTC,2021-01-31,17:22:04,+0000,360052655,aaron_hedlund,Aaron Hedlund,,"If anything like real life, then also the most energetic and enthusiastic addition to #EconTwitter!",en,[],[],[],1,1,9,['econtwitter'],[],https://twitter.com/aaron_hedlund/status/1355929352391839754,False,https://twitter.com/yfatihkarahan/status/1355922738972676098,0,,,,,,,,[],,,,
1355922738972676098,1355922738972676098,2021-01-31 16:55:47 UTC,2021-01-31,16:55:47,+0000,554822302,yfatihkarahan,Fatih Karahan,,Coolest addition to #EconTwitter: @DavidWiczer,en,"[{'screen_name': 'davidwiczer', 'name': 'david wiczer', 'id': '1355906594677075970'}]",[],[],3,3,28,['econtwitter'],[],https://twitter.com/yfatihkarahan/status/1355922738972676098,False,,0,,,,,,,,[],,,,
1355917664305164299,1355917664305164299,2021-01-31 16:35:37 UTC,2021-01-31,16:35:37,+0000,1258395358985682944,econd47,Market Design Community,,"The schedule for this week's seminars has five talks by @fkojima79 in @VMDSeminar, P. Onuchic (@OnuWeiss) and K. Desaratha in Not the 2021 Theory Market, K. Teramoto in @CETC_Econ, and @Aaroth in @Games_Seminar. Check out the timetable 👇👇👇 #EconTwitter  https://t.co/mwvEZyDUl1",en,"[{'screen_name': 'fkojima79', 'name': 'fuhito kojima', 'id': '197936466'}, {'screen_name': 'vmdseminar', 'name': 'virtual market design seminar', 'id': '1263770279945424897'}, {'screen_name': 'onuweiss', 'name': 'paula + josh', 'id': '1156317402453463043'}, {'screen_name': 'cetc_econ', 'name': 'cetc (canadian economic theory conference)', 'id': '1334935672918921218'}, {'screen_name': 'aaroth', 'name': 'aaron roth', 'id': '5850692'}, {'screen_name': 'games_seminar', 'name': 'games, decisions & networks seminar series', 'id': '1349078723895709697'}]",[],['https://pbs.twimg.com/media/EtEtmS8XMAQu-5m.png'],1,3,13,['econtwitter'],[],https://twitter.com/econD47/status/1355917664305164299,False,,1,https://pbs.twimg.com/media/EtEtmS8XMAQu-5m.png,,,,,,,[],,,,
