id,conversation_id,created_at,date,time,timezone,user_id,username,name,place,tweet,language,mentions,urls,photos,replies_count,retweets_count,likes_count,hashtags,cashtags,link,retweet,quote_url,video,thumbnail,near,geo,source,user_rt_id,user_rt,retweet_id,reply_to,retweet_date,translate,trans_src,trans_dest
1356963856057262080,1356963856057262080,2021-02-03 13:52:49 UTC,2021-02-03,13:52:49,+0000,867914691783340032,eugen_dimant,Eugen Dimant,,Weird #nudge: agreed 5 days ago to review a paper — today I get an email saying ‘review due soon’ - deadline is on March 5... 🤔  Do we have any evidence indicating that early reminders work better than late ones? @c_a_gravert @erezyoeli @eckelcc @RFisman   #EconTwitter  https://t.co/op8IliE4wK,en,"[{'screen_name': 'c_a_gravert', 'name': 'christina gravert', 'id': '800846501563887616'}, {'screen_name': 'erezyoeli', 'name': 'erez yoeli', 'id': '1852557714'}, {'screen_name': 'eckelcc', 'name': 'catherine eckel', 'id': '3877946357'}, {'screen_name': 'rfisman', 'name': 'ray fisman', 'id': '1279376011'}]",[],['https://pbs.twimg.com/media/EtTnbv7WYAInGQ4.jpg'],2,1,3,"['nudge', 'econtwitter']",[],https://twitter.com/eugen_dimant/status/1356963856057262080,False,,1,https://pbs.twimg.com/media/EtTnbv7WYAInGQ4.jpg,,,,,,,[],,,,
1356959311054970880,1356959311054970880,2021-02-03 13:34:45 UTC,2021-02-03,13:34:45,+0000,1354889179,jecacarpediem,Jelena Todorović,,"I am very excited about this event and proud of my WiE team for keeping up the great work on spreading the awareness, truthfully informing and actively improving the environment for up-coming generations of women in economics, business and policy 🙌 #EconTwitter",en,[],[],[],0,0,3,['econtwitter'],[],https://twitter.com/jecacarpediem/status/1356959311054970880,False,https://twitter.com/Women_in_Econ/status/1356881531940335620,0,,,,,,,,[],,,,
1356958707351969800,1356958707351969800,2021-02-03 13:32:21 UTC,2021-02-03,13:32:21,+0000,785183076,j_c_suarez,Juan Carlos Suárez,,"Really enjoyed listening to @SandyDarity and @DarrickHamilton on @NPRCodeSwitch ! While the discussion is about reparations, it is also relevant for conversations around diversity/inclusion. Definitely recommended for people on #EconTwitter who grapple with  issues of D&amp;I.",en,"[{'screen_name': 'sandydarity', 'name': 'sandy darity, retweets do not mean endorsement.', 'id': '408036857'}, {'screen_name': 'darrickhamilton', 'name': 'darrick hamilton', 'id': '427059715'}, {'screen_name': 'nprcodeswitch', 'name': ""npr's code switch"", 'id': '1117836660'}]",[],[],2,2,10,['econtwitter'],[],https://twitter.com/J_C_Suarez/status/1356958707351969800,False,,0,,,,,,,,[],,,,
1356957972132462594,1356957972132462594,2021-02-03 13:29:26 UTC,2021-02-03,13:29:26,+0000,1351314996727316482,regscurbec,Regional Science and Urban Economics,,"New in #RSUE: ""Minimum Wages and Housing Rents: Theory and Evidence""  https://t.co/Zkhvj017Bc #UrbanEcon #EconTwitter",en,[],['https://ift.tt/3pLo2Q6'],[],0,4,8,"['rsue', 'urbanecon', 'econtwitter']",[],https://twitter.com/RegScUrbEc/status/1356957972132462594,False,,0,,,,,,,,[],,,,
1356954397679509506,1356954397679509506,2021-02-03 13:15:14 UTC,2021-02-03,13:15:14,+0000,3087070036,oxrepjournal,Oxford Econ Policy,,"What do we know about gender stereotyping and bias?  @mardelgiu and @sjbEconobot examine the literature on gender discrimination, and perform an experiment illustrating unconscious bias, in our new Gender Economics issue:   https://t.co/OZiFL8G89d #EconTwitter  https://t.co/IyTzpdhpCM",en,"[{'screen_name': 'mardelgiu', 'name': 'marina della giusta', 'id': '3252769270'}, {'screen_name': 'sjbeconobot', 'name': 'steven bosworth – economist?', 'id': '979465094554890240'}]",['https://academic.oup.com/oxrep/article/36/4/925/6124290'],['https://pbs.twimg.com/media/EtTe1X9XEAEaD8u.png'],0,2,2,['econtwitter'],[],https://twitter.com/OxrepJournal/status/1356954397679509506,False,,1,https://pbs.twimg.com/media/EtTe1X9XEAEaD8u.png,,,,,,,[],,,,
1356952321058607105,1356952321058607105,2021-02-03 13:06:58 UTC,2021-02-03,13:06:58,+0000,1204062353924468736,joshuakwilde,Joshua Wilde,,"Our paper using Google data made state-specific predictions for the effect of COVID-19 on monthly birthrates through Feb 2021.  Thanks to @familyunequal, we can assess how well we did for a few states for December! @MPIDRnews @s_lohmann_ @veen1027 #EconTwitter #PopTwitter  1/3",en,"[{'screen_name': 'familyunequal', 'name': 'philip n cohen', 'id': '38047391'}, {'screen_name': 'mpidrnews', 'name': 'mpidr', 'id': '573691525'}, {'screen_name': 's_lohmann_', 'name': 'sophie lohmann', 'id': '1237356271025741826'}, {'screen_name': 'veen1027', 'name': 'wei chen', 'id': '127522944'}]",[],[],1,3,6,"['econtwitter', 'poptwitter']",[],https://twitter.com/JoshuaKWilde/status/1356952321058607105,False,,0,,,,,,,,[],,,,
1356951201326247937,1356951201326247937,2021-02-03 13:02:31 UTC,2021-02-03,13:02:31,+0000,905699310532263936,oxfordesh,Oxford Economic & Social History,,.@M_Avaro starts today's #oxeshgradseminar on GBP in the Bretton Woods period with a suitably undead 🧟‍♂️ image #econhist #EconTwitter  https://t.co/87e5APwQzL,en,"[{'screen_name': 'm_avaro', 'name': 'maylis avaro', 'id': '2591394654'}]",[],['https://pbs.twimg.com/media/EtTbo9oXAAEMF3n.jpg'],1,3,2,"['oxeshgradseminar', 'econhist', 'econtwitter']",[],https://twitter.com/OxfordESH/status/1356951201326247937,False,,1,https://pbs.twimg.com/media/EtTbo9oXAAEMF3n.jpg,,,,,,,[],,,,
1356948522432671745,1356948522432671745,2021-02-03 12:51:53 UTC,2021-02-03,12:51:53,+0000,1195018824053067776,christinagore13,Christina Gore,,Woke up this morning to an email that an article had been accepted after two round of revisions!!! This is my first published article! How did you celebrate your first publication? #EconTwitter #AcademicTwitter,en,[],[],[],5,0,30,"['econtwitter', 'academictwitter']",[],https://twitter.com/ChristinaGore13/status/1356948522432671745,False,,0,,,,,,,,[],,,,
1356945430500753409,1356945430500753409,2021-02-03 12:39:36 UTC,2021-02-03,12:39:36,+0000,1025538004167864321,itsafronomics,Anna Gifty says #BlackWomenBest,,#SACE2021 speaker line-up is 🔥 #AcademicTwitter #EconTwitter,en,[],[],[],0,1,3,"['sace2021', 'academictwitter', 'econtwitter']",[],https://twitter.com/itsafronomics/status/1356945430500753409,False,https://twitter.com/SadieCollective/status/1356629393595133953,0,,,,,,,,[],,,,
1356941016629190659,1356941016629190659,2021-02-03 12:22:03 UTC,2021-02-03,12:22:03,+0000,1548618854,austnnchols,Austin Nichols,,Am I the last person on #EconTwitter to discover @KirbyKNielsen has an ingenious haiku abstract for every paper at  https://t.co/YaJNVqA3u7 (and think everyone should emulate this)?,en,"[{'screen_name': 'kirbyknielsen', 'name': 'kirby nielsen', 'id': '1098380616129642498'}]",['https://kirbyknielsen.com/research/'],[],2,1,9,['econtwitter'],[],https://twitter.com/AustnNchols/status/1356941016629190659,False,,0,,,,,,,,[],,,,
1356939281017823232,1356939281017823232,2021-02-03 12:15:09 UTC,2021-02-03,12:15:09,+0000,15342208,voxeu,VoxEU,,"“Local elites, especially large landowners, played an important role in boosting #Fascist Party activity and support in #Italy” show @DrDaronAcemoglu et al. who explore the link between the threat of #Socialism and Mussolini’s rise to power:  https://t.co/Tw3b3pcsjz #EconTwitter  https://t.co/IqGHxZBKFK",en,"[{'screen_name': 'drdaronacemoglu', 'name': 'daron acemoglu', 'id': '2163559417'}]",['http://ow.ly/o57Y50DpSEE'],['https://pbs.twimg.com/media/EtTRFe7WgAMqx74.jpg'],0,5,14,"['fascist', 'italy', 'socialism', 'econtwitter']",[],https://twitter.com/voxeu/status/1356939281017823232,False,,1,https://pbs.twimg.com/media/EtTRFe7WgAMqx74.jpg,,,,,,,[],,,,
1356938749674983424,1356938749674983424,2021-02-03 12:13:03 UTC,2021-02-03,12:13:03,+0000,30003893,eckhoffandresen,Martin E. Andresen,,New paper in The Econometrics Journal with @MHuberEcon: “Instrument-based estimation with binarized treatments: Issues and tests for the exclusion restriction”! We explore identifying assumptions and testable implications with IV when treatment is binarized.  1/n #EconTwitter,en,"[{'screen_name': 'mhuberecon', 'name': 'martinhuber', 'id': '1176867972163559424'}]",[],[],1,3,8,['econtwitter'],[],https://twitter.com/eckhoffandresen/status/1356938749674983424,False,,0,,,,,,,,[],,,,
1356932955692752896,1356932955692752896,2021-02-03 11:50:01 UTC,2021-02-03,11:50:01,+0000,1011023633177817090,claudianoneto,Claudiano Neto,,"Receiving useful and respectful revisions should be the standard in the paper's submitting process. Fortunately, I received it in my last submission.   #EconTwitter",en,[],[],[],0,1,2,['econtwitter'],[],https://twitter.com/ClaudianoNeto/status/1356932955692752896,False,,0,,,,,,,,[],,,,
1356923180045250562,1356923180045250562,2021-02-03 11:11:11 UTC,2021-02-03,11:11:11,+0000,824288526695071745,hasheconomy,#Economy,,Federal Govt restructures NCX with the aim of making the price of farm produce/foods much better.....  NCX stands for Nigerian Commodities Exchange.  @MBuhari @ProfOsinbajo @FarmGabed @cenbank    #economy #Marketing #cbnews #EconTwitter #Bitcoin #Fulaniherdsmen #Fulani #NSPPD  https://t.co/5J7fGd1Ogx,en,"[{'screen_name': 'mbuhari', 'name': 'muhammadu buhari', 'id': '2936714848'}, {'screen_name': 'profosinbajo', 'name': 'prof yemi osinbajo', 'id': '2914442873'}, {'screen_name': 'farmgabed', 'name': 'gabed farms nigeria ltd', 'id': '1298885690265137152'}, {'screen_name': 'cenbank', 'name': 'central bank of nigeria', 'id': '16182044'}]",[],[],0,6,5,"['economy', 'marketing', 'cbnews', 'econtwitter', 'bitcoin', 'fulaniherdsmen', 'fulani', 'nsppd']",[],https://twitter.com/HashEconomy/status/1356923180045250562,False,,1,https://pbs.twimg.com/ext_tw_video_thumb/1356920952328708097/pu/img/Ei19d21KMjimRyGY.jpg,,,,,,,[],,,,
1356920711084969985,1356920711084969985,2021-02-03 11:01:22 UTC,2021-02-03,11:01:22,+0000,1176867972163559424,mhuberecon,MartinHuber,,"In IV regression, converting multivalued treatments (eg education) to binary ones(high/low education) may violate the #exclusionrestriction. Our publication (with  @eckhoffandresen) provides conditions for identification+testable implications: https://t.co/6cJ2bLZQb6 #Econtwitter",en,"[{'screen_name': 'eckhoffandresen', 'name': 'martin e. andresen', 'id': '30003893'}]",['https://academic.oup.com/ectj/advance-article/doi/10.1093/ectj/utab002/6126343?guestAccessKey=6b5fc63a-7bf7-4a96-a1a5-48095444abb9'],[],4,10,32,"['exclusionrestriction', 'econtwitter']",[],https://twitter.com/MHuberEcon/status/1356920711084969985,False,,0,,,,,,,,[],,,,
1356916590843944960,1356916590843944960,2021-02-03 10:45:00 UTC,2021-02-03,10:45:00,+0000,481338876,ubeconomics,UB School of Economics,,"🆕#WorkingPaper: ""Global effects of US uncertainty: real and financial shocks on real and financial markets"" by José E. Gómez-González, Jorge Hirs-Garzon, and Jorge Mario Uribe Gil🌎   Full text👉🏻  https://t.co/g9AfqnYT5n   #EconTwitter #Uncertainty #CapitalMarket #BusinessCycles  https://t.co/RMoCTUYHJE",es,[],['http://bit.ly/3pQiljs'],['https://pbs.twimg.com/media/ErKrFyPXYAAqQDt.png'],0,1,2,"['workingpaper', 'econtwitter', 'uncertainty', 'capitalmarket', 'businesscycles']",[],https://twitter.com/ubeconomics/status/1356916590843944960,False,,1,https://pbs.twimg.com/media/ErKrFyPXYAAqQDt.png,,,,,,,[],,,,
1356909095459168262,1356909095459168262,2021-02-03 10:15:13 UTC,2021-02-03,10:15:13,+0000,481338876,ubeconomics,UB School of Economics,,📣Do you want to know more about the #MSc in #Economics at @UniBarcelona? You are in the right place! We are setting up an online Q&amp;A session with programme director @VicenteRoyuela for you!  📅 Feb 17th  ⏰ 16:00 CET  ⚠️ Registration required  https://t.co/1mJBFMJAN8 #EconTwitter  https://t.co/DmkNZDQvaW,en,"[{'screen_name': 'unibarcelona', 'name': 'universitat de barcelona', 'id': '188725330'}, {'screen_name': 'vicenteroyuela', 'name': 'vicente royuela', 'id': '2188531296'}]",['https://bit.ly/2LZKjet'],['https://pbs.twimg.com/media/EtSZ-FkXcAAr95l.jpg'],0,2,4,"['msc', 'economics', 'econtwitter']",[],https://twitter.com/ubeconomics/status/1356909095459168262,False,,1,https://pbs.twimg.com/media/EtSZ-FkXcAAr95l.jpg,,,,,,,[],,,,
1356905937630552066,1356905937630552066,2021-02-03 10:02:40 UTC,2021-02-03,10:02:40,+0000,302709105,ramanuppalprof,Raman Uppal,,Excellent article on the unintended consequences of a policy that wishes to level the playing field across genders but its effect is to do the opposite. #genderinequality #inequality #EconTwitter,en,[],[],[],0,1,2,"['genderinequality', 'inequality', 'econtwitter']",[],https://twitter.com/RamanUppalProf/status/1356905937630552066,False,https://twitter.com/dinapomeranz/status/1356897642366832640,0,,,,,,,,[],,,,
1356898691546812416,1356898691546812416,2021-02-03 09:33:52 UTC,2021-02-03,09:33:52,+0000,501861132,oecdeconomy,OECD Economics,,"Despite an unprecedented recession in 2020, #Chile is set for a gradual recovery. Check out our @OECD Economic Survey to see the policies to prioritise for a strong and inclusive recovery, launching Thursday 4 Feb @14h (CET).  https://t.co/GybVpg5JGl #EconomicSurvey #EconTwitter  https://t.co/jZK79Ot8Bf",en,"[{'screen_name': 'oecd', 'name': 'oecd ➡️ better policies for better lives', 'id': '25390350'}, {'screen_name': '14h', 'name': 'hossam elden mahmmud', 'id': '283038629'}]",['https://oe.cd/chile'],['https://pbs.twimg.com/media/EtSrkHBXEAA9oci.jpg'],0,5,11,"['chile', 'economicsurvey', 'econtwitter']",[],https://twitter.com/OECDeconomy/status/1356898691546812416,False,,1,https://pbs.twimg.com/media/EtSrkHBXEAA9oci.jpg,,,,,,,[],,,,
1356896111190044675,1356896111190044675,2021-02-03 09:23:37 UTC,2021-02-03,09:23:37,+0000,1110146189196955648,oxforddemsci,Leverhulme Centre for Demographic Science,,"LCDS Deputy Director @drjenndowd, @chloergibbs &amp; @lindsleininger on schools &amp; #COVID19 in @AmSciMag. @LeverhulmeTrust #schoolsreopening #poptwitter #econtwitter",en,"[{'screen_name': 'drjenndowd', 'name': 'dr. jenn dowd', 'id': '18089975'}, {'screen_name': 'chloergibbs', 'name': 'chloe gibbs', 'id': '874694894'}, {'screen_name': 'lindsleininger', 'name': 'lindsey leininger', 'id': '2612769967'}, {'screen_name': 'amscimag', 'name': 'american scientist', 'id': '112796409'}, {'screen_name': 'leverhulmetrust', 'name': 'the leverhulme trust', 'id': '76963627'}]",[],[],0,1,5,"['covid19', 'schoolsreopening', 'poptwitter', 'econtwitter']",[],https://twitter.com/OxfordDemSci/status/1356896111190044675,False,https://twitter.com/AmSciMag/status/1355889847089696771,0,,,,,,,,[],,,,
1356889700196352001,1356889700196352001,2021-02-03 08:58:08 UTC,2021-02-03,08:58:08,+0000,1220307216512823297,uamteh,TEH_UAM,,"Very interesting list of #HealthEconomics seminars, please find below a link to sign up and get the Zoom link  @C__Kronenberg  #EconTwitter",en,"[{'screen_name': 'c__kronenberg', 'name': 'christoph kronenberg', 'id': '1171679131165253632'}]",[],[],0,2,3,"['healtheconomics', 'econtwitter']",[],https://twitter.com/UamTeh/status/1356889700196352001,False,https://twitter.com/C__Kronenberg/status/1356882319974551554,0,,,,,,,,[],,,,
1356882319974551554,1356882319974551554,2021-02-03 08:28:49 UTC,2021-02-03,08:28:49,+0000,1171679131165253632,c__kronenberg,Christoph Kronenberg,,#EconTwitter the VMESS schedule until the end of June is now finalized! Not already on the mailing list? Sign up here to get the Zoom links:  https://t.co/xTQ9CEpBNo  More info:  https://t.co/vw8fF2iAQs (cc: co-host @ana_c_moura)  https://t.co/N8wwWqD516,en,"[{'screen_name': 'ana_c_moura', 'name': 'ana moura', 'id': '1537533121'}]","['https://forms.gle/9p53tnqf84DopVhE8', 'https://sites.google.com/view/christoph-kronenberg/home/vmess']",['https://pbs.twimg.com/media/EtSbtMDXMAAXEsR.png'],0,7,16,['econtwitter'],[],https://twitter.com/C__Kronenberg/status/1356882319974551554,False,,1,https://pbs.twimg.com/media/EtSbtMDXMAAXEsR.png,,,,,,,[],,,,
1356881531940335620,1356881531940335620,2021-02-03 08:25:41 UTC,2021-02-03,08:25:41,+0000,1164107634133393408,women_in_econ,Women in Economics Initiative,,"The Women in Economics Initiative, in partnership with the @YPFPBrussels present a webinar on ‘Bridging the Gender Data Gap’.  👉This is an event only for our WiE members only. Register here:  https://t.co/HtiNecC42Z #EconTwitter  https://t.co/qxeHtPfgsr",en,"[{'screen_name': 'ypfpbrussels', 'name': 'ypfp brussels', 'id': '568122033'}]",['https://www.eventbrite.co.uk/e/bridging-the-gender-data-gap-tickets-139697542109'],['https://pbs.twimg.com/media/EtScj8xXUAAbr4d.jpg'],0,8,13,['econtwitter'],[],https://twitter.com/Women_in_Econ/status/1356881531940335620,False,,1,https://pbs.twimg.com/media/EtScj8xXUAAbr4d.jpg,,,,,,,[],,,,
1356880971946201088,1356880971946201088,2021-02-03 08:23:27 UTC,2021-02-03,08:23:27,+0000,357594498,mariosa_com,Mariarosaria Comunale,,My paper with Justas and Povilas available here🔽 #EconTwitter #Gravity #Trade,en,[],[],[],0,5,13,"['econtwitter', 'gravity', 'trade']",[],https://twitter.com/Mariosa_Com/status/1356880971946201088,False,https://twitter.com/Lietuvosbankas/status/1348909335909433344,0,,,,,,,,[],,,,
1356879242806575107,1356879242806575107,2021-02-03 08:16:35 UTC,2021-02-03,08:16:35,+0000,1245732103779692544,ansolassen,Anne Sophie Lassen,,"Hi #EconTwitter Reading the mass lay-off/plant closure literature, but I found very few papers w data from outside North/West Europe and 🇺🇸/🇨🇦 Who can help?  Main interest is labor market, but also ‘spillovers’. I found papers on crime in Brazil and child edu in China -🤞🏻for more",en,[],[],[],2,3,4,['econtwitter'],[],https://twitter.com/AnSoLassen/status/1356879242806575107,False,,0,,,,,,,,[],,,,
1356878868041388033,1356878868041388033,2021-02-03 08:15:06 UTC,2021-02-03,08:15:06,+0000,3087070036,oxrepjournal,Oxford Econ Policy,,"Innovations are likely to affect men and women in different ways, something rarely explored in research on automation.  In our new issue, Guido Matias Cortes, Ana Oliveira, and Anna Salomons explore the gendered effects automation may have:    https://t.co/RooviaKCLi #EconTwitter  https://t.co/sjVnPo6WfG",en,[],['https://academic.oup.com/oxrep/article/36/4/903/6124297'],['https://pbs.twimg.com/media/EtSaI9gXAAE2W8B.png'],0,2,3,['econtwitter'],[],https://twitter.com/OxrepJournal/status/1356878868041388033,False,,1,https://pbs.twimg.com/media/EtSaI9gXAAE2W8B.png,,,,,,,[],,,,
1356875336638738444,1356875298856435712,2021-02-03 08:01:04 UTC,2021-02-03,08:01:04,+0000,1153198855548260353,econtweetingbot,EconTweeting Bot,,"Yesterday, @AchimTruger's tweet was quoted most often by the other economists on the #EconTwitter list.  https://t.co/Ur693fkwQJ",en,"[{'screen_name': 'achimtruger', 'name': 'achim truger', 'id': '3352338183'}]",['https://twitter.com/AchimTruger/status/1356621940123918340'],[],1,2,2,['econtwitter'],[],https://twitter.com/EconTweetingBot/status/1356875336638738444,False,https://twitter.com/AchimTruger/status/1356621940123918340,0,,,,,,,,[],,,,
1356875298856435712,1356875298856435712,2021-02-03 08:00:55 UTC,2021-02-03,08:00:55,+0000,1153198855548260353,econtweetingbot,EconTweeting Bot,,"Welcome to the daily review of the #EconTwitter list by @MakronomMagazin, today with tweets by @APeichl, @AchimTruger and @BachmannRudi. #rstats  https://t.co/dFmuHdVRve",en,"[{'screen_name': 'makronommagazin', 'name': 'makronom', 'id': '2994746043'}, {'screen_name': 'apeichl', 'name': 'andreas peichl', 'id': '3130999965'}, {'screen_name': 'achimtruger', 'name': 'achim truger', 'id': '3352338183'}, {'screen_name': 'bachmannrudi', 'name': 'rudi bachmann', 'id': '905524795252625408'}]",[],['https://pbs.twimg.com/media/EtSW4wPXEAAQTs0.jpg'],1,3,5,"['econtwitter', 'rstats']",[],https://twitter.com/EconTweetingBot/status/1356875298856435712,False,,1,https://pbs.twimg.com/media/EtSW4wPXEAAQTs0.jpg,,,,,,,[],,,,
1356868833336770561,1356868833336770561,2021-02-03 07:35:13 UTC,2021-02-03,07:35:13,+0000,806975237766135813,mischrodi,Michael Schrodi,,"Mal anderes Format, aber wichtiges Thema. Nach #Corona: Alternativen zu #Sozialabbau, #Privatisierung #Investitionsverzicht. Mit @KuehniKev @PhilippaSigl @NowaboFM @AchimTruger @CanselK @SDullien @GustavAHorn #EconTwitter #clubhouse #finanzen #Wirtschaft   https://t.co/lc1th3PTy0",de,"[{'screen_name': 'kuehnikev', 'name': 'kevin kühnert 😷', 'id': '2764750474'}, {'screen_name': 'philippasigl', 'name': 'philippa sigl-glöckner', 'id': '3032109904'}, {'screen_name': 'nowabofm', 'name': 'norbert walter-borjans', 'id': '706536761279782912'}, {'screen_name': 'achimtruger', 'name': 'achim truger', 'id': '3352338183'}, {'screen_name': 'canselk', 'name': 'cansel kiziltepe', 'id': '23248102'}, {'screen_name': 'sdullien', 'name': 'sebastian dullien', 'id': '499717174'}, {'screen_name': 'gustavahorn', 'name': 'gustav a. horn', 'id': '1185354854'}]",['https://www.joinclubhouse.com/event/mZNJpz1Q'],[],0,3,7,"['corona', 'sozialabbau', 'privatisierung', 'investitionsverzicht', 'econtwitter', 'clubhouse', 'finanzen', 'wirtschaft']",[],https://twitter.com/mischrodi/status/1356868833336770561,False,,0,,,,,,,,[],,,,
1356864943610425345,1356864943610425345,2021-02-03 07:19:46 UTC,2021-02-03,07:19:46,+0000,1199154507223093249,abhiroopmukho,Abhiroop Mukhopadhyay,,"Looking forward to a month of interesting webinars at #EconISIDelhi. Every Friday. This Friday (5th Feb) Abhishek Kumar from @Igidr_Mumbai speaks at 1500 HRS  on ""Effects of productivity growth on domestic savings across countries"" #EconTwitter  https://t.co/eoxWBcD3AS",en,"[{'screen_name': 'igidr_mumbai', 'name': 'igidr', 'id': '253500669'}]",[],['https://pbs.twimg.com/media/EtSNTWcUcAIcXZh.jpg'],0,7,19,"['econisidelhi', 'econtwitter']",[],https://twitter.com/AbhiroopMukho/status/1356864943610425345,False,,1,https://pbs.twimg.com/media/EtSNTWcUcAIcXZh.jpg,,,,,,,[],,,,
1356860210007130115,1356860210007130115,2021-02-03 07:00:57 UTC,2021-02-03,07:00:57,+0000,3032109904,philippasigl,Philippa Sigl-Glöckner,,"++Fr, 19 Uhr++ #EconTwitter goes Clubhouse 🎧",en,[],[],[],1,4,22,['econtwitter'],[],https://twitter.com/PhilippaSigl/status/1356860210007130115,False,https://twitter.com/sdullien/status/1356710307587047425,0,,,,,,,,[],,,,
1356833494303916032,1356833494303916032,2021-02-03 05:14:48 UTC,2021-02-03,05:14:48,+0000,405472617,inapraetorius,Ina Praetorius,,Uta Meier-Gräwe und ich haben jetzt insgesamt 8 #economyiscare Kolumnen im @Handelsblatt geschrieben. Wann beginnt die Debatte? @PeterBofinger @jsuedekum @goldmannerdmann @EconomicEthics @DEhnts @norberthaering @AchimTruger @tricks_y @GrimmVeronika @MonikaSchnitzer #EconTwitter,de,"[{'screen_name': 'handelsblatt', 'name': 'handelsblatt', 'id': '5776022'}, {'screen_name': 'peterbofinger', 'name': 'peter bofinger', 'id': '888695305876713472'}, {'screen_name': 'jsuedekum', 'name': 'jens suedekum', 'id': '258353673'}, {'screen_name': 'goldmannerdmann', 'name': 'mathias binswanger', 'id': '987255434'}, {'screen_name': 'economicethics', 'name': 'seth', 'id': '2981738470'}, {'screen_name': 'dehnts', 'name': 'dirk ehnts', 'id': '916945628'}, {'screen_name': 'norberthaering', 'name': 'norbert häring', 'id': '2994558921'}, {'screen_name': 'achimtruger', 'name': 'achim truger', 'id': '3352338183'}, {'screen_name': 'tricks_y', 'name': 'hendrik theine', 'id': '2530943429'}, {'screen_name': 'grimmveronika', 'name': 'veronika grimm', 'id': '4359212357'}, {'screen_name': 'monikaschnitzer', 'name': 'monika schnitzer', 'id': '998503348369272832'}]",[],[],1,2,3,"['economyiscare', 'econtwitter']",[],https://twitter.com/InaPraetorius/status/1356833494303916032,False,https://twitter.com/InaPraetorius/status/1353699002194272258,0,,,,,,,,[],,,,
1356818568684445697,1356818568684445697,2021-02-03 04:15:29 UTC,2021-02-03,04:15:29,+0000,314734325,ben_golub,Ben Golub,,The original #econtwitter shitpost  https://t.co/tXiL5RyniY,en,[],[],['https://pbs.twimg.com/media/EtRjGJbXAAAEdlD.jpg'],5,7,41,['econtwitter'],[],https://twitter.com/ben_golub/status/1356818568684445697,False,,1,https://pbs.twimg.com/media/EtRjGJbXAAAEdlD.jpg,,,,,,,[],,,,
1356814572343107585,1356814572343107585,2021-02-03 03:59:37 UTC,2021-02-03,03:59:37,+0000,1237274606769070080,sgc_econ,Santiago García-Couto,,"This is a great opportunity for all graduate students. You can still sign up!   Plus, I promise you will have a great TA for Lecture 3 (Structural Transformation - Key Theories).  STEG Virtual Course on ""Key Concepts in Macro Development""  #EconTwitter   https://t.co/gG6dRxRMgf",en,[],['https://steg.cepr.org/events/stegvirtualcourse2021'],[],1,2,10,['econtwitter'],[],https://twitter.com/sgc_econ/status/1356814572343107585,False,,0,,,,,,,,[],,,,
1356796820375142407,1356796820375142407,2021-02-03 02:49:04 UTC,2021-02-03,02:49:04,+0000,525048177,fromfiretotable,"Davíd G. Martínez, Ph.D.",,"Related if you haven't submitted @jofedhr consider doing so. Especially #EconTwitter peeps at the intersection of HR &amp; ED. Working with reviewer comments has been so straight forward, purposeful. The press is on top of things. The editors K-20 respect the work. #AcademicTwitter",en,"[{'screen_name': 'jofedhr', 'name': 'journal of education human resources', 'id': '941015651963101185'}]",[],[],0,2,3,"['econtwitter', 'academictwitter']",[],https://twitter.com/FromFireToTable/status/1356796820375142407,False,,0,,,,,,,,[],,,,
