id,conversation_id,created_at,date,time,timezone,user_id,username,name,place,tweet,language,mentions,urls,photos,replies_count,retweets_count,likes_count,hashtags,cashtags,link,retweet,quote_url,video,thumbnail,near,geo,source,user_rt_id,user_rt,retweet_id,reply_to,retweet_date,translate,trans_src,trans_dest
1354831738011320321,1354831738011320321,2021-01-28 16:40:32 UTC,2021-01-28,16:40:32,+0000,35203319,evankirstel,Evan Kirstel,,2020 was the #economy's worst year since 1946  https://t.co/DLvuAubqw6 #EconTwitter #EconomicRecovery #stimulus,en,[],['https://www.axios.com/gdp-fourth-quarter-b63627cc-59c4-47fd-a389-33501283be41.html?utm_campaign=organic&utm_medium=socialshare&utm_source=twitter'],[],0,2,2,"['economy', 'econtwitter', 'economicrecovery', 'stimulus']",[],https://twitter.com/EvanKirstel/status/1354831738011320321,False,,0,,,,,,,,[],,,,
1354830385641877509,1354830385641877509,2021-01-28 16:35:10 UTC,2021-01-28,16:35:10,+0000,12594872,cgdev,Center for Global Development,,"A compelling #economics abstract: leads with the question ❓, does some motivating 🙌, lays out the details 📑, and then concludes results 🎯.   Right?  👇 @DaveEvansPhD explores the perfect formula:  https://t.co/U2KCue3GKM #EconTwitter",en,"[{'screen_name': 'daveevansphd', 'name': 'david evans', 'id': '101264566'}]",['http://ow.ly/lwGQ50DkSsC'],[],0,1,3,"['economics', 'econtwitter']",[],https://twitter.com/CGDev/status/1354830385641877509,False,,0,,,,,,,,[],,,,
1354829770643693568,1354829770643693568,2021-01-28 16:32:43 UTC,2021-01-28,16:32:43,+0000,898367252914982912,dangiedeman,Dan Giedeman,,"So, #EconTwitter, where are we at with the Efficient Market Hypothesis these days?  🤪",en,[],[],[],1,1,2,['econtwitter'],[],https://twitter.com/DanGiedeman/status/1354829770643693568,False,,0,,,,,,,,[],,,,
1354829046815870981,1354829046815870981,2021-01-28 16:29:50 UTC,2021-01-28,16:29:50,+0000,1043549304,aledinola,Alessandro Di Nola,,These beautiful threads are the best part of #EconTwitter. Example here 👇,en,[],[],[],0,2,2,['econtwitter'],[],https://twitter.com/aledinola/status/1354829046815870981,False,https://twitter.com/SNageebAli/status/1354518293516836868,0,,,,,,,,[],,,,
1354823745106563073,1354823745106563073,2021-01-28 16:08:46 UTC,2021-01-28,16:08:46,+0000,1050181685705363456,sadiecollective,The Sadie Collective,,"Stay tuned! We are celebrating Black economists during Black History Month. Make sure to follow us on all platforms. IG: SadieCollective and of course, this Twitter. #EconTwitter",en,[],[],[],0,3,8,['econtwitter'],[],https://twitter.com/SadieCollective/status/1354823745106563073,False,https://twitter.com/thefantatraore/status/1354803332427165696,0,,,,,,,,[],,,,
1354822357303529475,1354822357303529475,2021-01-28 16:03:16 UTC,2021-01-28,16:03:16,+0000,867914691783340032,eugen_dimant,Eugen Dimant,,"🧨Updated Deadline 🧨  We accept submissions to our ‘Social Norms &amp; Behavior Change’ special issue at JEBO through 🗓March 14.  Open to interdisciplinary research using theory, empirics &amp; experiments.  More info 👇🏻 Pls spread the word @MicheleJGelfand #EconTwitter @katy_milkman",en,"[{'screen_name': 'michelejgelfand', 'name': 'michele j. gelfand', 'id': '1488525614'}, {'screen_name': 'katy_milkman', 'name': 'katy milkman', 'id': '1589179254'}]",[],[],0,4,3,['econtwitter'],[],https://twitter.com/eugen_dimant/status/1354822357303529475,False,https://twitter.com/eugen_dimant/status/1268195688569016321,0,,,,,,,,[],,,,
1354822082752770048,1354822082752770048,2021-01-28 16:02:10 UTC,2021-01-28,16:02:10,+0000,1110521407346216961,econ_tribute,ECONtribute,,Early career researchers: Check out the new interdisciplinary speaker series on norms and behavior change organised by our #ECONtribute Research Fellow @eugen_dimant:  https://t.co/VTqW7fNWyU  Next talk by @CBicchieri @penn_csnbd #econtwitter,en,"[{'screen_name': 'eugen_dimant', 'name': 'eugen dimant', 'id': '867914691783340032'}, {'screen_name': 'cbicchieri', 'name': 'cristina bicchieri', 'id': '183039547'}, {'screen_name': 'penn_csnbd', 'name': 'penn center for social norms & behavioral dynamics', 'id': '1131954366594703362'}]",['https://normsandbehavior.sas.upenn.edu/about-center/nobec-talks/'],[],0,1,3,"['econtribute', 'econtwitter']",[],https://twitter.com/ECON_tribute/status/1354822082752770048,False,,0,,,,,,,,[],,,,
1354816413110681600,1354816413110681600,2021-01-28 15:39:38 UTC,2021-01-28,15:39:38,+0000,70679266,moritzfritschle,Moritz Fritschle,,To have the opportunity at all and then to be able to apply for a Ph.D. position is somehow a sense of achievement for me. No matter how it turns out in the end. #econtwitter #AcademicChatter #PhD,en,[],[],[],1,1,3,"['econtwitter', 'academicchatter', 'phd']",[],https://twitter.com/MoritzFritschle/status/1354816413110681600,False,,0,,,,,,,,[],,,,
1354813489097805824,1354813489097805824,2021-01-28 15:28:01 UTC,2021-01-28,15:28:01,+0000,165818745,marcfabel,Marc Fabel,,"I am delighted to share that one chapter of my PhD thesis has been published in @JHealthEcon. In the paper, I assess the causal impact of the length of #MaternityLeave (ML) on children’s long-run health outcomes.   https://t.co/FHqxRVdh2T #EconTwitter   thread 👇 [1/10]",en,"[{'screen_name': 'jhealthecon', 'name': 'journal of health economics', 'id': '1014800713954811906'}]",['https://doi.org/10.1016/j.jhealeco.2021.102431'],[],2,1,10,"['maternityleave', 'econtwitter']",[],https://twitter.com/marcfabel/status/1354813489097805824,False,,0,,,,,,,,[],,,,
1354813125002891282,1354813125002891282,2021-01-28 15:26:34 UTC,2021-01-28,15:26:34,+0000,389797386,ellenhughescrom,Ell Hughes-Cromwick,,"And why we have to persist, #econtwitter, to make the case for science and analysis and focus on workers  and people on the margin who don't have the resources to combat these pollution challenges. Jobs and people, many thought all this was ""taken care of,"" but no, no.",en,[],[],[],0,1,2,['econtwitter'],[],https://twitter.com/EllenHughesCrom/status/1354813125002891282,False,https://twitter.com/EllenHughesCrom/status/1354811544811433991,0,,,,,,,,[],,,,
1354812360544854019,1354812360544854019,2021-01-28 15:23:32 UTC,2021-01-28,15:23:32,+0000,188657738,christianflatz,Christian Flatz,,Den Zusammenhängen zwischen Ursache und Wirkung auf der Spur: Wirtschaftsforscher Andreas Steinmayr #EconTwitter,de,[],[],[],0,1,3,['econtwitter'],[],https://twitter.com/christianflatz/status/1354812360544854019,False,https://twitter.com/uniinnsbruck/status/1354727971760840704,0,,,,,,,,[],,,,
1354811544811433991,1354811544811433991,2021-01-28 15:20:18 UTC,2021-01-28,15:20:18,+0000,389797386,ellenhughescrom,Ell Hughes-Cromwick,,"#econtwitter Public markets are public goods. We want them to be safe and sound. When we enter into these markets -- like air we breathe at the store, we desire safety. That is why regulations and Federal Reserve oversight of bubbles are needed, why we strive to trash pollution.",en,[],[],[],0,0,3,['econtwitter'],[],https://twitter.com/EllenHughesCrom/status/1354811544811433991,False,,0,,,,,,,,[],,,,
1354810332393312256,1354810332393312256,2021-01-28 15:15:29 UTC,2021-01-28,15:15:29,+0000,2363283914,erintroland,Erin Troland,,"TFW you finally apply the theory of git's version control to your actual coding, and it's not just a meaningless flowchart #EconTwitter  https://t.co/Bv0izEB5Yg",en,[],[],['https://pbs.twimg.com/tweet_video_thumb/Es1Az80UcAEiGPl.jpg'],0,0,2,['econtwitter'],[],https://twitter.com/erintroland/status/1354810332393312256,False,,1,https://pbs.twimg.com/tweet_video_thumb/Es1Az80UcAEiGPl.jpg,,,,,,,[],,,,
1354806621776429062,1354806621776429062,2021-01-28 15:00:44 UTC,2021-01-28,15:00:44,+0000,284112637,kansascityfed,Kansas City Fed,,"The latest #Ag Lending Update indicates that while the number of loans continued to trend downward, the average size of farm loans grew for the 2nd consecutive quarter.  https://t.co/sA0j8E3BKy #EconTwitter #Banking  https://t.co/ObuIwDimHB",en,[],['https://bit.ly/3p2ZNwj'],['https://pbs.twimg.com/media/Es09cQRU0AEU_eI.jpg'],0,4,4,"['ag', 'econtwitter', 'banking']",[],https://twitter.com/KansasCityFed/status/1354806621776429062,False,,1,https://pbs.twimg.com/media/Es09cQRU0AEU_eI.jpg,,,,,,,[],,,,
1354805260104081408,1354805260104081408,2021-01-28 14:55:19 UTC,2021-01-28,14:55:19,+0000,69942361,mclevenstein,Maggie Levenstein,,Share with your undergrad students who are thinking about #economics grad school. This is a great opportunity. #EconTwitter,en,[],[],[],0,3,3,"['economics', 'econtwitter']",[],https://twitter.com/MCLevenstein/status/1354805260104081408,False,https://twitter.com/AEAInformation/status/1354791340157112327,0,,,,,,,,[],,,,
1354804928414244868,1354803488841060360,2021-01-28 14:54:00 UTC,2021-01-28,14:54:00,+0000,2592325153,claudia_sahm,Claudia Sahm RECOVERY FOR ALL,,logging off here. going for my walk. doing work today on the relief package. lot of requests recently on how to best structure automatic checks to people that would continue until recovery is economic complete. spreadsheet and writing therapy for me today. #EconTwitter 👇👇  https://t.co/AW8uAW2JUC,en,[],[],['https://pbs.twimg.com/tweet_video_thumb/Es075cZU0AQlwnY.jpg'],0,1,7,['econtwitter'],[],https://twitter.com/Claudia_Sahm/status/1354804928414244868,False,,1,https://pbs.twimg.com/tweet_video_thumb/Es075cZU0AQlwnY.jpg,,,,,,,[],,,,
1354804800534110212,1354804800534110212,2021-01-28 14:53:30 UTC,2021-01-28,14:53:30,+0000,795745110,moralesmeoqui,Jorge Morales Meoqui,,"#EconTwitter Despites its pretensions, economics has become less scientific and more susceptible to political influence, writes @alexwsalter  https://t.co/eUnBSnKuHj via @WSJ",en,"[{'screen_name': 'alexwsalter', 'name': 'alexander william salter', 'id': '1233378929433554944'}, {'screen_name': 'wsj', 'name': 'the wall street journal', 'id': '3108351'}]",['https://www.wsj.com/articles/how-economics-lost-itself-in-data-11611775849?reflink=desktopwebshare_twitter'],[],0,4,3,['econtwitter'],[],https://twitter.com/MoralesMeoqui/status/1354804800534110212,False,,0,,,,,,,,[],,,,
1354803986008694790,1354803986008694790,2021-01-28 14:50:15 UTC,2021-01-28,14:50:15,+0000,1118500484589989888,mpi_inno_comp,Max Planck Institute for Innovation & Competition,,Important question:  How much can U save if observing both in-network negotiated prices and cash prices when shopping for #HealthServices?  #EconTwitter #HealthEconTwitter  https://t.co/JOEqSJJOZ5,en,[],[],['https://pbs.twimg.com/media/Es05Pp4UYAcvR2n.jpg'],1,3,4,"['healthservices', 'econtwitter', 'healthecontwitter']",[],https://twitter.com/mpi_inno_comp/status/1354803986008694790,False,,1,https://pbs.twimg.com/media/Es05Pp4UYAcvR2n.jpg,,,,,,,[],,,,
1354802725934882821,1354802725934882821,2021-01-28 14:45:15 UTC,2021-01-28,14:45:15,+0000,1341008872207618048,empiricalindia,Empirical India Papers,,Agricultural productivity and the sectoral reallocation of labor in rural India  Kyle Emerick  #EconTwitter #agriculture #productivity #labor #rural #india   https://t.co/sNAhOo9lka,en,[],['https://www.sciencedirect.com/science/article/abs/pii/S0304387818311787'],[],0,1,2,"['econtwitter', 'agriculture', 'productivity', 'labor', 'rural', 'india']",[],https://twitter.com/EmpiricalIndia/status/1354802725934882821,False,,0,,,,,,,,[],,,,
1354800761603911687,1354800761603911687,2021-01-28 14:37:27 UTC,2021-01-28,14:37:27,+0000,705281586,dlmillimet,Daniel Millimet,,"This article claims that wages rose significantly after the 2017 tax cuts. Any actual evidence to support this? I don’t recall seeing anything ... is this political spin, another case of Granger causality gone awry, or something else? #EconTwitter    https://t.co/rXYcEhFnC8  https://t.co/ptERrF8DJg",en,[],['https://www.wsj.com/articles/how-economics-lost-itself-in-data-11611775849?st=6sjbd6br1tx1xvr&reflink=article_email_share'],['https://pbs.twimg.com/media/Es04HFtXMAAOAoj.jpg'],0,0,3,['econtwitter'],[],https://twitter.com/dlmillimet/status/1354800761603911687,False,,1,https://pbs.twimg.com/media/Es04HFtXMAAOAoj.jpg,,,,,,,[],,,,
1354799223838023683,1354799223838023683,2021-01-28 14:31:20 UTC,2021-01-28,14:31:20,+0000,2752163252,smithdanj1,Daniel J. Smith,,"""The tolerance for alternative/heterodox views is very limited, contributing to groupthink and to the divergence of the academic literature from real-world problems."" - Zingales ( https://t.co/ESlOL4dHT8) #EconTwitter",en,[],['https://pubs.aeaweb.org/doi/pdfplus/10.1257/pandp.20201002'],[],0,0,3,['econtwitter'],[],https://twitter.com/smithdanj1/status/1354799223838023683,False,,0,,,,,,,,[],,,,
1354795130218283008,1354795130218283008,2021-01-28 14:15:04 UTC,2021-01-28,14:15:04,+0000,1173527152098197505,heterodoxeconwu,heterodox_econ_wu,,"Join the free VHS webinar featuring our #researcher #KATHARINAMADER. You’ll have a chance to ask questions! Register now! Webinar: Politisches Café. Thema: Wie geht es weiter mit der Wirtschaft? 03.02.2021, 19:00-20:30 Uhr  ➡️ https://t.co/OMyApjqiNH  #EconTwitter #Corona  https://t.co/TNxM0Sz2ne",en,[],['https://vhs.at/de/k/280532619'],['https://pbs.twimg.com/media/Es0yOy5XIAIY-Z3.jpg'],0,1,2,"['researcher', 'katharinamader', 'econtwitter', 'corona']",[],https://twitter.com/HeterodoxEconWU/status/1354795130218283008,False,,1,https://pbs.twimg.com/media/Es0yOy5XIAIY-Z3.jpg,,,,,,,[],,,,
1354788819996958723,1354788819996958723,2021-01-28 13:50:00 UTC,2021-01-28,13:50:00,+0000,3433119875,pjakiela,Pamela Jakiela,,"OK #EconTwitter, what are your favorite metrics/stats/data science/visualization textbooks with a female and/or URM author? I already know about (and love) the example below.  https://t.co/FuoHuBjRvL",en,[],[],['https://pbs.twimg.com/media/Es0tQG_W4AMnxZh.jpg'],7,11,37,['econtwitter'],[],https://twitter.com/PJakiela/status/1354788819996958723,False,,1,https://pbs.twimg.com/media/Es0tQG_W4AMnxZh.jpg,,,,,,,[],,,,
1354788165614260225,1354788165614260225,2021-01-28 13:47:24 UTC,2021-01-28,13:47:24,+0000,1172574579581181958,policycornell,Cornell Policy Analysis and Management,,We're excited to announce our spring seminar schedule! Email nmk64@cornell.edu for complete details. #policy #AcademicTwitter #EconTwitter  https://t.co/m4uHdew2Ef,en,[],[],['https://pbs.twimg.com/media/Es0qmJkXAAYYz1h.png'],1,1,12,"['policy', 'academictwitter', 'econtwitter']",[],https://twitter.com/PolicyCornell/status/1354788165614260225,False,,1,https://pbs.twimg.com/media/Es0qmJkXAAYYz1h.png,,,,,,,[],,,,
1354779272368578560,1354779272368578560,2021-01-28 13:12:03 UTC,2021-01-28,13:12:03,+0000,1263770279945424897,vmdseminar,Virtual Market Design Seminar,,"Next Monday we are pleased to welcome @fkojima79 (@UTokyoMD). He will present ""Weak Monotone Comparative Statics"" with Yeon-Koo Che and Jinwoo Kim.   Discussant: Chris Shannon (@berkeleyecon).  #EconTwitter @WiSoUniCologne @ZEW @AssasParis2 @AfseContact @ECON_tribute @EPoS224",en,"[{'screen_name': 'fkojima79', 'name': 'fuhito kojima', 'id': '197936466'}, {'screen_name': 'utokyomd', 'name': '東京大学マーケットデザインセンター(utmd)', 'id': '1310259313567358976'}, {'screen_name': 'berkeleyecon', 'name': 'berkeley economics', 'id': '3760705339'}, {'screen_name': 'wisounicologne', 'name': 'wisofakultät_uniköln', 'id': '1545160885'}, {'screen_name': 'zew', 'name': 'zew', 'id': '48392431'}, {'screen_name': 'assasparis2', 'name': 'univ panthéon-assas', 'id': '303849254'}, {'screen_name': 'afsecontact', 'name': 'afse', 'id': '2830293424'}, {'screen_name': 'econ_tribute', 'name': 'econtribute', 'id': '1110521407346216961'}, {'screen_name': 'epos224', 'name': 'crc tr 224 epos bonn-mannheim', 'id': '1222873544113229825'}]",[],[],1,7,14,['econtwitter'],[],https://twitter.com/VMDSeminar/status/1354779272368578560,False,,0,,,,,,,,[],,,,
1354777321950076933,1354777321950076933,2021-01-28 13:04:18 UTC,2021-01-28,13:04:18,+0000,3866598805,jpal_sa,J-PAL South Asia,,NOW HIRING: RESEARCH ASSOCIATE for the Emissions Trading Scheme project in Surat. Work with leading PIs &amp; and Pollution control board(s) to undertake cutting-edge research in environment &amp; climate change. @EPIC_India @anantsudarshan @econ_ra #econtwitter  https://t.co/pPuiNhL9T5,en,"[{'screen_name': 'epic_india', 'name': 'uchicago epic india', 'id': '4121338227'}, {'screen_name': 'anantsudarshan', 'name': 'anant sudarshan', 'id': '82431989'}, {'screen_name': 'econ_ra', 'name': 'econ ra listings', 'id': '1042199173527941121'}]",['https://www.povertyactionlab.org/careers/research-associate-emissions-trading-scheme-j-pal-south-asia-103544'],[],0,7,13,['econtwitter'],[],https://twitter.com/JPAL_SA/status/1354777321950076933,False,,0,,,,,,,,[],,,,
1354764662596841474,1354764662596841474,2021-01-28 12:14:00 UTC,2021-01-28,12:14:00,+0000,856779584876027904,m_silliman,mikko silliman,,"#EconTwitter - favorite examples of mediation in applied papers?   looking for ideas to apply to my own work. as of now, i've gotten familiar with Imai, Keele, and Tingley (2010); Heckman, Savalyev &amp; Pinto (2013); Angrist, Autor, &amp; Pallais (2020). others?",en,[],[],[],0,2,4,['econtwitter'],[],https://twitter.com/m_silliman/status/1354764662596841474,False,,0,,,,,,,,[],,,,
1354760265460539394,1354760265460539394,2021-01-28 11:56:32 UTC,2021-01-28,11:56:32,+0000,909883382,mikybartoli,Carlo Reggiani,,"Hi #EconTwitter,  Only a few days left to freely download the paper “Online platform price parity clauses: Evidence from the EU  https://t.co/pwOnJz7Ib6 case”, by @andre171176 , @claudiopiga and myself.   https://t.co/93MPPfqtbD  I take the chance for a (long) thread.  (1/n)",en,"[{'screen_name': 'andre171176', 'name': 'andrea mantovani', 'id': '1080885674402816000'}, {'screen_name': 'claudiopiga', 'name': 'claudio a.g. piga', 'id': '27206066'}]","['http://Booking.com', 'https://www.sciencedirect.com/science/article/pii/S0014292120302555?dgcid=author']",[],1,5,14,['econtwitter'],[],https://twitter.com/mikybartoli/status/1354760265460539394,False,,0,,,,,,,,[],,,,
1354759971846709248,1354759971846709248,2021-01-28 11:55:22 UTC,2021-01-28,11:55:22,+0000,1171918842,novafrica,NOVAFRICA,,"The paper “Can Technology Improve the Classroom Experience in Primary Education? An African Experiment on a Worldwide Program” has been added to the @novafrica Working Paper Series. By @JoanaCardim, @teremolin and @pedrocvicente.  Read here:  https://t.co/ZDA9lCeJzZ #EconTwitter  https://t.co/bGdMzcahYC",en,"[{'screen_name': 'novafrica', 'name': 'novafrica', 'id': '1171918842'}, {'screen_name': 'joanacardim', 'name': 'joana cardim', 'id': '3071993632'}, {'screen_name': 'teremolin', 'name': 'teresa molina-millán', 'id': '978351818'}, {'screen_name': 'pedrocvicente', 'name': 'pedro vicente', 'id': '41436880'}]",['http://bit.ly/2Y77eGR'],['https://pbs.twimg.com/media/Es0S65tXYAA427K.png'],0,9,18,['econtwitter'],[],https://twitter.com/novafrica/status/1354759971846709248,False,,1,https://pbs.twimg.com/media/Es0S65tXYAA427K.png,,,,,,,[],,,,
1354740554446192642,1354740554446192642,2021-01-28 10:38:12 UTC,2021-01-28,10:38:12,+0000,63073975,madversity,Madhavan Narayanan,,#EconTwitter,und,[],[],[],0,1,4,['econtwitter'],[],https://twitter.com/madversity/status/1354740554446192642,False,https://twitter.com/madversity/status/1354738229900021768,0,,,,,,,,[],,,,
1354733277366554624,1354733277366554624,2021-01-28 10:09:17 UTC,2021-01-28,10:09:17,+0000,1199154507223093249,abhiroopmukho,Abhiroop Mukhopadhyay,,Cngts also to Dr. @Priyankonomist who also received her doctoral degree. She has an even longer connection with #EconISIDelhi as she was a Masters student at our inst. Nice to see how she has blossomed into a good researcher. #EconTwitter @Debasis37144717 @MoniBishnu  https://t.co/Y4eOxtYiuq,en,"[{'screen_name': 'priyankonomist', 'name': 'priyanka kothari', 'id': '2179439570'}, {'screen_name': 'debasis37144717', 'name': 'debasis mishra', 'id': '1284673541355433987'}, {'screen_name': 'monibishnu', 'name': 'monisankar bishnu', 'id': '1321108060216016902'}]",[],['https://pbs.twimg.com/media/Esz6pJHU4AA79zk.jpg'],5,2,33,"['econisidelhi', 'econtwitter']",[],https://twitter.com/AbhiroopMukho/status/1354733277366554624,False,,1,https://pbs.twimg.com/media/Esz6pJHU4AA79zk.jpg,,,,,,,[],,,,
1354732468256047104,1354732468256047104,2021-01-28 10:06:04 UTC,2021-01-28,10:06:04,+0000,369593887,alessia_metrics,Alessia Paccagnini 👩‍🏫📚💶📈💻🍕⚽🐱🐶🎥 🎶🌍,,What happens when you share your knowledge!  #EconTwitter #Econometrics,en,[],[],[],0,1,3,"['econtwitter', 'econometrics']",[],https://twitter.com/Alessia_metrics/status/1354732468256047104,False,https://twitter.com/AmbrogioCB/status/1354569808105365508,0,,,,,,,,[],,,,
1354727244997021696,1354727244997021696,2021-01-28 09:45:19 UTC,2021-01-28,09:45:19,+0000,1286331716861296648,maurer_se,Stephan Maurer,,Glad to see the @unikonstanz #econtwitter representation going up!,en,"[{'screen_name': 'unikonstanz', 'name': 'universität konstanz', 'id': '160286320'}]",[],[],0,1,4,['econtwitter'],[],https://twitter.com/maurer_se/status/1354727244997021696,False,https://twitter.com/KaasLeo/status/1354726045849710592,0,,,,,,,,[],,,,
1354726045849710592,1354726045849710592,2021-01-28 09:40:33 UTC,2021-01-28,09:40:33,+0000,1184590104121303043,kaasleo,Leo Kaas,,"Welcome, @SebastianFind on Twitter! #EconTwitter",en,"[{'screen_name': 'sebastianfind', 'name': 'sebastian findeisen', 'id': '1354555348372303875'}]",[],[],0,4,14,['econtwitter'],[],https://twitter.com/KaasLeo/status/1354726045849710592,False,,0,,,,,,,,[],,,,
1354716343333920768,1354716343333920768,2021-01-28 09:02:00 UTC,2021-01-28,09:02:00,+0000,175018039,ukstatsauth,UK Statistics Authority,,"There are some really interesting #economics opportunities at @ONS at the moment, including the Renaissance Prize for undergraduates  https://t.co/SzqLp0JuE4 and a Research Funding Grant for scholars and academics.  https://t.co/zVN1Nj1z3s #EconTwitter  https://t.co/1uSK6Pli0E",en,"[{'screen_name': 'ons', 'name': 'office for national statistics (ons)', 'id': '219275799'}]","['https://bit.ly/39ZySLD', 'https://bit.ly/3cagcLK']",['https://pbs.twimg.com/media/EslziABW4AI0u_t.jpg'],0,2,3,"['economics', 'econtwitter']",[],https://twitter.com/UKStatsAuth/status/1354716343333920768,False,,1,https://pbs.twimg.com/media/EslziABW4AI0u_t.jpg,,,,,,,[],,,,
1354715231302414338,1354715231302414338,2021-01-28 08:57:35 UTC,2021-01-28,08:57:35,+0000,1354357328905175042,politoekonomie,AK Politische Ökonomie,,"Zur Abschlussdiskussion unserer Lektüre war gestern Abend der Autor @MauriceHoefgen bei uns zu Gast. Die hochschulinterne Veranstaltung ist auf breites Interesse gestoßen. Der Grundstein ist gelegt, um mit neuem Möglichkeitssinn die Erkenntnisse weiterzudenken. #mmt #econtwitter  https://t.co/3xacGUS8ki",de,"[{'screen_name': 'mauricehoefgen', 'name': 'maurice höfgen', 'id': '1046402409323532288'}]",[],['https://pbs.twimg.com/media/EszkW7PXIAI_PiB.jpg'],1,4,11,"['mmt', 'econtwitter']",[],https://twitter.com/politoekonomie/status/1354715231302414338,False,,1,https://pbs.twimg.com/media/EszkW7PXIAI_PiB.jpg,,,,,,,[],,,,
1354714106742378498,1354714106742378498,2021-01-28 08:53:07 UTC,2021-01-28,08:53:07,+0000,933319481002164224,jku_econ,JKU Economics Department,,"#seminar:  Wed, 3rd Feb, 2021, 4pm CET, all welcome  CarlyWill Sloan, @cwill_tweet (@CGUnews)  ""#RacialBias by Prosecutors: Evidence from Random Assignment""  Register at  https://t.co/2r9Wd3Uo8E #EconTwitter  https://t.co/LqwFFSpQsw",en,"[{'screen_name': 'cwill_tweet', 'name': 'carlywill sloan', 'id': '953630049839796224'}, {'screen_name': 'cgunews', 'name': 'cgu', 'id': '19669549'}]",['https://www.jku.at/en/department-of-economics/research/research-events/online-research-seminar/'],['https://pbs.twimg.com/media/EszpBevXUAcHeov.jpg'],0,2,6,"['seminar', 'racialbias', 'econtwitter']",[],https://twitter.com/jku_econ/status/1354714106742378498,False,,1,https://pbs.twimg.com/media/EszpBevXUAcHeov.jpg,,,,,,,[],,,,
1354711026189664256,1354711026189664256,2021-01-28 08:40:52 UTC,2021-01-28,08:40:52,+0000,1352203116624695296,nocetnhh,NoCeT,,Maximilian Todtenhaupt's paper “International Taxation and Productivity Effects of M&amp;As” has just been accepted in the Journal of International Economics. @JIntlEcon #EconTwitter    https://t.co/iZXTuWcqQc,en,"[{'screen_name': 'jintlecon', 'name': 'journal of international economics', 'id': '1175906410154078210'}]",['https://papers.ssrn.com/sol3/papers.cfm?abstract_id=2929291'],[],0,1,2,['econtwitter'],[],https://twitter.com/NoCeTNHH/status/1354711026189664256,False,,0,,,,,,,,[],,,,
1354709919879090177,1354709919879090177,2021-01-28 08:36:28 UTC,2021-01-28,08:36:28,+0000,3845930572,sheheryarbanuri,Sheheryar Banuri,,Econs: I don't want to be a participant in your study  Also Econs: Why didn't you run a treatment with anal swabs but without telling the participants? Surely informing them would have changed their behavior  Pick a lane you guys..  #EconTwitter #AcademicChatter #AcademicTwitter,en,[],[],[],0,2,11,"['econtwitter', 'academicchatter', 'academictwitter']",[],https://twitter.com/Sheheryarbanuri/status/1354709919879090177,False,https://twitter.com/c_a_gravert/status/1354378799534796810,0,,,,,,,,[],,,,
1354700741319880704,1354700741319880704,2021-01-28 08:00:00 UTC,2021-01-28,08:00:00,+0000,481338876,ubeconomics,UB School of Economics,,"Today's #Webinar: 'Celestial Enlightenment: Eclipses, Curiosity and Economic Development Among Pre-Modern Ethnic Groups'  🎙️Eric Roca Fernandez (@UCLouvain_be) ⏰12:15 (CET) 📍Online. More information:  https://t.co/MertCpQhJJ 🗃️Recruitment seminar  #EconTwitter",en,"[{'screen_name': 'uclouvain_be', 'name': 'uclouvain', 'id': '2319105122'}]",['https://bit.ly/3qOq3uZ'],[],0,1,2,"['webinar', 'econtwitter']",[],https://twitter.com/ubeconomics/status/1354700741319880704,False,,0,,,,,,,,[],,,,
