id,conversation_id,created_at,date,time,timezone,user_id,username,name,place,tweet,language,mentions,urls,photos,replies_count,retweets_count,likes_count,hashtags,cashtags,link,retweet,quote_url,video,thumbnail,near,geo,source,user_rt_id,user_rt,retweet_id,reply_to,retweet_date,translate,trans_src,trans_dest
1356592473473232897,1356586155807014915,2021-02-02 13:17:04 UTC,2021-02-02,13:17:04,+0000,1025538004167864321,itsafronomics,Anna Gifty says #BlackWomenBest,,"So what to do?   Right now #econtwitter has turned its attention to pre-doctoral programs to help ""bridge the gap"" and ""increase diversity"", but as @DomRussel @paulineyliang @zongyhuang point out below, predocs just select on non-Black privileged people:    https://t.co/EJsO6bycIq",en,"[{'screen_name': 'domrussel', 'name': 'dominic russel', 'id': '814181168'}, {'screen_name': 'paulineyliang', 'name': 'pauline liang', 'id': '923983117'}, {'screen_name': 'zongyhuang', 'name': 'zong huang', 'id': '1211533849835925504'}]",['https://www.economist.com/finance-and-economics/2020/08/08/what-it-takes-to-become-an-academic-economist-is-changing'],[],1,8,18,['econtwitter'],[],https://twitter.com/itsafronomics/status/1356592473473232897,False,,0,,,,,,,,[],,,,
1356592003295961091,1356592003295961091,2021-02-02 13:15:12 UTC,2021-02-02,13:15:12,+0000,3087070036,oxrepjournal,Oxford Econ Policy,,"What primarily drives the gender pay gap among parents?  Monica Costa Dias, Robert Joyce, and Francesca Parodi investigate in our new Gender Economics issue:   https://t.co/3EFjfm3QBM #EconTwitter  https://t.co/7e4GSAPDGF",en,[],['https://academic.oup.com/oxrep/article/36/4/855/6124298'],['https://pbs.twimg.com/media/EtOVPNhXcAQmIXe.png'],0,3,4,['econtwitter'],[],https://twitter.com/OxrepJournal/status/1356592003295961091,False,,1,https://pbs.twimg.com/media/EtOVPNhXcAQmIXe.png,,,,,,,[],,,,
1356584366105886725,1356584366105886725,2021-02-02 12:44:51 UTC,2021-02-02,12:44:51,+0000,828700391088996355,pinnaclereports,Pinnacle Report,,Academic &amp; Non-academic Recruitment at the Tertiary Educational Institution    https://t.co/JjLZqxFRIa via @Pinnaclereports @Recruitmenttabl #BahriaUniversity #AcademicTwitter #EconTwitter #employment #education #aktuOnlineExam #BahriansWantOnlineExams #exams2021,en,"[{'screen_name': 'pinnaclereports', 'name': 'pinnacle report', 'id': '828700391088996355'}, {'screen_name': 'recruitmenttabl', 'name': 'recruitment table', 'id': '272643611'}]",['https://www.pinnaclereport.com.ng/academic-non-academic-recruitment-at-the-tertiary-educational-institution/'],[],0,1,2,"['bahriauniversity', 'academictwitter', 'econtwitter', 'employment', 'education', 'aktuonlineexam', 'bahrianswantonlineexams', 'exams2021']",[],https://twitter.com/Pinnaclereports/status/1356584366105886725,False,,0,,,,,,,,[],,,,
1356583744380014598,1356583744380014598,2021-02-02 12:42:23 UTC,2021-02-02,12:42:23,+0000,181707855,ahlfeldt,Gabriel M Ahlfeldt,,"Just had the pleasure of chairing a great session on environmental and social sustainability in housing with leading stakeholders from German policy, practice, and academia @katjakipping  #Schellnhuber @Rolf_Buch   @LSEGeography  https://t.co/yl0gffWcYw @FacebookWatch #EconTwitter",en,"[{'screen_name': 'katjakipping', 'name': 'katja kipping', 'id': '28066013'}, {'screen_name': 'rolf_buch', 'name': 'rolf buch', 'id': '1128293617427197952'}, {'screen_name': 'lsegeography', 'name': 'lse geography & environment', 'id': '240262055'}, {'screen_name': 'facebookwatch', 'name': 'facebookwatch', 'id': '899733078641225728'}]",['https://fb.watch/3p0bE_4Rq7/'],[],0,3,6,"['schellnhuber', 'econtwitter']",[],https://twitter.com/Ahlfeldt/status/1356583744380014598,False,,0,,,,,,,,[],,,,
1356579489002754049,1356579489002754049,2021-02-02 12:25:28 UTC,2021-02-02,12:25:28,+0000,1171918842,novafrica,NOVAFRICA,,Mentoring Success of Immigrant College Students.  The new @novafrica project performs a randomized impact evaluation of a program to promote the integration and academic performance of Cape Verdean college students in Portugal.  https://t.co/2B9Edo0POB @NovaSBE #EconTwitter  https://t.co/3HVNwFzCy1,en,"[{'screen_name': 'novafrica', 'name': 'novafrica', 'id': '1171918842'}, {'screen_name': 'novasbe', 'name': 'novasbe', 'id': '730422764'}]",['http://bit.ly/3clLAXO'],['https://pbs.twimg.com/media/EtOI0A0XcAE1D4O.jpg'],0,4,22,['econtwitter'],[],https://twitter.com/novafrica/status/1356579489002754049,False,,1,https://pbs.twimg.com/media/EtOI0A0XcAE1D4O.jpg,,,,,,,[],,,,
1356577488915333123,1356577488915333123,2021-02-02 12:17:32 UTC,2021-02-02,12:17:32,+0000,787025129729646592,gorilainvest,Gorila,,"Produção industrial sobe 0,9% em dezembro, acima das expectativas, fechando 2020 em queda de 4,5%.  #EconTwitter #Industry #economics",pt,[],[],[],0,2,4,"['econtwitter', 'industry', 'economics']",[],https://twitter.com/gorilainvest/status/1356577488915333123,False,,0,,,,,,,,[],,,,
1356575196359102464,1356575196359102464,2021-02-02 12:08:25 UTC,2021-02-02,12:08:25,+0000,1263770279945424897,vmdseminar,Virtual Market Design Seminar,,"If you missed it yesterday, you can (re)watch the great talk of @fkojima79 (@UTokyoMD) on our Youtube account:  https://t.co/eSVST8yX6C  Thank you Fuhito!  #EconTwitter @WiSoUniCologne @ZEW @AfseContact @ECON_tribute @EPoS224 @AssasParis2",en,"[{'screen_name': 'fkojima79', 'name': 'fuhito kojima', 'id': '197936466'}, {'screen_name': 'utokyomd', 'name': '東京大学マーケットデザインセンター(utmd)', 'id': '1310259313567358976'}, {'screen_name': 'wisounicologne', 'name': 'wisofakultät_uniköln', 'id': '1545160885'}, {'screen_name': 'zew', 'name': 'zew', 'id': '48392431'}, {'screen_name': 'afsecontact', 'name': 'afse', 'id': '2830293424'}, {'screen_name': 'econ_tribute', 'name': 'econtribute', 'id': '1110521407346216961'}, {'screen_name': 'epos224', 'name': 'crc tr 224 epos bonn-mannheim', 'id': '1222873544113229825'}, {'screen_name': 'assasparis2', 'name': 'univ panthéon-assas', 'id': '303849254'}]",['https://www.youtube.com/watch?v=BStPgWQoQv4'],[],0,8,27,['econtwitter'],[],https://twitter.com/VMDSeminar/status/1356575196359102464,False,,0,,,,,,,,[],,,,
1356567774294921216,1356567774294921216,2021-02-02 11:38:55 UTC,2021-02-02,11:38:55,+0000,2299933973,roberto__iacono,Roberto Iacono,,"Agree. @BSmedsvik &amp; I are studying 2nd gen vs 1st gen in the🇳🇴lab market, w/ focus on unemp. insurance &amp; soc. assistance👇  Bottom line: across income dist (x-axis), 2nd gen receive *less* than 1st gen but still considerably *more* subsidies wrt natives   #soctwitter #EconTwitter  https://t.co/Y9T17n6koS",en,"[{'screen_name': 'bsmedsvik', 'name': 'bård smedsvik', 'id': '1353995379902214144'}]",[],['https://pbs.twimg.com/media/EtN8slHXUAImQZM.jpg'],0,1,6,"['soctwitter', 'econtwitter']",[],https://twitter.com/Roberto__Iacono/status/1356567774294921216,False,https://twitter.com/GretaMorando/status/1356561957256593418,1,https://pbs.twimg.com/media/EtN8slHXUAImQZM.jpg,,,,,,,[],,,,
1356557980322381825,1356557980322381825,2021-02-02 11:00:00 UTC,2021-02-02,11:00:00,+0000,481338876,ubeconomics,UB School of Economics,,"🗞️Now you can read the post from our #JobMarket candidate @alessio_romarri ""Do far-right mayors increase the probability of hate-crimes? Evidence from Italy"", awarded with the prize for #JobMarketPaper in #Economics by @nadaesgratis  #EconTwitter #Italy #HateCrime",en,"[{'screen_name': 'alessio_romarri', 'name': 'alessio romarri', 'id': '969436710877716480'}, {'screen_name': 'nadaesgratis', 'name': 'nada es gratis', 'id': '117720701'}]",[],[],0,1,10,"['jobmarket', 'jobmarketpaper', 'economics', 'econtwitter', 'italy', 'hatecrime']",[],https://twitter.com/ubeconomics/status/1356557980322381825,False,https://twitter.com/nadaesgratis/status/1356482691512881158,0,,,,,,,,[],,,,
1356552649278164994,1356552649278164994,2021-02-02 10:38:49 UTC,2021-02-02,10:38:49,+0000,969436710877716480,alessio_romarri,Alessio Romarri,,"Spanish media coverage of my JMP! Once again, muchas gracias @nadaesgratis for this award. Extremely proud that two other (amazing) researchers part of @ubeconomics &amp; @FundacioIEB were specially mentioned for this prize @romar505 @TchKinga #EconTwitter #econjobmarket",en,"[{'screen_name': 'nadaesgratis', 'name': 'nada es gratis', 'id': '117720701'}, {'screen_name': 'ubeconomics', 'name': 'ub school of economics', 'id': '481338876'}, {'screen_name': 'fundacioieb', 'name': 'ieb', 'id': '229793087'}, {'screen_name': 'romar505', 'name': 'rodrigo martínez', 'id': '125195910'}, {'screen_name': 'tchkinga', 'name': 'kinga barbara tchórzewska', 'id': '1100842290048835584'}]",[],[],0,5,52,"['econtwitter', 'econjobmarket']",[],https://twitter.com/alessio_romarri/status/1356552649278164994,False,https://twitter.com/nadaesgratis/status/1356515487010725890,0,,,,,,,,[],,,,
1356550258449412097,1356550258449412097,2021-02-02 10:29:19 UTC,2021-02-02,10:29:19,+0000,976436958363873280,fialalenka,Lenka Fiala,,"I am super excited to join @NovaSBE as an assistant professor this Fall. Deepest thanks to my letter writers John, Charles, Jan, and Eric, all my colleagues and friends for their support.  #EconJobMarket #EconTwitter #phdchat",en,"[{'screen_name': 'novasbe', 'name': 'novasbe', 'id': '730422764'}]",[],[],29,3,217,"['econjobmarket', 'econtwitter', 'phdchat']",[],https://twitter.com/FialaLenka/status/1356550258449412097,False,,0,,,,,,,,[],,,,
1356543503367622659,1356543503367622659,2021-02-02 10:02:29 UTC,2021-02-02,10:02:29,+0000,1292848702785191937,hwueconomics,"Economics @ Edinburgh Business School, Heriot-Watt",,Join us on Thursday! At 16:00 GMT @stef_alba (@PittTweet) will  deliver  the second Wealth of Nations Lecture @AdamSmithHouse. Register here:   https://t.co/rdWmm14r6H  #PanmureHouse #EconTwitter #AdamSmithHouse  https://t.co/MyouJkd6ZR,en,"[{'screen_name': 'stef_alba', 'name': 'stefania albanesi', 'id': '16905031'}, {'screen_name': 'pitttweet', 'name': 'university of pittsburgh', 'id': '68503423'}, {'screen_name': 'adamsmithhouse', 'name': ""adam smith's panmure house"", 'id': '1407354745'}]",['https://zoom.us/webinar/register/WN_v6WhGYw0QoWOJ9FVs2j_yA'],['https://pbs.twimg.com/media/EtNpHAjWQAEDI1O.jpg'],0,4,4,"['panmurehouse', 'econtwitter', 'adamsmithhouse']",[],https://twitter.com/HWUEconomics/status/1356543503367622659,False,,1,https://pbs.twimg.com/media/EtNpHAjWQAEDI1O.jpg,,,,,,,[],,,,
1356539133544574977,1356539133544574977,2021-02-02 09:45:07 UTC,2021-02-02,09:45:07,+0000,2729705377,cepr_org,CEPR,,"Watch the CEPR &amp; @INSEAD webinar with Hanna Halaburda (@NYUStern) &amp; Raphael Auer (@BIS_org &amp; CEPR), presenting on 'Distributed Ledger Technologies and Financial Markets' on our YouTube channel here:  https://t.co/AZRKilCxAZ #EconTwitter  https://t.co/PmVwCCEljk",en,"[{'screen_name': 'insead', 'name': 'insead', 'id': '113381235'}, {'screen_name': 'nyustern', 'name': 'nyu stern', 'id': '158378207'}, {'screen_name': 'bis_org', 'name': 'bank for international settlements', 'id': '158289900'}]",['http://ow.ly/NJjL50DnyG9'],['https://pbs.twimg.com/media/EtNlJziWgAEabGq.jpg'],0,6,17,['econtwitter'],[],https://twitter.com/cepr_org/status/1356539133544574977,False,,1,https://pbs.twimg.com/media/EtNlJziWgAEabGq.jpg,,,,,,,[],,,,
1356538949276164097,1356538949276164097,2021-02-02 09:44:23 UTC,2021-02-02,09:44:23,+0000,968948833186123776,jrgptrs,Jörg Peters,,"Mein Beitrag @FAZ_Wirtschaft zu strukturellen Problemen der empirischen Wirtschaftswissenschaften. Publikationsdruck &amp; wenig Transparenz sind ungesunde Mischung. Lösung: #OpenScience, Replikationen &amp; mehr Bewusstsein für normative Sichtweisen #econtwitter  https://t.co/LkJ38kgkz3  https://t.co/ePs1A34XTa",de,"[{'screen_name': 'faz_wirtschaft', 'name': 'faz wirtschaft', 'id': '24870448'}]",['http://bit.ly/36yxDSS'],['https://pbs.twimg.com/media/EtNfJuuWgAAo-8A.jpg'],2,27,80,"['openscience', 'econtwitter']",[],https://twitter.com/jrgptrs/status/1356538949276164097,False,,1,https://pbs.twimg.com/media/EtNfJuuWgAAo-8A.jpg,,,,,,,[],,,,
1356533286068244480,1356533286068244480,2021-02-02 09:21:53 UTC,2021-02-02,09:21:53,+0000,1278050480002928641,fig_box,figbox.,,"Hi All,   Check out  https://t.co/5EhXxYMmWx it allows you to get ""referee report"" style reviews FOR FREE from scholars who have published where you are planning to submit your WORKING MANUSCRIPT.🥰🥰 #AcademicChatter #AcademicTwitter #phdchat #phdlife #EconTwitter @camwritinghub  https://t.co/kuel58RaNI",en,"[{'screen_name': 'camwritinghub', 'name': 'cambridge writing hub', 'id': '1171830237455441922'}]",['https://figbox.co'],['https://pbs.twimg.com/media/EtNfwCRXUAEIjKX.jpg'],1,2,7,"['academicchatter', 'academictwitter', 'phdchat', 'phdlife', 'econtwitter']",[],https://twitter.com/fig_box/status/1356533286068244480,False,,1,https://pbs.twimg.com/media/EtNfwCRXUAEIjKX.jpg,,,,,,,[],,,,
1356531371343241216,1356531371343241216,2021-02-02 09:14:16 UTC,2021-02-02,09:14:16,+0000,978634325221629952,mmf_research,Money Macro and Finance Society,,From our annual conference. Watch the talk at  https://t.co/XqaoL61nxs #EconTwitter,en,[],['https://www.youtube.com/watch?v=BGlQGUvehxo&t=1582s'],[],0,5,5,['econtwitter'],[],https://twitter.com/MMF_research/status/1356531371343241216,False,https://twitter.com/EconObservatory/status/1356514059672309760,0,,,,,,,,[],,,,
1356524902778613761,1356524902778613761,2021-02-02 08:48:34 UTC,2021-02-02,08:48:34,+0000,3046665274,tcdeconomics,TCD Economics,,"Dept looks forward to welcoming Katheryn Russ of UC Davis today (2nd February) at 4pm, presenting the Paper: Trade Shocks and the Shifting Landscape of U.S. Manufacturing  https://t.co/9teKELoDuL… #EconTwitter  @TRISSTCD  @TCD_SSP",en,"[{'screen_name': 'trisstcd', 'name': 'trinity research in social sciences', 'id': '703202097752203265'}, {'screen_name': 'tcd_ssp', 'name': 'tcd_ssp', 'id': '806444325165006848'}]",['https://tcd.ie/Economics/events/seminars/'],[],1,2,8,['econtwitter'],[],https://twitter.com/tcdeconomics/status/1356524902778613761,False,,0,,,,,,,,[],,,,
1356523664771014659,1356523664771014659,2021-02-02 08:43:39 UTC,2021-02-02,08:43:39,+0000,1638119389,arbiebaguios,Arbie Baguios,,"Apropos of nothing, can someone recommend good in-depth book/video/podcast about (history + politics of) money for non-econ/non-finance folks?  Especially interested in links between central bank and stock market.   #EconTwitter",en,[],[],[],2,1,4,['econtwitter'],[],https://twitter.com/arbiebaguios/status/1356523664771014659,False,,0,,,,,,,,[],,,,
1356523398088818689,1356523398088818689,2021-02-02 08:42:35 UTC,2021-02-02,08:42:35,+0000,3978477436,econmitch,Ian Mitchell,,"David Attenborough on econ in the #DasguptaReview of biodiversity:  ""Economics is a discipline that shapes decisions of the utmost consequence, &amp; so matters to us all.   The Review at last puts biodiversity at its core &amp; provides the compass that we urgently need""  #EconTwitter",en,[],[],[],0,1,3,"['dasguptareview', 'econtwitter']",[],https://twitter.com/EconMitch/status/1356523398088818689,False,,0,,,,,,,,[],,,,
1356520757594116101,1356520757594116101,2021-02-02 08:32:06 UTC,2021-02-02,08:32:06,+0000,1613265398,eaepe,EAEPE,,🛑At EAEPE 2021 we will host a keynote by a winner of the Sveriges Riksbank Prize in Economic Sciences in Memory of Alfred Nobel. Guess his/her name. #Econtwitter  https://t.co/WBdvEhETyO,en,[],['https://www.nobelprize.org/prizes/lists/all-prizes-in-economic-sciences/'],[],0,2,6,['econtwitter'],[],https://twitter.com/eaepe/status/1356520757594116101,False,,0,,,,,,,,[],,,,
1356520231078748162,1356520231078748162,2021-02-02 08:30:00 UTC,2021-02-02,08:30:00,+0000,481338876,ubeconomics,UB School of Economics,,"Today's #Webinar: 'Women, Local Public Finance and Fiscal Adjustment'  🎙️@alecasarico (@Unibocconi) ⏰14:30 (CET) 📍Online. More information:  https://t.co/P3BqzfohG9 🗃️IEB seminar  #EconTwitter",en,"[{'screen_name': 'alecasarico', 'name': 'alessandra casarico', 'id': '1227604438615052288'}, {'screen_name': 'unibocconi', 'name': 'università bocconi', 'id': '342641955'}]",['https://bit.ly/3ammTIm'],[],0,1,2,"['webinar', 'econtwitter']",[],https://twitter.com/ubeconomics/status/1356520231078748162,False,,0,,,,,,,,[],,,,
1356519444055474187,1356519444055474187,2021-02-02 08:26:53 UTC,2021-02-02,08:26:53,+0000,1087407953014149122,econ_ub,Economics UoB,,"One week left!! Deadline is Feb 9. We are seeking to appoint exceptional candidates in any area of economics, especially macro/econometrics. PLEASE retweet/reshare.  . #EconTwitter #VivaEconomics .  https://t.co/MmHl6HYKwV",en,[],['https://www.jobs.ac.uk/job/CDP191/lecturer-senior-lecturer-in-economics-teaching-and-research'],[],0,5,6,"['econtwitter', 'vivaeconomics']",[],https://twitter.com/econ_ub/status/1356519444055474187,False,,0,,,,,,,,[],,,,
1356516481211768832,1356516481211768832,2021-02-02 08:15:06 UTC,2021-02-02,08:15:06,+0000,3087070036,oxrepjournal,Oxford Econ Policy,,"A sizeable gap continues to exist between men's and women's wages.   In our new Gender Economics issue, @AlexanderBryson, Heather Joshi, @MeBozena, and David Wilkinson quantify this gap and make policy suggestions to ameliorate it.  https://t.co/3TtuZUXfjA   #EconTwitter  https://t.co/y9lzPS8x5L",en,"[{'screen_name': 'alexanderbryson', 'name': 'alex bryson', 'id': '293690029'}, {'screen_name': 'mebozena', 'name': 'bożena wielgoszewska', 'id': '3015586396'}]",['https://academic.oup.com/oxrep/article/36/4/836/6124291'],['https://pbs.twimg.com/media/EtNQjQ0WQAIAtZE.png'],1,3,4,['econtwitter'],[],https://twitter.com/OxrepJournal/status/1356516481211768832,False,,1,https://pbs.twimg.com/media/EtNQjQ0WQAIAtZE.png,,,,,,,[],,,,
1356510421923078145,1356510421923078145,2021-02-02 07:51:01 UTC,2021-02-02,07:51:01,+0000,875679268126306305,tbroekel,Tom Broekel,,"Come to #Stavanger, they said. Sea climate ensures that it never gets really cold, they said. You can ride your bike every day, they said. A refreshing -13 degrees this morning casts some icy doubts on these stories. #EconTwitter @POLISS_EU #NordicERSA  https://t.co/DJR4n26Ekd",en,"[{'screen_name': 'poliss_eu', 'name': 'policies for smart specialisation', 'id': '1268157778364895234'}]",[],['https://pbs.twimg.com/media/EtNLCdkWgAAXHGu.jpg'],8,2,64,"['stavanger', 'econtwitter', 'nordicersa']",[],https://twitter.com/TBroekel/status/1356510421923078145,False,,1,https://pbs.twimg.com/media/EtNLCdkWgAAXHGu.jpg,,,,,,,[],,,,
1356501311563436034,1356501311563436034,2021-02-02 07:14:49 UTC,2021-02-02,07:14:49,+0000,48134123,evaeggerphd,eva-maria egger,,#EconTwitter How long (in months) is okay to wait for editorial office to move an accepted paper to publication before sending email to Editor (after silence from editorial office)?,en,[],[],[],0,1,2,['econtwitter'],[],https://twitter.com/EvaEggerPhD/status/1356501311563436034,False,,0,,,,,,,,[],,,,
1356487218441854976,1356487218441854976,2021-02-02 06:18:49 UTC,2021-02-02,06:18:49,+0000,1341008872207618048,empiricalindia,Empirical India Papers,,How do droughts impact household food consumption and nutritional intake? A study of rural India  Fenella Carpena  #EconTwitter #drought #rural #india #development #Econometrics #nutrition #food #econometrics   https://t.co/UBcxs9pS8F,en,[],['https://www.sciencedirect.com/science/article/abs/pii/S0305750X19301573'],[],0,4,5,"['econtwitter', 'drought', 'rural', 'india', 'development', 'econometrics', 'nutrition', 'food', 'econometrics']",[],https://twitter.com/EmpiricalIndia/status/1356487218441854976,False,,0,,,,,,,,[],,,,
1356471023248564225,1356471023248564225,2021-02-02 05:14:28 UTC,2021-02-02,05:14:28,+0000,3795586874,allriseforbacon,Ritabrata Bose,,A Brilliant Way to Search Different Types of Graphs (along with Codes!)   https://t.co/dZWs6KGtR1  - @hanalytx through @instagram  #DataScience #EconTwitter #Coding #RStats #Python #Data #JuliaLang #DataVisualization #DataVisualization #100DaysOfCode #100DaysOfMLCode,en,"[{'screen_name': 'hanalytx', 'name': 'hana (she/her) - blm', 'id': '1232821366140723200'}, {'screen_name': 'instagram', 'name': 'instagram', 'id': '180505807'}]",['https://datavizcatalogue.com/index.html'],[],1,15,8,"['datascience', 'econtwitter', 'coding', 'rstats', 'python', 'data', 'julialang', 'datavisualization', 'datavisualization', '100daysofcode', '100daysofmlcode']",[],https://twitter.com/AllRiseForBacon/status/1356471023248564225,False,,0,,,,,,,,[],,,,
1356431595901698048,1356431595901698048,2021-02-02 02:37:48 UTC,2021-02-02,02:37:48,+0000,35203319,evankirstel,Evan Kirstel,,80% of Americans planning to splurge after getting COVID-19A vaccine  https://t.co/nxvJicRB5i #EconTwitter #economy,en,[],['https://www.wxyz.com/money/consumer/dont-waste-your-money/80-of-americans-planning-to-splurge-after-getting-covid-19a-vaccine'],[],0,2,3,"['econtwitter', 'economy']",[],https://twitter.com/EvanKirstel/status/1356431595901698048,False,,0,,,,,,,,[],,,,
1356416554133577728,1356416554133577728,2021-02-02 01:38:02 UTC,2021-02-02,01:38:02,+0000,1278050480002928641,fig_box,figbox.,,"Hello #AcademicTwitter #AcademicChatter   Senior scholars ""Adopt A Manuscript"" on  https://t.co/5EhXxYMmWx and to all Junior Scholars get reviews from scholars published across 30,800+ academic journals before you submit your working manuscript @itsafronomics #econtwitter #phdchat  https://t.co/fDPPm9CSYV",en,"[{'screen_name': 'itsafronomics', 'name': 'anna gifty says #blackwomenbest', 'id': '1025538004167864321'}]",['https://figbox.co'],[],1,9,7,"['academictwitter', 'academicchatter', 'econtwitter', 'phdchat']",[],https://twitter.com/fig_box/status/1356416554133577728,False,,1,https://pbs.twimg.com/ext_tw_video_thumb/1356416361073901571/pu/img/umzh1D1sLd2WL-48.jpg,,,,,,,[],,,,
1356405840861941762,1356405840861941762,2021-02-02 00:55:27 UTC,2021-02-02,00:55:27,+0000,1348850574670913544,hotnewtrend,Super Intelligence,,When’s a good time to make a note of something?  When you have an “Aha” moment.  These are the most important to remember later.  Recalling them later is empowering.   #business #MarketingTwitter #EconTwitter #startup #AcademicTwitter #AcademicChatter,en,[],[],[],0,4,9,"['business', 'marketingtwitter', 'econtwitter', 'startup', 'academictwitter', 'academicchatter']",[],https://twitter.com/hotnewtrend/status/1356405840861941762,False,,0,,,,,,,,[],,,,
1356396794348007427,1356396794348007427,2021-02-02 00:19:31 UTC,2021-02-02,00:19:31,+0000,958330392775479296,uamsseb,UAM Summer School of Economics and Business,,"#SummerSchool of #EconomicsAndBusiness, from June 28 to July 23, 2021.  #studyeconomics #studybusiness #studyinmadrid #studyabroad #studyinspain #visitspain #visitmadrid #spain #madrid #studyabroad2021 #studyabroadspain #summerschool2021 #shortprogram #EconTwitter  https://t.co/lwQxHjj3j9",en,[],[],[],0,4,7,"['summerschool', 'economicsandbusiness', 'studyeconomics', 'studybusiness', 'studyinmadrid', 'studyabroad', 'studyinspain', 'visitspain', 'visitmadrid', 'spain', 'madrid', 'studyabroad2021', 'studyabroadspain', 'summerschool2021', 'shortprogram', 'econtwitter']",[],https://twitter.com/uamsseb/status/1356396794348007427,False,,1,https://pbs.twimg.com/ext_tw_video_thumb/1356396775091937284/pu/img/f6C3qZofhds8hI4w.jpg,,,,,,,[],,,,
1356394135352172546,1356394135352172546,2021-02-02 00:08:57 UTC,2021-02-02,00:08:57,+0000,17126462,pnikolov,Plamen V Nikolov 🌐,,"Survey of Pre-Doctoral Research Experiences in Economics (by Zong Huang, Pauline Liang, Dominic Russel):    https://t.co/krTE5dJEIv  Slides:  https://t.co/jx1IgJJkWy  #AcademicTwitter #EconTwitter #PreDocs",en,[],"['https://dominic-russel.netlify.app/publication/pre_doc_survey/', 'https://dominic-russel.netlify.app/files/predoc_slides.pdf']",[],0,2,2,"['academictwitter', 'econtwitter', 'predocs']",[],https://twitter.com/pnikolov/status/1356394135352172546,False,,0,,,,,,,,[],,,,
1356391887951646721,1356391887951646721,2021-02-02 00:00:01 UTC,2021-02-02,00:00:01,+0000,1348850574670913544,hotnewtrend,Super Intelligence,,"If you don't know where you are going,  All road will get you there.  It pays to to have a solid plan of attack before making your next move.   In this vein, getting a second opinion can be crucial.  #business #ecommerce #MarketingTwitter #EconTwitter #Amazon #startup",en,[],[],[],0,2,3,"['business', 'ecommerce', 'marketingtwitter', 'econtwitter', 'amazon', 'startup']",[],https://twitter.com/hotnewtrend/status/1356391887951646721,False,,0,,,,,,,,[],,,,
1356391743692763137,1356391743692763137,2021-02-01 23:59:26 UTC,2021-02-01,23:59:26,+0000,1473222548,a_peterman,Amber Peterman,,"#Jobs: Senior researcher &amp; head of office for @IFPRIMalawi - PhD in Econ, Ag Econ or similar &amp; 5+ years work experience in Malawi / region  African economists highly encouraged to apply!  #EconTwitter @AERCAFRICA    https://t.co/3znjgNFbSA",en,"[{'screen_name': 'ifprimalawi', 'name': 'ifpri malawi', 'id': '3826881039'}, {'screen_name': 'aercafrica', 'name': 'african economic research consortium', 'id': '1271477468'}]",['https://phf.tbe.taleo.net/phf04/ats/careers/v2/viewRequisition?org=IFPRI&cws=43&rid=2285'],[],0,11,7,"['jobs', 'econtwitter']",[],https://twitter.com/a_peterman/status/1356391743692763137,False,,0,,,,,,,,[],,,,
